"Location";"Source"
"187173764-2-6480";"Lady Estre was our true Queen! Damn you for killing her!"
"187173764-2-6603";"You walked into the Crypt of Hearts...and survived? I don't believe it!"
"187173764-2-6654";"This one was glad he was not in a hole in the ground called the Tower of Lies. Only in Coldharbour is a hole called a tower."
"187173764-2-6657";"They say Lord Gharesh-ri saved Haven from pirates. But this one knows it was you."
"187173764-2-6924";"You showed those Wood Orcs. It's what they get for betraying the Green Lady."
"187173764-2-6976";"Say, you're the one who exposed that swindler Endarwe, aren't you? Ha! Ayleid warlord my arse."
"187173764-2-7019";"Hail, Champion of the Crucible!"
"187173764-2-7209";"Saw that group that calls itself the Daggers earlier. Never seen people drink so much. Wonder what they're celebrating."
"187173764-2-7211";"You're the one who stopped the Maormer offensive! Divines bless you!"
"187173764-2-7252";"Thank you for saving the Mane at Driladan Pass."
"187173764-2-7253";"I heard that poor Lord Diel met a tragic end in the Shrieking Scar. About time someone took care of that bastard."
"187173764-2-7280";"You saved my life, traveler. I was in Dune the day of the attack. Thank you."
"187173764-2-7400";"I heard that Skorvild baited the giants into attacking Lower Yorgrim."
"187173764-2-7402";"Can you believe there was a spy in the Thalmor at Woodhearth?"
"187173764-2-7424";"It must have been hard for King Jorunn to kill his own brother."
"187173764-2-7431";"When did the skin-stealers take Hrondar? Weeks ago? Months? Years?"
"187173764-2-7434";"Look there! That's the one what bested Captain Blackheart and banished his crew!"
"187173764-2-7524";"Have you heard that King Lalorian has returned? He's going to lead the Fighters Guild now."
"187173764-2-7536";"My hatchling lives because of you. I tell all I see, so your legend will grow in the Hist."
"187173764-2-7557";"You're the one who helped that Dunmer vampire hunter drive the vampires out of Long Haven."
"187173764-2-7626";"Vanus Galerion tried to destroy the Black Forge all by himself. He was captured, but someone rescued him."
"187173764-2-7656";"Someone told me that the Library of Dusk is a trap for smart people. I guess we're safe then."
"187173764-2-7709";"The Thizzrini champion! Here, before me!"
"187173764-2-7710";"You were with the Resistance at Arenthia. Bright moons!"
"187173764-2-7804";"The Veiled Heritance is broken, there is a new Silvenar, and we have you to thank!"
"187173764-2-7876";"I heard you were there when Molag Grunda was defeated. Well done."
"187173764-2-7915";"Moons guide you on path, Hallowed. Guide you in all things."
"187173764-2-7929";"You...you are the Hallowed. You walked the Path with the Mane!"
"187173764-2-8124";"I heard the Great Shackle was destroyed! I hope that means the Planemeld has been stopped."
"187173764-2-8125";"I heard the Great Shackle was destroyed! I hope that means the Planemeld has been stopped."
"187173764-2-8126";"I heard the Great Shackle was destroyed! I hope that means the Planemeld has been stopped."
"187173764-2-8127";"I heard the Great Shackle was destroyed! I hope that means the Planemeld has been stopped."
"187173764-2-8152";"Hah! The Hero of Coldharbour walks among us."
"187173764-2-8178";"Did you really destroy the Daedric portal at Moonhenge all by yourself?"
"187173764-2-8194";"Thanks to you, Vicereeve Pelidil is dead and the Dominion has one enemy fewer."
"187173764-2-8199";"This one knows the truth. The Argonians in the Gray Mire were spies. You did well to send them away."
"187173764-2-8200";"The storyteller at Sarandel's Carnival ... how could he get Bosmer history so wrong?"
"187173764-2-8275";"You are the one who destroyed the Withered Hand! You are a hero!"
"187173764-2-8282";"I had a sister stationed at Grimwatch. Thanks for what you did for them."
"187173764-2-8290";"The Fighters Guild is a nest of snakes. They should have put that Argonian to the sword."
"187173764-2-8649";"There's an Ayleid ruin under the Lorkrata Hills? I never suspected such a thing!"
"187173764-2-8686";"If the Duke were an Orc, he'd have killed himself by now. He brings shame to Evermore."
"187173764-2-8687";"Glad to see the queen finally show her backbone. The duke deserved death for what he did."
"187173764-2-8771";"I heard what you did at the Doomcrag. I don't know if I could have been as half as brave as you, but thanks for what you did."
"187173764-2-8786";"A terrible shame about General Endare. I suppose you had to do what was best."
"187173764-2-8800";"A little bird spoke to me outside the inn. Said the Reachmen's leader was dead. Never had a bird talk to me before."
"187173764-2-8808";"The queen killed the Duke. Strong, decisive. I like that. And she's a widow. Hm...."
"187173764-2-8882";"I heard the battle in the Fevered Mews was touch and go. Glad you won the day."
"187173764-2-8918";"The garrison's safe now, but there'll soon be another fight. Another way to raise our weapons in battle. Mark my words."
"187173764-2-8940";"My family's together for the first time since the Imperials left! Praise the gods, we've survived!"
"187173764-2-8947";"King Camoran Aeradan knows his place. He made no attempt to use the Orrery for himself."
"187173764-2-9040";"This one heard you captured the High Elf ambassador for her crimes in Elden Root. Well done, walker."
"187173764-2-9125";"Lady Lleraya was a vampire? I'm glad you defeated her and saved Northpoint."
"187173764-2-9144";"Other kings step back, but High King Emeric charges ahead! He's lucky someone keeps saving him from disaster."
"187173764-2-9318";"Captain Thayer certainly found a bumper crop of guard recruits at Hoarfrost Downs. I wonder how he did it."
"187173764-2-9319";"Captain Thayer certainly found a bumper crop of guard recruits at Hoarfrost Downs. I wonder how he did it."
"187173764-2-9320";"Captain Thayer certainly found a bumper crop of guard recruits at Hoarfrost Downs. I wonder how he did it."
"187173764-2-9321";"Captain Thayer certainly found a bumper crop of guard recruits at Hoarfrost Downs. I wonder how he did it."
"187173764-2-9349";"Baron Dorell and Countess Tamrith led the assault against Baron Montclair! We never would have taken the Shrouded Pass without their leadership!"
"187173764-2-9363";"Daedric magic at the Edrald estate? I'm just glad you were able to close that portal!"
"187173764-2-9369";"Daedric magic at the Edrald estate? I'm just glad you were able to close that portal!"
"187173764-2-9370";"Daedric magic at the Edrald estate? I'm just glad you were able to close that portal!"
"187173764-2-9371";"Daedric magic at the Edrald estate? I'm just glad you were able to close that portal!"
"187173764-3-769";"Look here. If it isn't King Emeric's own champion. The hero of the Covenant!"
"187173764-3-970";"Knights of the Flame came very near dissolution, were it not for you."
"187173764-3-2114";"The Vanne Family says you saved their farm. Well done."
"187173764-3-2650";"Is it true the Impervious Vault was robbed? I did not deem that possible!"
"187173764-3-2685";"My friend Mordroc told me you saved him from being a monkey. Crazy talk!"
"187173764-3-2726";"The dead had risen at Tu'whacca's throne, but you returned them to their rest. Thank you."
"187173764-3-2764";"To think that necromancer at Tava's Blessing had such dark plans. Thank the gods you stopped him!"
"187173764-3-2989";"The nerve of the Imperials to attack Satakalaam! You gave them what they deserved!"
"187173764-3-3098";"Heard what you did at the at-Tura Estate. Tava bless you."
"187173764-3-3174";"I know you. You exposed the mad constable in Koeglin Village. Ruptga guide you!"
"187173764-3-3190";"I hear you resolved the standoff at Alcaire Castle. I am glad no blood was shed."
"187173764-3-3646";"Those witches helped at the Mill? That really surprises me."
"187173764-3-3648";"I heard that Duke Sebastien was ill, but Gloria Fausta cured him. Royalty have all the luck!"
"187173764-3-3656";"Did you hear what happened in Aldcroft? They killed the Duke."
"187173764-3-3676";"The Hag Fen is a strange place, even with the Wyresses watching over it."
"187173764-3-3692";"Turns out that Duke Sebastien's a werewolf, What a world we live in!"
"187173764-3-3925";"I hear someone helped the Wyrd Sisters save the Wyrd Tree."
"187173764-3-3956";"Glad to hear Camlorn is safe again. I imagine that it will take years to rebuild it, however."
"187173764-3-3968";"I heard you helped the soldiers camped at the Redoubt. Thank you for that."
"187173764-3-4056";"If I'd been in Crosswych, I'd have put my mining pick right into Sternes Gelves back."
"187173764-3-4111";"Tales of Angof's defeat by your hand have begun to spread. You're starting to make quite a name for yourself."
"187173764-3-4476";"Praise Vivec, you were there to stop Alexandra Conele from capturing the coral heart!"
"187173764-3-4481";"Davon's Watch would have been overrun if you hadn't been there."
"187173764-3-4508";"I would have enjoyed tangling with the Orcs at Malak's Maw. They're strong fighters. Almost as strong as Nords."
"187173764-3-4545";"Argonians in Silent Mire had a bit of pirate trouble recently, but I heard some stranger saved them."
"187173764-3-4561";"Good thing you stopped General Serien. Too bad about Tanval's son, though."
"187173764-3-4564";"You fought at Shinji's Scarp, huh? Heard that was quite a battle."
"187173764-3-4567";"Drathus told everyone who would listen how you discovered that spy."
"187173764-3-4595";"The Dark Elves sure like their kwama eggs. I think they taste terrible, but that's just my opinion."
"187173764-3-4600";"Plague in Narsis? Hah! Those Dark Elves wouldn't know a real plague if it crawled out and bit them."
"187173764-3-4642";"Nasty business in Stormhold. You must enjoy having the ear of the vicecanons."
"187173764-3-4652";"Anyone who has House Dres's respect has mine."
"187173764-3-4675";"Don't know why the Ashlanders attacked a holy order, but at least someone stopped them."
"187173764-3-4732";"Are you the one I should thank, for saving my home from Balreth?"
"187173764-3-4951";"The moment the plague disappeared from the Gorge, traders were selling their wares again. Amazing."
"187173764-3-4956";"I wonder what the Dominion thought when they saw you burn their ship."
"187173764-3-5037";"Deepcrag kwama mine had some trouble recently. I always wondered why they call it a mine? They just harvest eggs."
"187173764-3-5060";"The Ordinators seem on edge. What are the Dark Elves so nervous about?"
"187173764-3-5061";"Some of my Dark Elf friends are still upset that Saint Veloth's shrine was attacked. And by one of their own, no less."
"187173764-3-5077";"If you hadn't defeated that nasty little Elf, Vox, I'm sure our great King Jorunn would have taken care of her."
"187173764-3-5096";"I heard there's a crater in the middle of Selfora now and not much else."
"187173764-3-5131";"Is it true Tanval sacrificed himself to seal Sadal away?"
"187173764-3-5269";"Can you believe the Reachmen raised Sinmur's ghost? It's a good thing you were there."
"187173764-3-5359";"You're the hero who made Stral pay for the deaths of Dajaheel and Belron."
"187173764-3-5376";"I'm trying to compose a song about your heroics at Fallowstone Hall."
"187173764-3-5409";"This one is not sure what to think about a Redguard leading the Fighters Guild. Strange times we live in."
"187173764-3-5415";"Heard you wiped out that Goblin tribe in Fungal Grotto. Maybe I can go visit the place now."
"187173764-3-5429";"It's great to hear the Mages Guild have a new refuge for study and contemplation. Scholars should have a safe place to study, don't you think?"
"187173764-3-5483";"I heard that someone overthrew the giant leader in Lower Yorgrim."
"187173764-3-5504";"This one does not know what to think. A Khajiiti woman slain and a Daedra-worshipper advising the Fighters Guild? Strange times we live in."
"187173764-3-5509";"I love mead. I love Voljar mead. Well, really, I love any mead. I'm not that particular."
"187173764-3-5575";"You're the one that saved Jorunn the Skald-King in Windhelm. Hail, hero!"
"187173764-3-5602";"The rumor is that some stranger helped route the Stormfist Brigade from Fort Morvunskar."
"187173764-3-5613";"We Nords will route out that bastard Fildgor. He won't be able to hide in the hills for very long."
"187173764-3-5624";"Good riddance to those mad cultists and their Bad Man tree."
"187173764-3-5644";"This one doesn't grasp the Hound's goals, but thanks you for thwarting them."
"187173764-3-5650";"The Stormfist Brigade made a critical mistake at Cradlecrush. They should have left the mammoths alone."
"187173764-3-5701";"Rilis XII is an embarrassment and an abomination. You did well to destroy him."
"187173764-3-5719";"High-King Jorunn rules unopposed and Fildgor yet lives. The divines truely smile on the sons of Skyrim."
"187173764-3-5720";"I heard there was a fight at the entrance to Sovngarde. I wish I could have seen such a thing!"
"187173764-3-5734";"I'm starting to think the Skald-King is invincible. Not even poison can kill the smug bastard!"
"187173764-3-5736";"I presume it was quick for the Silvernar's advisor, in the end. You have my sympathies."
"187173764-3-5784";"You were at Faldar's Tooth, when Thallik tried to open a portal to Oblivion!"
"187173764-3-5789";"I'm glad you put an end to this Hound business. All Bosmer are in your debt."
"187173764-3-5865";"Maybe Jorunn deserved this fate. Maybe Fildgor was right all along. The Nord people must stand together."
"187173764-3-5935";"You're the favored one, the one Ysgramor appeared to."
"187173764-3-5955";"Good riddance to cowards. Captain Cularalda has no place in the Dominion!"
"187173764-3-6012";"You stood in the ruins of Ezduiin. The halls of the Ancients."
"187173764-3-6027";"Thank you for standing beside the Queen at Tanzelwil, traveler. Stars watch over you."
"187173764-3-6156";"You did us all a favor by saving Wayrest, but what were you doing down in those sewers?"
"187173764-3-6161";"Hail, Geirmund's Guardian!"
"187173764-3-6181";"Firsthold...so much death. I hear the place still smells of fire and death."
"187173764-3-6300";"I've heard tell of your devout work at the holy site of Torinaan. Divines bless you."
"187173764-3-6304";"You saved our high-and-mighty Queen, eh? Pah, Naemon should have had the crown!"
"187173764-3-6379";"Heard you found some witch raising Draugr in the Hall of the Dead. We live in dangerous times."
"187173764-3-6426";"There's the person that uncovered the plot against the King. Hail, hero!"
"187173764-3-6446";"Trusting a bandit? The Lion Guard should be ashamed of itself."
"187173764-3-6447";"You know what happened in Eagle's Brook? That's what happens when you rely on magic."
"187173764-3-6480";"Ayrenn should have been the one put to death at Skywatch. Bah!"
"187173764-3-6603";"Is it true? Did you really explore the Crypt of Hearts?"
"187173764-3-6654";"Bad enough to come to Coldharbour, but to end up in the Tower of Lies, toiling away? Glad some of those people were saved."
"187173764-3-6657";"The Jackdaws should never attacked Haven. They got what they deserved."
"187173764-3-6924";"You saw a spectral wolf that spoke like a man? Takes all kinds, I guess."
"187173764-3-6976";"Is it true you saved those priceless relics from the Worm Cultists in Rulanyil's Fall? What a brave gesture!"
"187173764-3-7019";"Champion of the Blessed Crucible, this one salutes you!"
"187173764-3-7209";"Lord Diel was talking about expanding the docks of Daggerfall to the north. Guess someone took care of those harpies."
"187173764-3-7211";"They say the storms from Tempest Island would've drowned and blasted us all, were it not for your heroics."
"187173764-3-7252";"My sister was among the soldiers you saved at Driladan Pass."
"187173764-3-7253";"So Diel messes with the harpies to try to turn a profit, and they find his body covered in claw marks? I'd call that justice."
"187173764-3-7280";"I can't imagine...all those people killed at Dune. Thank you, traveler."
"187173764-3-7400";"Now that the giant threat is over, I'm going to start trading in Lower Yorgrim again."
"187173764-3-7402";"I understand we've you to thank for uncovering the spy in Woodhearth."
"187173764-3-7424";"Now that Fildgor is gone, perhaps the Stormfist clan will accept with the one true king."
"187173764-3-7431";"I heard Ten-Maur-Wolk was full of Daedra. You're no milk-drinker, that's for sure."
"187173764-3-7434";"Bless my eyes, if it isn't the Scourge of Blackheart!"
"187173764-3-7524";"I heard a rumor that someone braved the Lightless Oubliette and saved the last Ayleid King."
"187173764-3-7536";"May Ruuvitar rot. Do we slaughter Dominion children in their cribs? It is not done!"
"187173764-3-7557";"The moors outside of Long Haven were home to vampires. Can you imagine!"
"187173764-3-7626";"I feel safer knowing that the Black Forge was destroyed."
"187173764-3-7656";"There's the hero who freed the researchers from the Library of Dusk. Well done, friend!"
"187173764-3-7709";"Hah, my brother was at your final match at Thizzrini! Well done!"
"187173764-3-7710";"You helped the Clanmother retake Arenthia! Bright moons and well done!"
"187173764-3-7804";"Valenwood still exists because you defeated the Veiled Heritance. I honor you."
"187173764-3-7876";"Taking the Chasm was necessary, but by the soul of Tu'whacca I would prefer never to have to fight over ground like that again."
"187173764-3-7915";"You are the Hallowed! Bright moons be praised!"
"187173764-3-7929";"The Hallowed that walked the Path. This one is not worthy to stand before you."
"187173764-3-8124";"I was beginning to think this fight was hopeless, but with the Great Shackle destroyed, we might just have a chance here."
"187173764-3-8125";"I was beginning to think this fight was hopeless, but with the Great Shackle destroyed, we might just have a chance here."
"187173764-3-8126";"I was beginning to think this fight was hopeless, but with the Great Shackle destroyed, we might just have a chance here."
"187173764-3-8127";"I was beginning to think this fight was hopeless, but with the Great Shackle destroyed, we might just have a chance here."
"187173764-3-8152";"Is it true that you faced Molag Bal himself? This one shivers just thinking about it."
"187173764-3-8178";"The Daedra opened a portal at Moonhenge, and some hero collapsed it single-handedly."
"187173764-3-8194";"A friend sailed on the Prowler when you defeated Vicereeve Pelidil. The stories he tells!"
"187173764-3-8199";"Argonians, exiled from the Gray Mire. Will the Dominion do so to Khajiit, one day?"
"187173764-3-8200";"I never thought I'd enjoy a stage magician before I went to Sarandel's Carnival."
"187173764-3-8275";"Truly the gods sent you here to save us from the Withered Hand...thank you!"
"187173764-3-8282";"I heard you fought beside the Champions at Grimwatch! By the Green!"
"187173764-3-8290";"This one thinks the Fighters Guild is confused...why let a Daedra-worshipper live? Yes?"
"187173764-3-8649";"Folks are saying that Count Ravenwatch discovered an Ayleid manuscript in the Lorkrata ruins. Good thing you were there to help him!"
"187173764-3-8686";"Blood is thicker than water. The queen's soft-hearted where her family's concerned, even when it's the Duke."
"187173764-3-8687";"I hear the Duke's gone. Good riddance! I never did trust him."
"187173764-3-8771";"We haven't had a real king since Ranser, and he was a little bit crazy. I hope our new ruler isn't quite as warlike as the last one."
"187173764-3-8786";"You kept the Falinesti Faithful safe in Grahtwood. I know a few. Good sorts."
"187173764-3-8800";"The Reachmen are off-guard. Something's gone wrong with their plans, it seems."
"187173764-3-8808";"They say the queen herself killed Duke Renchant. Good for her!"
"187173764-3-8882";"Shornhelm is safe, thanks to you! We'll make sure those Montclairs never come back!"
"187173764-3-8918";"I rejoice to know Bangkorai Garrison is under Covenant control once more."
"187173764-3-8940";"Those bastard Imperials killed my dog, so I took as many of their lives as I could. Now they'll fear the name Hallin's Stand."
"187173764-3-8947";"You aided Queen Ayrenn in her ratification, correct? You do look like someone to know."
"187173764-3-9040";"Will the High Elves build our embassy even uglier than theirs? But no, this one shouldn't complain."
"187173764-3-9125";"The Montclairs have been forced out of Northpoint. Thank you for fighting for us, friend."
"187173764-3-9144";"The Covenant's leader should've been King Fahara'jad. No one would dare attack him as they do King Emeric."
"187173764-3-9318";"Dathieu? The son of King Ranser's traitor general? Do we really want another Dathieu serving in the army?"
"187173764-3-9319";"Dathieu? The son of King Ranser's traitor general? Do we really want another Dathieu serving in the army?"
"187173764-3-9320";"Dathieu? The son of King Ranser's traitor general? Do we really want another Dathieu serving in the army?"
"187173764-3-9321";"Dathieu? The son of King Ranser's traitor general? Do we really want another Dathieu serving in the army?"
"187173764-3-9349";"You there! I saw you fighting at the Shrouded Pass. You were remarkable, if you don't mind me saying."
"187173764-3-9363";"I've heard of cold feet, but why would anyone open an Oblivion portal just to stop a wedding?"
"187173764-3-9369";"I've heard of cold feet, but why would anyone open an Oblivion portal just to stop a wedding?"
"187173764-3-9370";"I've heard of cold feet, but why would anyone open an Oblivion portal just to stop a wedding?"
"187173764-3-9371";"I've heard of cold feet, but why would anyone open an Oblivion portal just to stop a wedding?"
"187173764-4-5409";"A strong Redguard man leading the Fighters Guild! Tall Papa be praised, it is as it should be!"
"187173764-4-5429";"The spirit of Shalidor returned and advising the Mages Guild! The times we live in."
"187173764-4-5504";"I can't believe they're making Guildmaster at-Aswala listen to that Argonian scum. He should have killed her when he had the chance!"
"187173764-4-8290";"Guildmaster at-Aswala truly has the mercy of Tall Papa. He let that Argonian traitor leave the guild with her life!"
"187173764-5-5409";"About time there was a strong Redguard leading the Fighters Guild. He'll keep the outlanders in line!"
"187173764-5-5429";"The return of Arch-Mage Shalidor! Truly a reason for all sons of Skyrim to smile."
"187173764-5-5504";"The new Guildmaster was merciful to let that Argonian traitor stay in the Fighters Guild, don't you think?"
"187173764-5-8290";"That Argonian traitor should have been put to the blade. Guildmaster at-Aswala is kinder than I'd have been!"
