"Location";"Source"
"165399380-0-43432";"I'm glad Vanus made it. I was afraid we lost the old braggart.\n\nVanus and I go way back. I'm not sure we could continue this mission without him."
"165399380-0-43433";"We all knew we'd be fighting for our lives and the lives of the people of Nirn when we agreed to undertake this mission.\n\nI never expected anything different."
"165399380-0-43438";"I will take it from here, my friend. We have many things to do before we can assault the planar vortex.\n\nContinue to build our forces. I promise we won't march against Molag Bal without you."
"165399380-0-43490";"The air is heavy, like velvet in my throat. It is a wonder these blades do not rust before my eyes!"
"165399380-0-43495";"Welcome, friend. We need to discuss the preparations for the coming assault, but I wanted to wait until you arrived.\n\nDo you have any questions before we begin?"
"165399380-0-43496";"With the slightest amount of assistance from the Mages Guild, I have figured out how to cross the Chasm and reach the planar vortex. The effort, however, will require the work of our combined forces.\n\nKing Dynar will explain everything shortly."
"165399380-0-43497";"Look at this place! All fancy and formal. Everyone gathered, putting aside their differences to overcome a greater evil. How heroic! I expect this means that we're all going to die.\n\nHeroically, of course."
"165399380-0-43498";"Vanus has assured me that his plan will work. We just have to put aside our differences and work together."
"165399380-0-43499";"The Mages Guild and Fighters Guild, working together! I never thought I'd see the day!\n\nBut with you helping us, I'm sure that everything with turn out fine."
"165399380-0-43500";"It is time to have our revenge!"
"165399380-0-43502";"Let's make this quick. There're monsters out there that need killing."
"165399380-0-43503";"This is so exciting! My first council meeting! At least, my first that didn't involve Wood Elves and a dark forest."
"165399380-0-43504";"All that work and worry, and here we are, helping the Mages Guild! It's like a dream come true.\n\nI can't wait to delve into a few more of these Coldharbour dungeons!"
"165399380-0-43505";"The probability that any of us will survive this adventure, based on every calculation I could reference, is exceedingly infinitesimal.\n\nCould be worse, I suppose."
"165399380-0-43506";"I represent the people of Haj Uxith. My soldiers are your soldiers, as promised."
"165399380-0-43508";"Molag Bal will shiver in fear at our approach! He will feel the might of me and my sisters!"
"165399380-0-43510";"I'm curious to examine this plan that Vanus has come up with."
"165399380-0-43511";"If this one wasn't shaking in his fur at the thought of facing Molag Bal, I would find this gathering to be extremely fascinating!"
"165399380-0-43512";"Remember our deal. I help you, then you help me.\n\nEverything else is just so much sound and fury."
"165399380-0-43518";"I'm not strong enough. \n\nHe's going to kill the Wilderking."
"165399380-0-43541";"I didn't escape the fields with much, but you're welcome to take a look."
"165399380-0-43547";"Don't bring the war in here with you. I don't want to hear it. I served my time in the Covenant army, and I want nothing more to do with it."
"165399380-0-43551";"As soon as the cart is fixed, I shall return to my mother in Bergama. Crowns I can suffer, but never again do I want to see another beetle! Jahi offered a fat purse if I would stay here as cook, but I would rather sell everything and go."
"165399380-0-43552";"I don't feel safe leaving the house anymore. The war seems to be right outside our doors."
"165399380-0-43554";"Peace be upon you, wayfarer. Do you have a thirst that I can satisfy?"
"165399380-0-43555";"Welcome. Whatever Vlastarus has to offer is yours, for the right price."
"165399380-0-43563";"I'm rather busy right now. Come back later."
"165399380-0-43564";"Do not interrupt me!"
"165399380-0-43565";"<Raynor Vanos doesn't say a word.>"
"165399380-0-43574";"This ram doesn't want to move. The training grounds always get the worst equipment."
"165399380-0-43578";"I'm still a Shadowscale, sight or no sight. I protected <<1>> from the lamias, yes?"
"165399380-0-43591";"Everything is so beautiful here. I never thought I'd see anything like it.\n\nI think my people are starting to understand how important this decision really was. For all of us."
"165399380-0-43592";"Please, take care where you step. Whoever killed this man may have left something behind."
"165399380-0-43593";"Faraniel seems so at peace here in this city.\n\nMaybe she was right all along."
"165399380-0-43596";"We'd just put out for Haven when the storm hit. Our ship foundered on some rocks and we had to swim back to land.\n\nNow we wait for another vessel to hire us on."
"165399380-0-43597";"Fighting an opponent you know nothing about is like going into battle unarmed.\n\nStudy him first—what he wants, how he moves. If you can discover this, he is defeated before blades are drawn, yes?"
"165399380-0-43599";"Hush! This one is busy! Can you not feel the skooma flowing through the streets? If you cannot, listen! It is all around us!"
"165399380-0-43600";"I hope we made the right choice by coming here.\n\nBeing surrounded by all this though - it's so overwhelming."
"165399380-0-43601";"Well, I'll be. Who knew what we were missing out on all this time?"
"165399380-0-43602";"I have not seen this type of greenery before. It's fascinating."
"165399380-0-43615";"If Aranias does not receive help, she will die."
"165399380-0-43621";"I'm scared. Is it okay to be scared?\n\nLook at all of this! I've moved the land on my island… but. Tell me I can do this."
"165399380-0-43622";"There is… an island. There is an island out there. I can feel it reaching. I can almost touch it."
"165399380-0-43624";"We receive strange looks from your people. I expected nothing less. They still think we are monsters.\n\nWe will prove otherwise. We will show them the power of the lamias and how our aid will help win this battle."
"165399380-0-43630";"It isn't every day a bard comes to <<1>>! What better way to set aside our cares than by listening to songs of far off lands?"
"165399380-0-43631";"Isn't <<1>> wonderful? He's been to every port between here and <<2>>!"
"165399380-0-43632";"Anyone can sing. This one is here for news from afar!"
"165399380-0-43633";"<<1>> has come to <<2>>! We'll be drinking rotmeth to a spinner's yarns before the month is out!"
"165399380-0-43647";"Can I help you, or are you just going to stand there and stare?"
"165399380-0-43650";"It is my task to show the Imperial the sights of Alik'r."
"165399380-0-43653";"Leave me alone."
"165399380-0-43657";"This used to be a place of repose, of learning. Now … I don't know.\n\nIf my heart weighs this heavily, it is probably best if I leave this place."
"165399380-0-43669";"Your skill with siege weapons will make a difference in many battles. Learn to use them here."
"165399380-0-43674";"If you remember that gates are a keep's weak points, you know what tool to use to break in."
"165399380-0-43678";"Our caravan was set upon nearby while <<1>> and I were … occupied elsewhere. I suppose we are stuck until another travels through here."
"165399380-0-43685";"You don't plan to patronize this place, do you?\n\nNever mind. Forget I said anything."
"165399380-0-43688";"Walk softly, warrior. You are in the presence of great power."
"165399380-0-43692";"Some of those creatures are still out there, but we'll deal with them now that you've cut off the source."
"165399380-0-43694";"I heard you were the one that came to Longhaven's aid. I thank you, friend."
"165399380-0-43696";"I hope those filthy elves didn't raid my shop."
"165399380-0-43698";"If the beetles rush us, I will give my life to buy a few moments for the others to escape. \n\nMy son died in the fields, and I hold no fear in my heart at the thought that I might join him."
"165399380-0-43706";"Look, Barbas! A surprise mortal.\n\nI hope you aren't here to cause trouble for me."
"165399380-0-43714";"Into the portal, hurry!"
"165399380-0-43719";"Welcome to Willowgrove! Thanks for visiting!\n\nI'm sorry we don't have enough spare honeymead to offer you a sample. We're running a bit low at the moment."
"165399380-0-43720";"Oh! Come to sample our honey-mead?\n\nMy apologies, but we're running a little low at the moment. Hopefully things will be resolved soon and we should be overflowing again."
"165399380-0-43721";"Must a man watch his livelihood slip through his fingers like sand, and his friends take Tu'whacca's guidance to the Far Shores? It is almost more than I can bear."
"165399380-0-43722";"I … ain't got no bah-dee!"
"165399380-0-43740";"Careful, soldier. Siege weapons are dangerous to the unwary."
"165399380-0-43742";"I have played in these fields since I was a child! I will not simply walk away!"
"165399380-0-43744";"How can I help you, soldier?"
"165399380-0-43757";"Hail, warrior. Have you come to gaze upon the Elder Scroll of Alma Ruma?"
"165399380-0-43759";"I must ready these supplies. A thousand apologies."
"165399380-0-43762";"It is beyond my importance to speak with you. Best to seek out Jahi, at the house near the center of the field."
"165399380-0-43763";"I wonder what <<1>> intends for these Dominion fools. If he has any honor it will be nothing pleasant, mark my words!"
"165399380-0-43764";"It will be good to leave this forsaken rock! How do the cat men stand being so still all the time?"
"165399380-0-43765";"Comings and goings, records of supplies, dialogues between the Helmsreeve and the Aldmeri envoys, the paperwork never ends!\n\nA moment's rest! Is that so much to ask?"
"165399380-0-43766";"Had the Dominion simply sailed on by, it wouldn't have come to this. Whatever happens next is on their heads, not ours."
"165399380-0-43772";"This place is like the northern wastes of my homeland. The sky dominates the landscape.\n\nI could sit here and look at it for days."
"165399380-0-43817";"Brewing fermented liquids in this dry climate is much more difficult than working in my beloved swamp. But foul ale is better than no ale at all, I always say."
"165399380-0-43822";"Magic and magical tomes abound in this strange land!"
"165399380-0-43825";"The Fighters Guild is watching the situation here is Deshaan very closely."
"165399380-0-43856";"Even strangers are welcome at our table, though we have little to share."
"165399380-0-43864";"In the days of the Empire, rabble like the Black Daggers were hunted down and left to dangle from trees along the roadside."
"165399380-0-43872";"With the Empire gone, who protects people like us? No one, that's who!"
"165399380-0-43876";"The Dark Lord's vile scheme fails today."
"165399380-0-43879";"Though I live in squalor like the rest, I will not die here with them. Somewhere in Cyrodiil, there is a place unsullied by chaos and war. I will find it!"
"165399380-0-43883";"This one cannot find anything since fleeing the chaos in Hackdirt!"
"165399380-0-43890";"I cannot lose him too. Elethlin is all I have left, but I fear he will leave me soon."
"165399380-0-43891";"Perhaps this place is worthless enough that no one will bother us here. Who knew Hackdirt was of value to any but us?"
"165399380-0-43902";"Let Iirenir rest, please. She hasn't had a good sleep in weeks, not since those damned Black Daggers kicked us out of our home.\n\nI could use some sleep too, but I can't seem to relax."
"165399380-0-43916";"Now that I've got me sea-legs for this deck, so to speak, I think I'll navigate these waters just fine. \n\nMe and my new old friends."
"165399380-0-43918";"The war has been our undoing. You see us at the end of our days, treasures stolen and safety gone."
"165399380-0-43922";"Bird-people, unsavory sellswords, and dung in the streets. This Kozanset is a shaveskin paradise, yes? \n\nHa! Lucky for you, I sell many blades. Have a look."
"165399380-0-43924";"You look like a wise walker to Khunzum—not like these unclawed Redguards. They spit on this Baandari's goods and wares. \n\nBut you know better. You know quality. Only the best from Khunzum."
"165399380-0-43925";"Do you tire of wares that do not meet your impeccable standards? I see the woe on your face—you need not try to hide it. Look, then, at my sweet goods! I have spotless items from all across Tamriel!"
"165399380-0-43926";"I am thinking you need more bags. Easier to hide things, yes?"
"165399380-0-43927";"This one's wagon would not break if we did not stea— … if we did not buy so many heavy things!"
"165399380-0-43930";"Ah. Come in, come in, walker! You have traveled far to see this one, yes? \n\nI know; you seek something lost. Hanubina-ko may help you find it. This one sees through mist and stone to speak with the moons and stars."
"165399380-0-43937";"I don't know who sent you, but the answer is ""no."" I just want to be left alone. Please leave."
"165399380-0-43943";"Soreheels tried to cook the bird people, but their meat tastes dry and sour. The shaveskins do not want to buy it. They make strange faces and run away. Now what is this one to do with it?"
"165399380-0-43944";"Good ale loosens the tongue and also the purse strings, is it not so? \n\nI have some things you might like—old Khajiiti spices. Nothing illegal, mind you. At least it was not illegal when last I was in the khaj. You will take a look, yes?"
"165399380-0-43945";"Between Soreheel's lead bottom and Wheelbreaker's clumsy carpentry, we will never get the wagon out of this stinking village. \n\nI do not wish to stay here. I'm far too young and sleek for such a place."
"165399380-0-43949";"The only way to reach Molag Bal's planar vortex is to take control of the Chasm."
"165399380-0-43959";"Andrathel does a much better job at coating these bowls. I don't know who coated these, but the honey is caramelizing.\n\nWe don't have the spare honey to waste on bad batches of mead."
"165399380-0-43980";"Even the best chef can only do so much with inferior ingredients. But I am grateful for what Desh-Wazei and the other farmers provide. And I do make a delicious casserole surprise!"
"165399380-0-43981";"In my experience, a community's success depends in large part upon the quality of its brewmaster. And make no mistake. I am the best brewmaster you'll find in this Hist-forsaken realm."
"165399380-0-43982";"Visitors to our ancient city are a rare commodity. Almost as rare as some of the wares I sell. Let me show you what I have available this fine day."
"165399380-0-44009";"Icy water is the key to long life. First I work up a sweat, then I jump in the lake."
"165399380-0-44011";"Oljorn is crazy, but it's all I have for entertainment out here."
"165399380-0-44053";"It was truly unwise to let things get so out of hand."
"165399380-0-44065";"May those bastards' evil souls languish here for all eternity!\n\nNow we must only nullify the wrong they did to me in life. If you will take the gemstones back to Darius, he can present them to the authorities and prove my innocence."
"165399380-0-44083";"Never had I thought to hear an apology from such as she. Truly, I too am to blame for being too quick to fight."
"165399380-0-44090";"With you here, maybe I don't need to worry so much about getting my ship back from these cursed Sea Elves."
"165399380-0-44093";"Pelidil will pay for what they did to Asteril. They will all pay."
"165399380-0-44094";"I never thanked you for helping us back in Woodhearth. Asteril was my friend, and because of you we can catch the ones that did this to her."
"165399380-0-44097";"Well met, Queenseye. Grim work to be done here, and we're glad to have you with us."
"165399380-0-44100";"Those bastards. If they hadn't outnumbered me …."
"165399380-0-44101";"<The harpy doesn't seem to be afraid or aggressive.>"
"165399380-0-44115";"Fancy a drink? All the finest libations in Tamriel, here. All the worst, as well."
"165399380-0-44117";"Those Maormer pirates came from the water. They're all over <<1>>!"
"165399380-0-44121";"We can't let those Maormer pirates reach <<1>>. They'll butcher our families!"
"165399380-0-44124";"What are you doing here?\n\nDoesn't matter. If you're in the mood to cave in some Sea Viper skulls, I don't really care."
"165399380-0-44125";"Why, it's you. We do seem to meet in the strangest places."
"165399380-0-44126";"Not one Sea Viper will make it through this door."
"165399380-0-44129";"<This Wood Orc's neck was snapped with incredible force. A blood trail leads off the edge of the cliff, and huge claw marks are gouged in the rock. It appears something tumbled off.>"
"165399380-0-44163";"Let me work on this barrier, you help stop the daedra coming through the portals!"
"165399380-0-44169";"I think our friends have the Chasm well in hand. What say we pop in for a chat with Molag Grunda?"
"165399380-0-44232";"These mages are crazy. Fearless, but crazy. The little wood elf says she can get this barrier down. I'll just make sure no one attacks her in the meantime."
"165399380-0-44256";"Hey.\n\nSquad got separated. <<1>> and I found <<2>>. They hurt him bad."
"165399380-0-44263";"We're not safe. Not yet."
"165399380-0-44267";"<The marine <<1>> is dead.>"
"165399380-0-44268";"A ringing head is bad.\n\nBut when it remains somewhat head-shaped … that is good, yes?"
"165399380-0-44275";"At last, a messenger! Welcome, oh winged deliverer. What does my prince have to say to me, after all these years?"
"165399380-0-44279";"What are you doing here? Get away, this is my place!"
"165399380-0-44280";"Greetings! This magical projection presents my current plan to my allies. Separated and alone, I decided to complete our mission. Personally.\n\nI entered the Black Forge through a side door with the intention of destroying the Great Shackle beyond."
"165399380-0-44286";"Oh, it's just you. What a relief! I hate guard duty. Especially portal guard duty. You never know what's going to pop out and kill you where you stand."
"165399380-0-44308";"My friend! To escape death so triumphantly is constant thrill, yes?\n\nNot so thrilling for the Maormer, of course."
"165399380-0-44313";"Move on, fetcher."
"165399380-0-44319";"You must be here to work with that matchmaker lug. If so, the boss says I can't touch you. \n\nWhich is a shame, because some of that stuff you're wearing looks pricey."
"165399380-0-44321";"""No robbery, extortion, or drunken revelry until after the wedding.""\n\nBloody Wildur and his blasted daughter. What are we supposed to do, eh? Are we the Ungodly, or ain't we? Pooey."
"165399380-0-44322";"Let me be clear: I don't like you, and I don't like your smarmy friend inside the tent. \n\nStay out of my way, lest you want me to show you the color of your guts."
"165399380-0-44344";"Vanus is amazing with his portal placement. Conjuration has never been a strength of mine."
"165399380-0-44378";"My name is Halelah, and I have a gift for you."
"165399380-0-44379";"It's finished. My masterpiece. What do you think? Be honest now."
"165399380-0-44392";"I greet you, walker. Study my wares; there is sure to be something to your liking."
"165399380-0-44393";"Please buy from Airal. He refuses to move until all his wares are sold. This one tires of the cold and his sullen company."
"165399380-0-44410";"Do you honestly believe that this collection of misguided mistfits can actually challenge the Lord of Brutality?\n\nI take it back. You are as stupid as you are brave!"
"165399380-0-44411";"Ah, darling! Perhaps you could say something to your companions? They refuse to let me participate in their little council.\n\nThe Ayleid actually told me to shut up and be quiet! How terribly droll of the man."
"165399380-0-44412";"I wish that Zur were here. He would have been shaking in his fur at the thought of going up against Molag Bal, but he also appreciated a good council meeting."
"165399380-0-44423";"Lord Sanguine has decreed a revel! Talk to Skeewul and join us!"
"165399380-0-44431";"Lord Sanguine provides needed relief in dire times like this. Do you wish to participate? I have a special drink, brewed just for this occasion!"
"165399380-0-44434";"The world is going to Oblivion, so we might as well enjoy life while we can. Talk to Skeewul if you want to join in!"
"165399380-0-44437";"There are no unhappy folk at Lord Sanguine's revels. The war, those alliances, the Empire—none of that matters anymore.\n\nJoin us, talk to Skeewul!"
"165399380-0-44440";"Feel free to look, but don't touch the prisoners. Sylvian wants them alive, for now."
"165399380-0-44460";"My father would be very proud of us, I think. \n\nYou have ensured that the honor of the Ash'abah will abide. I am grateful that I can count you as one of our tribe."
"165399380-0-44463";"To know that young girl masquerading as a scholar's apprentice was actually one of the most dangerous necromancers in the Alik'r Desert …?\n\nI still cannot understand it."
"165399380-0-44464";"I still feel like such a fool. To have shared my knowledge with that evil girl, and the whole time ….\n\nI am very grateful that she is no longer a threat. If things had not turned out this way, I don't know if I could've forgiven myself."
"165399380-0-44465";"Look at you. First you drive the risen dead from the Sentinel docks, and then you drive them from all of Alik'r.\n\nI must confess. I am impressed."
"165399380-0-44467";"When I think back to when this all started, when the Withered Hand had captured me and was holding me beneath the city … I can't believe how far we've come.\n\nIt wasn't easy, but we defeated the Withered Hand. We're heroes now!"
"165399380-0-44478";"This is our spot. You're welcome to sit by the fire for a time, but you'll need to make your own camp, if you're staying."
"165399380-0-44479";"I hope the fish keep biting. We'll be here a while."
"165399380-0-44480";"This camp is primitive, but at least we're alive and out of harm's way, for the time being."
"165399380-0-44481";"I can't believe they dragged me out into the middle of nowhere. It's cold and wet and all my books are ruined!"
"165399380-0-44485";"She killed them all. Froze them solid. How am I supposed to defeat that? I had to run, right? I had to hide or I'd be killed too!"
"165399380-0-44490";"Watch it, stranger. <<1>> put me here to keep an eye on his daughter's dowry."
"165399380-0-44502";"Hold. In the name of the Dominion."
"165399380-0-44532";"The city has been empty for so long. It's good to finally see a new customer in here."
"165399380-0-44533";"Welcome to the Shining Star, my friend! You won't find a more warm and inviting place in all of Coldharbour!"
"165399380-0-44534";"Welcome, friend. I come from a long line of master brewers, and I guarantee that my beverages are the best you'll ever drink in this horrid land."
"165399380-0-44535";"If you're looking for something to eat, just give me a moment. I'm not used to these crowds."
"165399380-0-44536";"I represent the Fighters Guild here in the Hollow City."
"165399380-0-44537";"My job is to establish the Mages Guild hall here in the Hollow City."
"165399380-0-44538";"I'm almost sorry to be stuck inside these walls. I'd love to get out there and get into the thick of the battle!"
"165399380-0-44539";"A secure vault makes for a confident heart."
"165399380-0-44544";"To see everything so alive and full of energy pleases me greatly. It is a stark contrast to the world outside these walls.\n\nIt reminds me of my time in Glenumbra, when things were … better."
"165399380-0-44545";"This city is dreadful. All the bright colors. The blooming flowers and trees. The … life!\n\nMaybe I should go back outside again. I think I prefer Coldharbour's stark landscape to this … wonderland."
"165399380-0-44547";"Finally, I can just relax in a nice, warm room. A glass of fine wine in my hand.\n\nI think I'll draw a nice hot bath to soothe my weary body. I just wish I had a servant or two to deal with these mundane tasks."
"165399380-0-44550";"Hungry? Of course you are. C'mon over and let Firuin take care of you."
"165399380-0-44559";"The wonders of war never cease. Every ram that shatters against a keep door, every trebuchet set afire, it's all coin in my pocket. Hurray for war, I say!"
"165399380-0-44561";"Aetis drives us like he fears the war will end tomorrow. Can't come soon enough for me."
"165399380-0-44563";"Last load of logs broke our wagon wheels. Now Aetis says we have to cut them all in half."
"165399380-0-44572";"Sorry, no time to talk. Vanus is running me ragged."
"165399380-0-44573";"You'll want to talk to Vanus. I'm just his assistant."
"165399380-0-44625";"Valenwood just keeps getting stranger and stranger. I might have to change my route entirely."
"165399380-0-44632";"People call this one a coward for not fighting. Ziss on them. Getting drunk when things turn dangerous takes real courage!"
"165399380-0-44647";"Just policing up the last of these damned Imperials. Most scattered like bloodflies when we threw down our sheathes. Cowards all."
"165399380-0-44664";"These claws are only good for one thing—slashing prices!"
"165399380-0-44681";"My head feels as if a dozen Orcs are pounding on war drums inside my skull."
"165399380-0-44682";"I am proud to lend my magic to such great personages as you and Vanus Galerion."
"165399380-0-44683";"Just give the word and my hammer will be by your side!"
"165399380-0-44711";"Greetings. I guard this Transitus Shrine for the Dominion. Do you have questions for me?"
"165399380-0-44713";"<This Bosmer was tortured to death. There is nothing left to be done.>"
"165399380-0-44736";"I hate this place. I miss the warmth and golden glow of Alik'r."
"165399380-0-44741";"Greetings, soldier."
"165399380-0-44744";"Don't leave me here!"
"165399380-0-44745";"Please … help me!"
"165399380-0-44759";"I came along with the original force. I wanted to show my support for this important effort."
