"Location";"Source"
"165399380-0-31759";"What I wouldn't give to be in a nice warm inn, drinking a pint of ale. Or three."
"165399380-0-31760";"I just need to rest for a bit. I'm sure I'll be all right soon."
"165399380-0-31761";"I'm sure we'll find someplace safe in a few days."
"165399380-0-31763";"To know your weakness is to know your enemy's strength."
"165399380-0-31764";"I'm not arrogant, just better than you."
"165399380-0-31765";"I know, I know. I'm amazing."
"165399380-0-31768";"<This bandit was executed with a single slash to the neck.>"
"165399380-0-31771";"I'm doing what I can, but my family's falling apart."
"165399380-0-31798";"You're the first interesting thing to walk into Narsis in a long time."
"165399380-0-31808";"Unless I killed a friend of yours and yer here to get even, back off. \n\nI'm lookin' for someone and it's not you. It's yer lucky day."
"165399380-0-31810";"The Cultists came out of nowhere. It was chaos. Netapatuu fought back. We all would have died if not for him."
"165399380-0-31812";"We're just researchers. We don't stand a chance. The others are dead, or worse."
"165399380-0-31825";"Not much to do in Ivarstead except drink, fish, hunt, and, well, drink. \n\nI like it here."
"165399380-0-31826";"Welcome to the Horker's Tusk Tavern. Fancy a drink?"
"165399380-0-31931";"Step right up, they have pretty good drink here. You won't find much rat hair in it at least."
"165399380-0-31932";"Haven't seen you here before. Or I don't remember it at least. But welcome to our little tavern. Well, it's not mine, but I kinda feel I belong here, you know what I mean? Well, anyway, hello!"
"165399380-0-31950";"This one will be staying down."
"165399380-0-31952";"Maybe I should go talk to her instead of sending illusions.\n\nNah, that's a horrible idea. I'd probably throw up or something."
"165399380-0-31953";"Isn't this conjuration simply adorable? But when is Drifts going to come over and talk to me?"
"165399380-0-31955";"He insists on sending her small illusions. What a coward.\n\nHe should just go and talk to her!"
"165399380-0-31956";"I'm glad he's going to hurt."
"165399380-0-31958";"I think she's badly hurt."
"165399380-0-31963";"What is it?"
"165399380-0-31968";"I hope our soldiers take the fight all the way to Auridon. I want blood for blood."
"165399380-0-31969";"Look at these magnificent projections. I wonder what they do?\n\nAre they wards? A test of some sort? Maybe mood lighting? I just don't know."
"165399380-0-31970";"I'll never forget him."
"165399380-0-31971";"It's so hard to say goodbye to a friend."
"165399380-0-31972";"I can't believe I lost that fight! I was cheated out of my invitation!\n\nAh, it doesn't matter. My family's gold secured me a new one, and here I am."
"165399380-0-31973";"I need to cast a spell. Conjure a familiar, levitate a groundskeeper, blow something up.\n\nIf instruction doesn't start soon, there's no telling what I might do."
"165399380-0-31974";"I just arrived and I'm already overloaded with work.\n\nConjurations, illusions, healing salves, Pact diplomacy, leadership training. What's next?"
"165399380-0-31975";"My first assignment. Study the flame. Determine what fuels it.\n\nI'm pretty sure the wax and wick fuel it. But it can't be that simple, can it?"
"165399380-0-31976";"My invitation? I don't have it with me. Someone took it, all right?\n\nMy family is dealing with it. Now go bother a Nord, why don't you."
"165399380-0-31978";"What did I drink?"
"165399380-0-31980";"House Hlaalu. That's where I'm going after the Academy certifies me. Merchants need magic, and they pay well.\n\nHey, got any flin?"
"165399380-0-31981";"By Kyne, don't these chattering Dark Elves ever shut up? They're driving me crazy."
"165399380-0-32009";"The Mages Guild will never give up. No werewolf, undead or not, will harm the people of Glenumbra.\n\nWe'll find out how Faolchu fell and we'll put him right back in the grave."
"165399380-0-32010";"We've been at this for weeks.\n\nThe Mages Guild is comprised of the wisest scholars, but even I'm starting to doubt if we can really learn anything here."
"165399380-0-32013";"Is he a friend of yours? This one is doing what she can for him but it is difficult.\n\nAt least he's alive. That makes him lucky compared to the other pilgrims we found in the storm."
"165399380-0-32016";"Never would have thought that I, a mere farmer's son, would one day explore the ruins of the Glenumbra Moors. \n\nI'll never forget this experience."
"165399380-0-32021";"The Mages Guild has never been known as a militaristic force. You tend to find us in ruins, searching for lost knowledge.\n\nBut sometimes even scholars need to take up arms."
"165399380-0-32028";"These lost spirits refuse to rest. They just wander about, lost in the dream of battle.\n\nThe Alessian Order had the wrong intentions, but I wouldn't wish this on my worst enemy."
"165399380-0-32033";"The Alessian army was driven by faith to put a quick end to anyone who didn't share their beliefs.\n\nIf only we'd learn these lessons from the past."
"165399380-0-32034";"The remnants of the last battle of Glenumbra Moors still linger.\n\nThat means there's a connection, something that holds them here. But what?"
"165399380-0-32035";"My brother was almost killed by one of Faolchu's werewolves.\n\nI couldn't bear losing him, and I don't want anyone else to suffer such pain. That's why I'm here. We'll find a way to stop Faolchu."
"165399380-0-32037";"We've been out here digging around for hours, and we haven't found one clue. It's hopeless!"
"165399380-0-32041";"This site was the breaking point of the Battle of Glenumbra Moors.\n\nThe Alessian army made one of their last stands here. The Direnni army was able to defeat Faolchu and prevail. We need to figure out how."
"165399380-0-32059";"Burns. My chest is like fire.\n\nSovngarde take me."
"165399380-0-32060";"I begged him not to go on this pilgrimage, but he wouldn't listen. \n\nIf I lose him, my heart will break."
"165399380-0-32067";"I can't stand to watch him suffer any more. I know he'll soon be lost to me."
"165399380-0-32071";"Y'ffre's bones! A brave adventurer! Please, won't you help me?"
"165399380-0-32075";"Welcome to Ivarstead. Stay out of trouble and we'll both be happier."
"165399380-0-32079";"<This body has been stripped of all possessions.>"
"165399380-0-32080";"Just get me some food in my belly and I'll be back at those stairs.\n\nDamned avalanche didn't kill me. I'm not going to give up now."
"165399380-0-32081";"To save a life is the greatest of pleasures. It is why I choose to heal. \n\nThis one would not have lived without your help. Take pride in that. May you always help the innocent in times of need."
"165399380-0-32082";"If you hadn't shown up, I would have been burying my husband now instead of watching him stuff his face. Thank you!"
"165399380-0-32098";"<This corpse is badly burned. His death was recent, no more than a day ago. A note on the body may explain what happened.>"
"165399380-0-32099";"I've been by the Prince's side since he could hold a sword. And I'll be with him until he puts it down again."
"165399380-0-32114";"You need somethin', friend? Got more than enough to do for two of me, so let me be unless you're looking for work."
"165399380-0-32115";"Somethin' you need, stranger? Go talk to Pa."
"165399380-0-32116";"I don't know you. State your business and don't make me angry."
"165399380-0-32121";"<Malsia holds a broken soul gem in her hand.>"
"165399380-0-32123";"Haven't caught much today."
"165399380-0-32159";"<<<1>> lies dead near the shrine to Mauloch. Blood still oozes from a stab wound in his chest.>"
"165399380-0-32169";"I almost had the bugger, but that right tusk came from nowhere! I'm going to have bruises in the morning, I tell you!"
"165399380-0-32170";"I don't know how the mammoths got out, but they certainly aren't coming back in on their own!"
"165399380-0-32171";"Ugh, my head … it's the only thing that doesn't hurt."
"165399380-0-32172";"I saw what you did up there! You took on the Green Hunters! Are you crazy?"
"165399380-0-32181";"<This man was killed by a massive club. He was stripped of all valuables, including his shirt.>"
"165399380-0-32182";"<This woman was stomped by a massive boot. All valuables have already been looted.>"
"165399380-0-32209";"J'Eeja's wares are yours, friend, for a mere pittance."
"165399380-0-32235";"I think that so-called Witch of the Moors puts on airs."
"165399380-0-32238";"My little Firwin … is that you? I can't see you clearly.\n\nI'm so tired, dear."
"165399380-0-32348";"Arfanel must have sent you. The Queen's Eyes see all, eh?"
"165399380-0-32355";"Oh … another guest. Splendid. Vesta will be so pleased. Have you told her you're here? If not, just run into the house and let her know."
"165399380-0-32356";"Welcome to Narsis, where people vanish in the night and a flesh-rotting plague ravages those unfortunate enough to still be here.\n\nThis must be your lucky day."
"165399380-0-32368";"We can rebuild, with time. I don't think many others share that feeling."
"165399380-0-32369";"If we were better stewards of the forest, the forest would have protected us. Don't you see?"
"165399380-0-32370";"I knew this day would come. We should have taken the fight to the Drublog when we were strong. When we were ready."
"165399380-0-32371";"Things are much more peaceful up here. Simpler.\n\nIf I could, I'd live in the treetops. Think of how wonderful that would be!"
"165399380-0-32372";"Me? I'm not hiding. What makes you think that?"
"165399380-0-32384";"Even in this place of war, knowledge can still be found … by those interested in such things."
"165399380-0-32419";"Divines bless you, friend! I am a good man who's fallen on hard times. I have eleven starving children that will surely die without a morsel to eat today. Won't you spare a silver for an honest man and his adoring children?"
"165399380-0-32438";"Greetings, traveler! Welcome to the Pilgrim's Rest, the best inn in Ivarstead."
"165399380-0-32442";"I often wonder if you could get a rock to grow if you cared for it enough."
"165399380-0-32443";"Though it is rare, there are members of the wyrd that are not Bretons."
"165399380-0-32450";"I never thought much of the wyrd, but the way they've taken us in shows they have good hearts."
"165399380-0-32451";"I never thought of living in a tree, but I could get used to this."
"165399380-0-32452";"Thank you for your help, stranger."
"165399380-0-32453";"When can we get back to our lives?"
"165399380-0-32462";"Where I am from, the trees are not so green."
"165399380-0-32464";"Simple toil is good for the heart, or so the wyresses say."
"165399380-0-32465";"I'm glad to be back at camp rather than at that mill."
"165399380-0-32466";"This camp may not be what the survivors from the mill are used to, but it will have to do."
"165399380-0-32468";"What are we to do when the earth itself rises to harm us?"
"165399380-0-32469";"Apples, apples, where are those apples?"
"165399380-0-32470";"Many of the Wyrd dislike fire, but I find I have an affinity for it."
"165399380-0-32495";"Be careful if you're going to Crosswych. Red Rooks have taken over the town. \n\nWe're getting ready to fight back though. If you want to lend a hand, you can join the resistance."
"165399380-0-32496";"You want to watch your step in Crosswych. The place is crawling with Red Rook thugs.\n\nOf course, we'll take any help we can get. If you feel like getting involved, talk to Tamien at the inn."
"165399380-0-32501";"A pact was forged here many years ago. No Baelborne may walk this land. Any of that bloodline who ignore this decree shall be dealt with.\n\nHarshly."
"165399380-0-32503";"Every Baelborne who dares to return to this land shall fall."
"165399380-0-32508";"I have more important things to do than give you directions to the inn."
"165399380-0-32509";"Excuse me, I am much too busy to deal with you right now."
"165399380-0-32526";"You did a great thing this day. If you need anything, you can always find me here."
"165399380-0-32527";"You saved my life. You're a hero."
"165399380-0-32532";"No refunds, no returns. No exceptions."
"165399380-0-32534";"Belarata is closed. All you'll find is a shady Khajiit selling rubble and old spoons."
"165399380-0-32582";"Always happy to serve. Get you something?"
"165399380-0-32583";"Running orders to Mathiisen, but I can stop for a moment. What do you need?"
"165399380-0-32604";"You'd be surprised what bounties the sea provides. Share in the bounty?"
"165399380-0-32605";"From the Skywatch docks to your pack. What can I get you?"
"165399380-0-32606";"Weary steps? I have something for that."
"165399380-0-32607";"My deals are the best deals! Taste the value!"
"165399380-0-32608";"Why wait for the high prices in Firsthold? Enjoy bargains for a weary traveler."
"165399380-0-32609";"Great prices for a weary traveler, here. Test my claim?"
"165399380-0-32631";"How did you manage to get here? You must have had quite a swim.\n\nSadly, that skill doesn't qualify you to attend the Academy."
"165399380-0-32632";"Serving the needs of a fort isn't the same as setting up a shop in a city."
"165399380-0-32633";"I've got a quest for you."
"165399380-0-32662";"I'm a duel monster!"
"165399380-0-32664";"I saw a big light over the tree and came this way. Do you need anything?"
"165399380-0-32665";"Before you have any of my brother's drinks, I'd recommend getting some solid food in your stomach."
"165399380-0-32678";"I'll never understand why we didn't build one large stable instead of these two smaller ones. It makes no sense!"
"165399380-0-32686";"Don't tell the stablemaster, but I can't stand the smell of guar."
"165399380-0-32699";"Move aside. I have house business to attend to."
"165399380-0-32747";"I've never seen Mournhold this crowded before."
"165399380-0-32763";"I'm waiting for word from Narsis. I hope things have returned to normal."
"165399380-0-32764";"Thanks to your efforts, order and peace are restored. Crosswych will be back to normal in no time."
"165399380-0-32779";"I'm rather busy right now. Come back later."
"165399380-0-32780";"Do not interrupt me!"
"165399380-0-32781";"<Raynor Vanos doesn't say a word.>"
"165399380-0-32830";"Shoveling guar droppings has one thing going for it. Job security."
"165399380-0-32831";"The Academy turns out the best leaders and mages in the world. And now I'll be a part of it all."
"165399380-0-32836";"You really ought to visit Crosswych when we're not quite so overrun with … pests."
"165399380-0-32843";"This would never happen in Summerset! Where is a justiciar when you need one?"
"165399380-0-32844";"He sold me a welkynd stone! Do welkynd stones dissolve in the rain? I think not!"
"165399380-0-32845";"Don't believe anything that swindler says. Look what his garbage did to my brother. It's not safe!"
"165399380-0-32846";"Ugh … feels like I've been trampled by a mammoth."
"165399380-0-32852";"Another fine night. Or is it day? Doesn't matter. The drinks are still coming."
"165399380-0-32864";"Between the armies tearing up the countryside and the demons terrorizing the island, the dust never stops flying. And it all seems to settle on my doorstep."
"165399380-0-32866";"I have to speak to the King, but they won't let me into the castle."
"165399380-0-32873";"Here to taunt the blind man too? The captain doesn't deserve this mockery!"
"165399380-0-32874";"Will that woman ever stop sweeping? It makes me exhausted just watching her. Not that I mind watching her, you understand…."
"165399380-0-32879";"I'm on a business visit from Vvardenfell. With the Argonians emancipated and Shadowfen open to the free market, there's plenty of money to be made."
"165399380-0-32882";"Much hotter and more humid down here than in Solstheim. Have to say that I like it."
"165399380-0-32890";"Monsters, soldiers, and demons. As long as they leave me to my work, I don't care what they do to each other."
"165399380-0-32893";"I have a great many staves to choose from. Summon powerful magicks with a flick of the wrist!"
"165399380-0-32895";"You will always be welcome in Crosswych."
"165399380-0-32897";"Well done. Well done indeed. \n\nWe'll make sure that something like this does not happen again."
"165399380-0-32901";"I've paid my debt to society. Unfortunately, I haven't paid my tab to Six-Coins."
"165399380-0-32904";"Shh! They'll hear you!"
"165399380-0-32909";"Ever been to the ruins at Bogmother? That's where we returned my mentor, Bran-Na, to the swamp."
"165399380-0-32912";"The Dunmer no longer take us as slaves. But that doesn't mean they take us seriously.\n\nI'm fine with that. The less they know about us, the better."
"165399380-0-32914";"Stormhold's a great city. You give us ten years and it'll be the crown jewel of the Pact."
"165399380-0-32915";"I understand why we need Argonian and Dunmer vicecanons. But what do we need a Nord for? Drunken tie-breaker?"
"165399380-0-32920";"I've got a lot on my mind, and all this noise isn't helping me think. Do I need to get lost in the swamp to get a moment of peace?"
"165399380-0-32923";"If you see that bastard Five-Coins, tell him … don't tell him anything. He doesn't deserve it."
"165399380-0-32927";"They say you can actually go talk to the Dunmer gods. Given the way the Dunmer treated us … do you think that also means you could punch them?"
"165399380-0-32933";"Something has occurred within the Mages Guild, and now I'm being terribly inconvenienced."
"165399380-0-32934";"Wagers only interest me if the stakes are high."
"165399380-0-32936";"I tried to find one of the magisters to assist my lady, but no one's available."
"165399380-0-32938";"My miners will take care of any Red Rooks hiding out in dark corners of the mine. It'll restore their confidence, to send these shiftless rogues running. \n\nMuch obliged to you, for all your help here in Crosswych."
"165399380-0-32939";"A banekin delivered my invitation! Walked right into the house and dropped it in my porridge.\n\nNow I want to see who else got one!"
"165399380-0-32940";"I've been studying at Shad Astula for two seasons now. I can't wait until I get my certificate and take my place as a Pact officer."
"165399380-0-32943";"Thanks for your help on the trail. I might've not made it home without your help."
"165399380-0-32949";"Fishing's pretty good here. The screams and flashes from the Imperial City don't seem to bother the fish any."
"165399380-0-32950";"Hello! Welcome to Admand Brothers Lumber Works. Please don't bother my workers, we have orders to fill."
"165399380-0-32951";"There's plenty of good fishing on Lake Rumare. This is our spot; go find your own."
"165399380-0-32952";"I rue the day I agreed to work here. We have been paid in thin stew for a week. I shall not work without pay."
"165399380-0-32954";"You don't want to talk to me. Yves is the smart one, apparently. I do the work, he drinks the ale. Yes, don't waste your time talking to the dumb Admand brother."
"165399380-0-32955";"Who?\n\nYou about scared me out of my pelt. At least there's flesh on your face. Where did you come from?"
"165399380-0-32959";"I can't believe what I just heard. Magistrix Vox was a paragon of virtue!"
"165399380-0-32968";"I thought they were all dead. Glad to find it isn't so."
"165399380-0-32969";"Never got to repay those Sea Drakes. I'll kill them some other time."
"165399380-0-32970";"I may have only five working fingers, but that's enough to hold a mug."
"165399380-0-32971";"I told you to get out. Glad you ignored me."
"165399380-0-32978";"Nightcaller Molacar inspires me. His interpretation of Vaermina's sendings in our dreams has shown us our true path!"
"165399380-0-32979";"I hope there's a sacrifice this time. It's been too long since we made an offering to Vaermina."
"165399380-0-32980";"I worry that we misread Vaermina's intent. A nightmare may be inspired by a spoiled serving of swamp eel pie. Then would it be Vaermina's will we follow, or the swamp eel's?"
"165399380-0-32981";"Nords boast that they can hold their liquor. What they mean is that they don't care what they do when they're drunk."
"165399380-0-32985";"I don't want your help or your pity. I have willingly offered myself to Vaermina. Only she can save Cyrodiil. If my sacrifice brings peace to others, I go gladly."
"165399380-0-32990";"Don't get on Vori's bad side. She may look pleasant, but I heard she flayed a failing student. For botching their spell! Can't count how many times I've done the same."
"165399380-0-32998";"A pilgrim, I see. Vaermina's shrine lies just down the path. Worship will continue for some time."
"165399380-0-32999";"I'm glad we have two smaller stables instead of one big one. Working near my sister all day would drive me crazy!"
"165399380-0-33000";"A new face! That's a rare occurrence. Welcome to the Everfull Flagon!"
"165399380-0-33004";"You're not one of the Flagon regulars."
"165399380-0-33012";"Therich and I grew up in Daggerfall, but people there weren't very tolerant of our relationship. We moved here five years ago and instantly felt accepted.\n\nFunny how the smallest minds are found in the biggest cities, isn't it?"
"165399380-0-33015";"Talmo has been whining about his stupid flag for days. I'm glad it's gone!"
"165399380-0-33016";"So many refugees here, it's not an Imperial town anymore. I'll be glad when this war is over and the newcomers can go home."
"165399380-0-33017";"Why have you wandered into the Cliffs of Failure, mortal? Are you curious as to what you must face here? Do you wonder why we haven't destroyed you? Or why these mages are bound before us?\n\nI have answers, of course—if you are willing to listen."
"165399380-0-33018";"The land's plenty fertile. The main problem with farming here is armies tromping through—ruining fields, stealing livestock, and burning homes. All we can do is build and hope for the best."
"165399380-0-33019";"Has Therich talked to you about his dumb wall idea yet? Stick around long enough and he will. What a nut!"
"165399380-0-33020";"I don't see what's so ridiculous about building a wall around Vlastarus. We'd all be a lot safer!"
"165399380-0-33022";"I can't believe these chickens eat so much. Where do they put it all?"
"165399380-0-33029";"You have no idea what you just walked into. You should never have come here."
"165399380-0-33030";"Yes, yes. I see, I see. You would make a fine addition to my forces."
"165399380-0-33031";"Ah, a new recruit! Splendid! I have a good feeling about you. Yes, I really do.\n\nTogether, I'm sure we can win this contest. Good fortune follows me, or so I've been told."
"165399380-0-33033";"Cursed, Daedra take it! Cursed! A curse on all curses!"
"165399380-0-33050";"I don't know what I'm going to do about Darvell."
"165399380-0-33053";"Everyone thinks I'm crazy, even my wife."
"165399380-0-33054";"If it weren't for Vastae, I'd have left town a long time ago. Everyone here is so concerned about the fissure and earthquakes and such, they don't take the time to appreciate music. It'd do them some good to relax a little."
"165399380-0-33055";"I try to keep what's left of Chorrol as neat as I can. I hope to eventually plant a small spice garden. The food here is so bland!"
"165399380-0-33057";"You want to help? Walk along the fissure and watch for monsters."
"165399380-0-33062";"Halion is an unappreciated genius. Chorrol doesn't deserve him. Isn't he great?"
"165399380-0-33067";"The waters of life flow strongly through this village. Despite the dangers from the fissure, the people remain. I admire them, though I will not stay."
"165399380-0-33074";"What? My friend's looking for an heirloom that was put in the wrong coffin. Keep moving."
"165399380-0-33080";"There's never anything new here. The danger scared away the best merchants. Not that we have the money to buy anything, with Asvorn just hanging around the tavern all day and night."
"165399380-0-33083";"This is a cursed place, wayfarer. Satakal's flames will consume all who dwell here. I await the end. What sense to flee when all Cyrodiil burns?"
"165399380-0-33084";"Hard to believe there aren't any beds available in town. I think it's anti-Orc racism!"
"165399380-0-33086";"If you're looking for a bed, check at the Oak and Crosier. I'm full up."
"165399380-0-33087";"Times are hard here, stranger. If not for the help we get from Weynon Priory, this would be a ghost town."
"165399380-0-33155";"What do you want?"
"165399380-0-33171";"<You can see a resemblence between this young man and Nelulin. This must be Iwelien, Velatosse's younger son.>"
"165399380-0-33175";"We have such lovely flowers here. I can think of a thousand places to plant them around the city."
"165399380-0-33181";"Why are you here? Why have you come searching for this damned fleet of the lost?"
"165399380-0-33184";"You'll be in my songs, friend.\n\nThank you."
"165399380-0-33185";"I could hear the giants howling from here. How many did you kill? A hundred? A thousand?"
"165399380-0-33224";"You … you came with us to stop Molag Bal, didn't you?\n\nI'm sorry you got caught up in this stupid game, too. Well, take my life. Finish me. I refuse to participate in this travesty."
"165399380-0-33225";"Stay away from Mim!\n\nDon't … don't make this one hurt you. Mim will win this game. Mim will beat everyone and get us out of here. All of us!"
"165399380-0-33226";"I can end this nightmare … one step and it would all be over. No more worries. No more unpleasant options. I wouldn't have to hurt anyone ….\n\nJust one single step."
"165399380-0-33227";"You came back. I was afraid I'd imagined our earlier discussion.\n\nMy mind plays tricks on me. Especially when the craving gets really bad."
"165399380-0-33233";"I see your skin is still on your bones. I searched the rest of the ship, but there's no sign of the journal. \n\nDid you have better luck?"
"165399380-0-33238";"What do you want? Can't a Nord drink in peace?"
