"Location";"Source"
"165399380-0-22380";"Honor to you, traveler. Name's Naril. I'm guessing you're new in town and need some work?\n\nIt's a bit of luck we met, because I need some help in a business deal."
"165399380-0-22383";"Welcome to the Fish Stink. What can I get you?"
"165399380-0-22388";"Come here. Quietly, please."
"165399380-0-22394";"You did it. The Echo of Vox is defeated and the fires and spirits have dissipated."
"165399380-0-22406";"Hi, I'm a test NPC for verifying various quest bugs."
"165399380-0-22409";"What brings you to this stinkhole?"
"165399380-0-22410";"Poor Valen! All that drinking has really taken its toll."
"165399380-0-22411";"Where can he be?"
"165399380-0-22413";"Brothers!"
"165399380-0-22416";"I have plenty to do without constant interruptions."
"165399380-0-22418";"Honor to you and your house, traveler. \n\nSay, you look like a smart one. Any interest in a business arrangement?"
"165399380-0-22425";"About time you got here! I've been dodging spiders for what seems like forever.\n\nWait, you're not Raynor."
"165399380-0-22426";"Stranger! Stranger! Stranger! I require your immediate assistance."
"165399380-0-22433";"You've done well, for a mortal."
"165399380-0-22461";"We want no trouble, outlander. My injury doesn't keep me from stringing a bow."
"165399380-0-22470";"I wouldn't want to be stuck here forever myself."
"165399380-0-22480";"It's a shame that some of the kwama have to be put down."
"165399380-0-22484";"<This guar's body was ripped open, and it's partly devoured. The beast that killed it might be nearby.>"
"165399380-0-22485";"You there! Come over here … quietly. Don't let them spot you."
"165399380-0-22487";"Even in death, I feel trapped here. Part of my soul is tied to this prison."
"165399380-0-22498";"I can't spare a moment for another tryst. Oh! Excuse me, I thought you were someone else."
"165399380-0-22499";"I find this village refreshing in its innocence, don't you?"
"165399380-0-22505";"My brewing skills are unmatched, for one who must work with dregs."
"165399380-0-22511";"S'rendarr bless you, my friend."
"165399380-0-22531";"You'll have to wait with the rest if you're seeking passage, f'lah. I don't care if King Emeric himself is banging on the gates. These manifests need to be checked and filed before we embark."
"165399380-0-22562";"By the skull of the saint! Sacrilege, blasphemy, and heresy!"
"165399380-0-22564";"Dithisi pays me well to make sure there's no trouble. So do me a favor and don't start any."
"165399380-0-22566";"The Tanval Blades have pushed us out of the city. I don't know how we'll get them out of there. The grandmaster seems to bend to their every whim."
"165399380-0-22588";"<This mudcrab's shell is discolored, as if from poison. The beast that killed it might be nearby.>"
"165399380-0-22590";"<This vanguard is dead. His armor is deeply dented, and the disjointed look of his limbs suggests crushed bones. The creature that killed him might be nearby.>"
"165399380-0-22591";"<This vanguard is dead. Her armor is deeply dented, and the disjointed look of her limbs suggests crushed bones. The creature that killed her might be nearby.>"
"165399380-0-22602";"Hello, traveler! I am but a humble merchant searching for new markets for my fine goods."
"165399380-0-22612";"We can't survive much longer here. Every year, the cannibals are more desperate."
"165399380-0-22618";"They're going to turn me into one of the unliving. You've got to save me!"
"165399380-0-22619";"I don't want to die. Please!"
"165399380-0-22620";"I don't want to be a zombie! Save me!"
"165399380-0-22621";"They're going to turn us into zombies. You've got to help me!"
"165399380-0-22630";"All my bags are genuine Skyrim auroch hide.\n\nThere isn't one stitch from any of those weird critters around here."
"165399380-0-22633";"Forgive my wheezing. The road from Dhalmora is long and my stock is ample. I could have loaded my burden onto a Guar, but I can't bring myself to do it. They look too much like family."
"165399380-0-22634";"It's a bad time to visit Davon's Watch. The Daggers could come over the walls at any moment.\n\nYou should buy some of my father's armor. You won't find better in all of Stonefalls."
"165399380-0-22635";"You buying or just talking?"
"165399380-0-22636";"As far as you know, the leather in my boots isn't from anyone in my family.\n\nExcuse me. That's a joke."
"165399380-0-22640";"Welcome to Narvyn's Arcane Emporium. Glad you found us. And by us, I mean me. Because a mage needs no one. Just his mind and good equipment. And every mage knows the best equipment can be found at Narvyn's.\n\nAm I going too fast for you?"
"165399380-0-22642";"I do not like the Khajiit, but Bakkhara was at least one of us. Why she crept off to Valenwood's Elden Tree, I will never know."
"165399380-0-22643";"Why don't you grab a drink and join us?"
"165399380-0-22645";"Hello, stranger. Just talking about the giant rats around here. \n\nHectur, the owner, goes after them like he's a great hero. He thinks it makes him look brave."
"165399380-0-22646";"Greetings, stranger. Long journey?"
"165399380-0-22647";"Pardon me, I'm showing this scale sister around town before we take up blades for the Pact."
"165399380-0-22648";"Stupid Khajiit! It's no wonder we made slaves of them. Bakkhara is going to waste her gifts creeping around Valenwood."
"165399380-0-22653";"I've been beaten lower than a dock rat. What's it to you?"
"165399380-0-22655";"What took you so long? And who's your sparky new friend?"
"165399380-0-22661";"These fumes … I feel terrible."
"165399380-0-22662";"I don't feel very well .…"
"165399380-0-22675";"In all my years, I've never seen anything like this."
"165399380-0-22739";"Good timing. I think I almost have this contraption figured out. Did you get the parts?"
"165399380-0-22749";"Looking to shape some metal? I've got what you need."
"165399380-0-22752";"Were you successful in the mines?"
"165399380-0-22755";"They say their spirits are here, you know. The lost souls who can't return to the soil. They say that this Vox … she enslaves them to do as she pleases.\n\nDo you think that's true? Are they not truly free from life's burden?"
"165399380-0-22756";"We're safe. I would prefer not to do that again."
"165399380-0-22757";"Honor to you, my friend."
"165399380-0-22758";"My shield brother is gone. He died as well as anyone could.\n\nLet's return to Kragenmoor and drink to his memory."
"165399380-0-22766";"Meht, my mouse, is not feeling well. His last meal sits ill with him. I will stay with him until he gets better."
"165399380-0-22775";"Your pardon. I know you have urgent business, but I must entreat your aid."
"165399380-0-22777";"You have to help me. I watched my son die before my eyes. What do I do?"
"165399380-0-22779";"Do you need something, citizen?"
"165399380-0-22781";"My whole family. Dead. I'll never leave here alive."
"165399380-0-22784";"Did you harvest the kwama cuttle?"
"165399380-0-22792";"<The corpse of an Argonian female lies in the dirt. Even though her body is slashed and burned, she appears to be dressed in the accoutrements of a tree-minder.>"
"165399380-0-22798";"Raynor showed up right after you went inside. \n\nWe heard scary noises from behind the door. What was in there?"
"165399380-0-22799";"I appreciate the help you gave my sister, even if she is rash and impetuous. Was the control rod useful?"
"165399380-0-22809";"Comrade."
"165399380-0-22811";"Hello."
"165399380-0-22812";"Beware! This is a place of angry death."
"165399380-0-22813";"I should do my best to comfort this man. He's dying."
"165399380-0-22814";"I like the ambiance out here.\n\nThere's a quiet in the air. So pleasant compared to that screaming from below."
"165399380-0-22823";"Stretch your tail here in peace."
"165399380-0-22824";"Be welcome and wallow, soldier. We aid Mistress Reesa in her humble works."
"165399380-0-22834";"What are you doing here?\n\nNo matter. I have goods to trade. They're just trifles, except for that odd statue."
"165399380-0-22848";"What? What are you doing out here?"
"165399380-0-22850";"Three bless you! We're grateful for your help."
"165399380-0-22856";"For speed on the battlefield, light armor is the best choice!"
"165399380-0-22858";"Protection and speed—that's what my armor offers!"
"165399380-0-22859";"This one offers weapons to fit every hand!"
"165399380-0-22860";"My wares are small but powerful. Don't risk battle without their protection!"
"165399380-0-22861";"Light armor is for cowards who plan to run. Invest in heavy armor and you will never regret it."
"165399380-0-22863";"What a pleasant surprise! I didn't think you'd get out of that gorge alive, but I'm happy to have been wrong."
"165399380-0-22864";"Hmm. There's something about you."
"165399380-0-22865";"Those pirates are digging … and drinking. We can take advantage of that."
"165399380-0-22866";"You look like someone who appreciates armor that doesn't slow you down!"
"165399380-0-22867";"Why wear armor that won't stop a dagger or that will rust if it rains? Try my armor on for size!"
"165399380-0-22868";"My weapons will keep you alive out there, warrior!"
"165399380-0-22869";"Small items pack great power. My wares will make a believer out of you!"
"165399380-0-22870";"I sell the best protection available. Anything less will leave you dead on the battlefield!"
"165399380-0-22872";"You go into battle unprepared, expect to die. Equip yourself well, warrior."
"165399380-0-22873";"While heavy armor suits clods who plod around the battlefield, light armor is best for the nimble of foot and mind!"
"165399380-0-22874";"The wise choose both protection and speed, qualities in which my armor excels!"
"165399380-0-22875";"It's the little things that make the difference in battle, friend. See for yourself!"
"165399380-0-22876";"When some Elf is poking at you with his little sword, you'll be glad you bought good armor from me!"
"165399380-0-22893";"I suppose I must now see to the farm. \n\nIt won't ever be the same, you know."
"165399380-0-22898";"Three gods. One faith.\n\nI trust you have practiced your devotions for the day."
"165399380-0-22909";"I'm going to die and rot in this swampy grave. No hope.\n\nI can't even get a dry pair of socks! Can't a soul die in a dry pair of socks?"
"165399380-0-22934";"What? Give up my invitation? Never!"
"165399380-0-22935";"I'm glad you're with us on this."
"165399380-0-22937";"Those pirates aren't just digging. They're drinking, too. Good."
"165399380-0-22957";"What do you want? Do you have an invitation?\n\nNo invitation, no passage."
"165399380-0-22958";"Control. We must learn control."
"165399380-0-22959";"I can't wait to get to the Academy! I want to become an officer and help lead the Pact."
"165399380-0-22960";"The instructors think they'll be able to contain my innate power. Ha!"
"165399380-0-22962";"I may not look it, but I'm glad to see you."
"165399380-0-23029";"Tell me, how did your invitation arrive?\n\nIn the claws of a bird of prey? In the fist of a charmed giant? I got mine from a terrifying ghost!"
"165399380-0-23047";"I've never been this far from home. I can't believe I'm doing this."
"165399380-0-23048";"Just wait till I get over to that school and show them what I'm made of. They'll be amazed!\n\nWhat're you looking at, s'wit?"
"165399380-0-23049";"My father said I was the most amazing wizard he'd ever seen. \n\nThey'll probably make me class hortator."
"165399380-0-23052";"Hello again my sweet… wait a minute. You aren't my sweet at all! Where is Orana?"
"165399380-0-23053";"Oh great, my father is convincing strangers to do his dirty work now. He couldn't talk me out of it and neither will you."
"165399380-0-23054";"Hello stranger, forgive me for not offering more hospitality but my family is in something of a crisis right now."
"165399380-0-23116";"You must be invited to enter the Shad Astula Academy of Magic.\n\nYou don't seem the type. Still, I've known unassuming students who achieved great success."
"165399380-0-23131";"Welcome to Shad Astula, proud training ground for the next generation of House and Pact leaders.\n\nMay I see your invitation?"
"165399380-0-23144";"There must be a way to fix things."
"165399380-0-23205";"I expect my students to strive for excellence. I demand brilliance, determination, and eagerness to embrace the ineffable mysteries of our noble calling."
"165399380-0-23213";"You have a touch of the Hist about you. It's strange."
"165399380-0-23218";"You want something, featherless?"
"165399380-0-23227";"I knew you could do it. Well done!\n\nNow to business. Something threatens this Academy, but your presence here will save the day. I have seen it in a vision!"
"165399380-0-23229";"I never thought I'd be so happy to be back in this inn."
"165399380-0-23230";"Thank you for rescuing Elynisi. I hope you can help us."
"165399380-0-23231";"Thanks again, friend!"
"165399380-0-23232";"I knew the Three wouldn't abandon me!"
"165399380-0-23237";"Vivec guide your steps, soldier."
"165399380-0-23238";"Troll's blood! I was hoping you'd show up here."
"165399380-0-23239";"Welcome in the name of the Three. How do you like Ebonheart?"
"165399380-0-23241";"Sun on my scales! Welcome. You have seen my cousins in the Argonian quarter, I hope?"
"165399380-0-23246";"When you came around, it was a lucky day for Shadowfen"
"165399380-0-23247";"I can fetch you a beverage if you'd like. If you're looking to make a more … intimate request, you'll have to speak with one of our courtesans."
"165399380-0-23255";"Find the amulet, she said. Use the wand, she said. \n\nWhat if it sets things on fire? I could burn the whole Academy to the ground."
"165399380-0-23262";"Those Dominion dryskins are all safely dead, I trust."
"165399380-0-23267";"Hello, traveler. I'm Selfora's healer. Not that it means much now. \n\nThis disaster has left me short on supplies. All I've got left are bloody rags and soothing words."
"165399380-0-23327";"What do you want? Can't a man drink in peace?"
"165399380-0-23328";"What rubbish! Fish magic from a pond? Vivec's buttocks, what does that even mean?"
"165399380-0-23332";"Asked me to do one simple thing. Bring student-rats back to instruction hall. But Hadmar can't do anything right."
"165399380-0-23348";"You were unconscious for hours. At least it seemed like hours.\n\nHow do you feel? I was worried about you."
"165399380-0-23349";"This is terrible! The Academy's in danger, the Arch-Mage is missing, and I'm locked in here with you."
"165399380-0-23352";"The Dominion fought like starving kagouti to get to this place. The fleshflies will surely feast upon their bodies.\n\nPoor fleshflies."
"165399380-0-23355";"I remember you! You helped us save Deepcrag Den!"
"165399380-0-23357";"<The dead Argonian's wrists bear fresh shackle-scars. A sticky substance oozes out from beneath his body.>"
"165399380-0-23359";"Master send me to make sure you safe. \n\nYou smell all right. Look funny, though."
"165399380-0-23364";"Hail and such. Keeping the ash out of your eyes?\n\nYou know, you look like a smart one. Any interest in a business arrangement?"
"165399380-0-23366";"Mayhem? Make things go boom?"
"165399380-0-23367";"Hadmar's glad to see you. Arch-Mage said you'd be here soon. And here you are."
"165399380-0-23368";"Wait, where am I? Why are we up so high?\n\nThat blasted banekin! It could have warned me."
"165399380-0-23369";"About time you summoned me. I thought you'd leave me sitting in that cell forever."
"165399380-0-23371";"Destroy the Lens! Release the students from its spell."
"165399380-0-23373";"We were going to expand the plantation. Sell the useless Cats for some strong Bretons and Redguards."
"165399380-0-23380";"You're awake! Oh, I was so worried. \n\nI'm so glad you're all right."
"165399380-0-23386";"Good to see you up and around. \n\nI knew you'd be fine, but Lena wouldn't leave your side. You gave her a good scare."
"165399380-0-23396";"Once again my people need me, but I dwindle and fade."
"165399380-0-23400";"The Dominion will never make us flatten our spines."
"165399380-0-23413";"Beware! Daedra assail this humble shrine."
"165399380-0-23417";"I thought I was the only one fool enough to be sneaking around this place. Are you trying to get killed? Run for it while you can."
"165399380-0-23420";"Well done, friend. That hag had no business keeping me here. You did the right thing."
"165399380-0-23421";"It's not all bad. At least I get a feather bed, right?\n\nAsk my son to come up to the tower. I'd like him to meet his … er, new stepmother."
"165399380-0-23441";"Be welcome, my friend. We have few luxuries here, but we will trade with what we have."
"165399380-0-23455";"I hoped and prayed someone would come along."
"165399380-0-23457";"Why are you bothering me? Want to end up in the stocks?"
"165399380-0-23458";"While I've enjoyed finding treasures, it's probably time for me to seek a new direction."
"165399380-0-23473";"<This victim looks like he suffered many wounds. Sometimes exploration can have quite a cost.>"
"165399380-0-23478";"I've heard these mushrooms are delicious, but I'm not going to eat them. They glow like lanterns! That's not appropriate mushroom behavior! I disapprove."
"165399380-0-23483";"I'm giving up tomb excavation for good. I think I'll grow mushrooms."
"165399380-0-23485";"Not so loud! You'll betray our position!"
"165399380-0-23496";"I came all the way from Saint Veloth's Shrine to lend my skills to this effort."
"165399380-0-23503";"Welcome. Are you a scholar of the Mages Guild? \n\nWait, don't tell me."
"165399380-0-23504";"I can't talk. I have to concentrate on not being seen. If I can't see her, she can't see me!"
"165399380-0-23512";"No, another monster! I'd almost escaped. Don't hurt me!"
"165399380-0-23526";"Hush, fool. Do you want to give my position away?"
"165399380-0-23527";"Another fan of my music, eh? What brings you to Whiterun?"
"165399380-0-23528";"Welcome to Riften. I don't have time to be polite. We need help. If you're willing, I'll love you forever. If you're not, get out of my way."
"165399380-0-23529";"What brings you to White Rose, stranger? Did you take a wrong turn somewhere?"
"165399380-0-23530";"No, father, please. Don't beat me! I'll learn the song!"
"165399380-0-23531";"Mother, why don't you understand? I'm not some milk-drinking schoolgirl!"
"165399380-0-23534";"Dark winds flow through the woods these days."
"165399380-0-23537";"You'll not get a word out of me."
"165399380-0-23559";"Hello."
"165399380-0-23560";"I was afraid I was the only person here. I'm glad to see a friendly face."
"165399380-0-23561";"Alas, poor me.  Misfortune and ruin abound.  Excuse me, but do you think you could help?"
"165399380-0-23562";"Greetings, I could use some help with a troubling situation."
"165399380-0-23563";"You there! I've been robbed by Supernal Dreamers!"
"165399380-0-23564";"Oh, my poor antique crystals."
"165399380-0-23565";"Hail, greetings, and welcome! Are you friendly to those of my ilk?"
"165399380-0-23567";"<Cough> Can you help me?"
"165399380-0-23572";"What are you doing up here? It's too high for your kind! You have no wings. If you fall, you'll go ""splat!""\n\nI'd be sad to eat your tasty bits. Mostly."
"165399380-0-23574";"It's a shame that some of my kwama must be put down."
"165399380-0-23576";"What's this Daedric ruin doing here? What's its purpose? \n\nOh gods, is that blood coming out of my ear?"
"165399380-0-23578";"Come to join me in exile, featherless one?"
"165399380-0-23581";"You heading into that cave, too? The last one who went in there didn't come out."
"165399380-0-23583";"I am trapped and forgotten, like so many others."
"165399380-0-23584";"Hey, you! You're awake, yeah?"
"165399380-0-23585";"Hey, you! A minute to help an old man?"
"165399380-0-23589";"<Cough> Can you help me?"
"165399380-0-23592";"empty"
"165399380-0-23596";"I will take the prisoner to be questioned. Please speak with Dajaheel."
"165399380-0-23600";"Where? This body. This isn't my body!"
"165399380-0-23612";"It is an honor to work with <<1>>."
"165399380-0-23613";"Quick, you have to get me out of here before they come back. I'm next!"
"165399380-0-23614";"Please help me!"
"165399380-0-23615";"Quick, you have to get me out of here before they come back. I'm next!"
"165399380-0-23616";"Want do you want?"
"165399380-0-23617";"I'm so very tired of being kidnapped."
"165399380-0-23619";"Hi, I'm an escape artist with amnesia. Can you help me?"
"165399380-0-23620";"Quick, you have to get me out of here before they come back. I'm next!"
"165399380-0-23621";"Quick, you have to get me out of here before they come back. I'm next!"
"165399380-0-23623";"The swamp's blood boils with dark magic."
"165399380-0-23624";"The swamp has always had teeth. But those teeth now have venom."
"165399380-0-23638";"Want do you want?"
"165399380-0-23639";"Please, I must concentrate."
"165399380-0-23640";"Well, that was exciting. Let's never do it again."
"165399380-0-23641";"Thank you for freeing me!"
"165399380-0-23642";"What's that? Ha, made you look."
"165399380-0-23643";"Thank you for saving me from the Dreamers."
"165399380-0-23644";"Oh, there you are!"
"165399380-0-23645";"Thank you for freeing me! You rock!"
"165399380-0-23647";"We'll hold the line here. We can't let the rotgorges wash over the village like a poisonous wave."
"165399380-0-23648";"Rotgorges … stranglers … they used to be a nuisance. Now, they're proving deadly."
"165399380-0-23649";"I wasn't going to let you go away without saying goodbye."
"165399380-0-23650";"I know I gave you a hard time and all, but ….\n\nGah. I'm sorry. There, I said it."
"165399380-0-23651";"Hadmar's glad you're all right. I'm proud to call you my friend."
"165399380-0-23652";"Goblins are disgusting."
"165399380-0-23653";"I've never liked Goblins."
"165399380-0-23668";"It's good to see you again. If my prince would allow it, I'd show you just how grateful I am."
"165399380-0-23670";"What are you doing here? Turn back while you have the chance."
"165399380-0-23714";"That damn giant almost killed me. He did more damage than all the Reach combined."
"165399380-0-23720";"Sinmur was the most frightening thing I'd ever seen. It stepped on the soldier right next to me, squashed him flat!"
"165399380-0-23721";"I need to go somewhere far from this chaos. Maybe I'll try Riften."
"165399380-0-23727";"No time to talk. This barricade's gotta be built!"
"165399380-0-23728";"How much higher do we need to make these things?"
"165399380-0-23729";"Why don't some of these damn soldiers help out?"
"165399380-0-23730";"What hope is there that these barricades will hold?"
"165399380-0-23731";"The enemy is upon us. Be wary."
"165399380-0-23734";"Waiting for the next attack is the worst part for me."
"165399380-0-23735";"The Reach will regret the day they decided to tangle with us."
"165399380-0-23736";"Will the Reachmen ever go away?"
"165399380-0-23737";"All's well that ends well. Or as well as it's going to get, anyway.\n\nI'm glad to see you're still in one piece."
"165399380-0-23739";"This is just the beginning. Sinmur will destroy the Rift if he's not stopped."
"165399380-0-23740";"What good are barricades against a monster like that?"
"165399380-0-23741";"You're here to help against those savage bastards, yeah? You deserve a drink."
"165399380-0-23742";"I need a rest. I haven't slept since the Reach's first attack."
"165399380-0-23743";"The Reachmen will break against Shor's Stone walls if they dare to attack again."
"165399380-0-23744";"They never saw it coming. I hope we can secure the town and recover the survivors."
"165399380-0-23745";"The Ordinators must be vigilant in our pursuit of preserving the peace for the Tribunal.\n\nSadly, we can't be everywhere at once. And so Magistrix Vox grows bolder every day."
"165399380-0-23746";"I have no idea how the Reach got here, but we have to drive them out."
"165399380-0-23750";"Maybe we should abandon Shor's Stone."
"165399380-0-23751";"We can use all the help we can get around here."
"165399380-0-23764";"You'll not get a word out of me."
"165399380-0-23773";"If we don't work, we don't eat. Company doesn't pay us for sitting outside the mine."
"165399380-0-23777";"I can keep busy here, but my brother Adon can't work with those Goblins running loose in the mine."
"165399380-0-23778";"You ask me, sweeping's better than mining … but I doubt I'll get paid as much."
"165399380-0-23779";"Might … might … might as well drink my troubles away!\n\nYou wanna use the well? I'm not going to!"
"165399380-0-23781";"So the Maulborn lied to everyone. I figured as much. This doesn't bode well for Narsis, though."
"165399380-0-23782";"Thragnar the Breaker. You've heard of me, of course."
"165399380-0-23798";"Those Reach dogs will think twice about messing with <<1>>!"
"165399380-0-23810";"I don't trust the Maulborn. Not one bit.\n\nAnd I bet they're behind the Serk situation. That wouldn't surprise me at all."
"165399380-0-23829";"The Reach forces were too much for us. I've never seen them in such numbers or working together."
"165399380-0-23844";"Thallik is pleased with my Reachmen for unleashing the giant, Sinmur. He has asked that you guard Vernim Wood while his priests perform rituals upon us."
"165399380-0-23845";"You see that thing? That's what's left of the Reachmen gathered at Vernim."
"165399380-0-23859";"I pray all is not lost."
"165399380-0-23877";"I save people!"
"165399380-0-23879";"Be careful, stranger! The farm isn't safe."
"165399380-0-23888";"You bear the implements of my thralls, yet skin and sinew drape your bones. \n\nYou're more than a wandering collection of ritual components. But what, precisely?"
"165399380-0-23933";"You've returned. With a number of dripping presents. Excellent work."
"165399380-0-23982";"We must hurry."
"165399380-0-24004";"This place is lost to time, wanderer. You could never understand its significance."
