"Location";"Source"
"188155806-0-1373";"Complete 7 heists from the Heist Board for the Thieves Guild."
"188155806-0-1374";"Complete 15 heists from the Heist Board for the Thieves Guild."
"188155806-0-1375";"Complete quest ""His Greatest Treasure"" in Hew's Bane."
"188155806-0-1376";"Complete quest ""That Which Was Lost"" in Hew's Bane."
"188155806-0-1377";"Complete quest ""Everyone Has A Price"" in Hew's Bane."
"188155806-0-1378";"Complete quest ""The One That Got Away"" in Hew's Bane."
"188155806-0-1379";"Steal the treasures on Kari's Hit List from every territory of the Aldmeri Dominion and place them in the Thieves Den."
"188155806-0-1380";"Steal the treasures on Kari's Hit List from every territory of the Daggerfall Covenant and place them in the Thieves Den."
"188155806-0-1381";"Steal the treasures on Kari's Hit List from every territory of the Ebonheart Pact and place them in the Thieves Den."
"188155806-0-1382";"Steal the treasure on Kari's Hit List from Abah's Landing and place it in the Thieves Den."
"188155806-0-1383";"Steal every treasure from Kari's Hit List and place them all within the Thieves Den."
"188155806-0-1385";"Defeat 25 Void Callers in the Maw of Lorkhaj."
"188155806-0-1386";"Defeat Rakkhat without anyone dying while afflicted by the Breath of Lorkhaj."
"188155806-0-1388";"In Veteran Maw of Lorkhaj, force Rakkhat into his final phase within two lunar cycles, then defeat him."
"188155806-0-1389";"Defeat Rakkhat in Veteran Maw of Lorkhaj, with a maximum of two players ever being afflicted by the Breath of Lorkhaj."
"188155806-0-1390";"Defeat Rakkhat in Veteran Maw of Lorkhaj, with at least three dro-m'Athra Dreadstalkers still alive."
"188155806-0-1391";"Complete all achievements related to defeating Rakkhat, Fang of Lorkhaj in Veteran Maw of Lorkhaj."
"188155806-0-1392";"Complete Veteran Maw of Lorkhaj without suffering a group member death."
"188155806-0-1393";"Come visit the Orcs' newly rebuilt capital city: Orsinium!"
"188155806-0-1394";"Successfully pick pockets at each of the four most popular shops in Abah's Landing."
"188155806-0-1395";"Discover and loot 1 Thieves Trove."
"188155806-0-1396";"Discover and loot 5 Thieves Troves."
"188155806-0-1397";"Discover and loot 15 Thieves Troves."
"188155806-0-1398";"Complete your first daily job from the Tip Board for the Thieves Guild."
"188155806-0-1399";"Complete 10 daily jobs from the Tip Board for the Thieves Guild."
"188155806-0-1400";"Complete 30 daily jobs from the Tip Board for the Thieves Guild."
"188155806-0-1401";"Assist each member of the Thieves Guild in resolving personal matters."
"188155806-0-1402";"Evade justice with the help of the ""Timely Escape"" Thieves Guild skill, as well as a friendly footpad."
"188155806-0-1403";"Complete 1 heist for the Thieves Guild without being detected."
"188155806-0-1404";"Receive the highest possible reward in 5 heists for the Thieves Guild."
"188155806-0-1405";"At each Outlaws Refuge within the Aldmeri Dominion, receive 4000 gold for fencing items."
"188155806-0-1406";"At each Outlaws Refuge within the Ebonheart Pact, receive 4000 gold for fencing items."
"188155806-0-1407";"At each Outlaws Refuge within the Daggerfall Covenant, receive 4000 gold for fencing items."
"188155806-0-1408";"Receive 4000 gold for fencing items at the Thieves Den in Abah's Landing."
"188155806-0-1409";"At each Outlaws Refuge within every Alliance territory, as well as the Thieves Den, receive 4000 gold for fencing items."
"188155806-0-1410";"Execute all targets listed in the Litany of Blood and collect your reward."
"188155806-0-1411";"Learn every chapter in the Trinimac style book, found by completing daily jobs for Guruzug in Morkul."
"188155806-0-1412";"Learn every chapter in the Malacath style book, found by completing daily jobs for Arzorag inside Skalar's Hostel."
"188155806-0-1413";"Travel to the notorious free port of Abah's Landing!"
"188155806-0-1414";"Learn every chapter in the Ebonheart Pact style book, found by Pact heroes in treasure chests in Cyrodiil and Imperial City."
"188155806-0-1415";"Learn every chapter in the Aldmeri Dominion style book, found by Dominion heroes in treasure chests in Cyrodiil and Imperial City."
"188155806-0-1416";"Learn every chapter in the Daggerfall Covenant style book, found by Covenant heroes in treasure chests in Cyrodiil and Imperial City."
"188155806-0-1417";"Learn every chapter in the Outlaw style book, found by defeating bosses in Hew's Bane."
"188155806-0-1418";"Learn the Soul Shriven style book, found by completing Cadwell's Silver."
"188155806-0-1419";"Defeat Limenauruus the possessed minotaur and the shadow spirits at Tribune's Folly."
"188155806-0-1420";"Enter the Kvatch Arena and defeat all challengers."
"188155806-0-1421";"Visit the Gold Coast and take in the local scenery."
"188155806-0-1422";"Learn every chapter in the Abah's Watch style book, found by completing Tip Board quests in the Thieves Guild."
"188155806-0-1423";"Learn every chapter in the Thieves Guild style book, found by completing Heists in the Thieves Guild."
"188155806-0-1424";"Learn every chapter in the Assassins League style book, found by defeating bosses in the Gold Coast."
"188155806-0-1425";"Defeat both world bosses in the Gold Coast."
"188155806-0-1426";"Explore and clear Hrota Cave."
"188155806-0-1427";"Explore and clear Garlas Agea."
"188155806-0-1428";"Discover and clear all caves and striking locales in the Gold Coast."
"188155806-0-1429";"Discover and clear both explorable caves in the Gold Coast."
"188155806-0-1430";"Discover all of the striking locales in the Gold Coast."
"188155806-0-1431";"Catch all 12 rare fish in the Gold Coast."
"188155806-0-1432";"Complete 14 unique story quests in the Gold Coast."
"188155806-0-1433";"Complete 17 unique story quests in the Gold Coast."
"188155806-0-1434";"Complete quests, defeat bosses, and explore delves to become the Bane of the Gold Coast."
"188155806-0-1435";"Join the Dark Brotherhood and complete the ""Voices in the Dark"" quest."
"188155806-0-1436";"Complete the ""Signed in Blood"" Dark Brotherhood quest in the Gold Coast."
"188155806-0-1437";"Complete the ""Welcome Home"" Dark Brotherhood quest in the Gold Coast."
"188155806-0-1438";"Complete the ""A Lesson in Silence"" Dark Brotherhood quest in the Gold Coast."
"188155806-0-1439";"Complete the ""Questions of Faith"" Dark Brotherhood quest in the Gold Coast."
"188155806-0-1440";"Complete the ""A Special Request"" Dark Brotherhood quest in the Gold Coast."
"188155806-0-1441";"Complete the ""Dark Revelations"" Dark Brotherhood quest in the Gold Coast."
"188155806-0-1442";"Complete the ""A Ghost from the Past"" Dark Brotherhood quest in the Gold Coast."
"188155806-0-1443";"Complete ""The Wrath of Sithis"" Dark Brotherhood quest in the Gold Coast."
"188155806-0-1444";"Complete the ""Filling the Void"" Dark Brotherhood quest in the Gold Coast."
"188155806-0-1445";"Complete your first Black Sacrament contract, as the Speaker commanded."
"188155806-0-1446";"Complete 7 Black Sacrament contracts, as the Speaker commanded."
"188155806-0-1447";"Complete 15 Black Sacrament contracts, as the Speaker commanded."
"188155806-0-1448";"Complete 5 Black Sacrament contracts at the highest possible reward level."
"188155806-0-1449";"Complete a Black Sacrament contract without being detected."
"188155806-0-1450";"Assassinate every target named by a Black Sacrament contract when commanded to by the Speaker."
"188155806-0-1451";"Complete your first murder contract from the ""Marked for Death"" tome."
"188155806-0-1452";"Complete 10 murder contracts from the ""Marked for Death"" tome."
"188155806-0-1453";"Complete 30 murder contracts from the ""Marked for Death"" tome."
"188155806-0-1454";"Closely observe the silent vigil of the Ayleid Sentinel at Beldaburo in the Gold Coast."
"188155806-0-1455";"Murder 20 innocents in the Gold Coast city of Kvatch."
"188155806-0-1456";"Murder 20 innocents in the Gold Coast city of Anvil."
"188155806-0-1457";"In the capital city of each Alliance, murder an innocent with the Blade of Woe."
"188155806-0-1458";"Aid each of the notable figures recently arrived on the Gold Coast."
"188155806-0-1459";"Murder your first innocent with the Blade of Woe."
"188155806-0-1460";"Murder 25 innocents with the Blade of Woe."
"188155806-0-1461";"Murder 100 innocents with the Blade of Woe."
"188155806-0-1462";"Defeat the Celestial Serpent in Veteran Sanctum Ophidia."
"188155806-0-1463";"Complete each achievement associated with the Speaker's Black Sacrament contracts."
"188155806-0-1464";"Learn every trait for each of the Alchemy reagents listed below."
"188155806-0-1465";"Learn all the traits for the Torchbug Thorax Alchemy reagent."
"188155806-0-1466";"Learn all the traits for the Beetle Scuttle Alchemy reagent."
"188155806-0-1467";"Learn all the traits for the Spider Egg Alchemy reagent."
"188155806-0-1468";"Learn all the traits for the Butterfly Wing Alchemy reagent."
"188155806-0-1469";"Learn all the traits for the Fleshfly Larva Alchemy reagent."
"188155806-0-1470";"Learn all the traits for the Scrib Jelly Alchemy reagent."
"188155806-0-1471";"Learn all the traits for the Nightshade Alchemy reagent."
"188155806-0-1472";"Learn all the traits for the Mudcrab Chitin Alchemy reagent."
"188155806-0-1474";"Defeat the Celestial Warrior in Veteran Hel Ra Citadel."
"188155806-0-1503";"Defeat the Celestial Mage in Veteran Aetherian Archive."
"188155806-0-1504";"Defeat Zatzu the Spine-Breaker, the Mighty Chudan, Xal-Nur the Slaver, and Tree-Minder Na-Kesh in the Ruins of Mazzatun."
"188155806-0-1505";"Defeat Zatzu the Spine-Breaker, the Mighty Chudan, Xal-Nur the Slaver, and Tree-Minder Na-Kesh in Veteran Ruins of Mazzatun."
"188155806-0-1506";"In Veteran Ruins of Mazzatun, defeat Tree-Minder Na-Kesh after enraging her by destroying her alchemical notes on Amber Plasm."
"188155806-0-1507";"Defeat Zatzu the Spine-Breaker, the Mighty Chudan, Xal-Nur the Slaver, and Tree-Minder Na-Kesh in Veteran Ruins of Mazzatun within 30 minutes of starting the dungeon. Timer starts on passing through the first archway."
"188155806-0-1508";"Defeat Zatzu the Spine-Breaker, the Mighty Chudan, Xal-Nur the Slaver, and Tree-Minder Na-Kesh in Veteran Ruins of Mazzatun without suffering a group member death."
"188155806-0-1509";"Defeat 50 Xit-Xaht Sludge-Slingers in Veteran Ruins of Mazzatun."
"188155806-0-1510";"Defeat 600 members of the Xit-Xaht tribe in Veteran Ruins of Mazzatun."
"188155806-0-1511";"Complete the listed achievements for Veteran Ruins of Mazzatun."
"188155806-0-1512";"Defeat Tree-Minder Na-Kesh after first eliminating all other enemies in Ruins of Mazzatun."
"188155806-0-1513";"Rescue all six of the Su-Zahleel Elders from the Ritual Chamber in Veteran Ruins of Mazzatun."
"188155806-0-1514";"Complete Ruins of Mazzatun without ever allowing a Sludge Slinger to empower one of its allies with Amber Plasm."
"188155806-0-1515";"Defeat the Mighty Chudan in Veteran Ruins of Mazzatun without any party members being hit by Bog Rush."
"188155806-0-1516";"Defeat Xal-Nur the Slaver in Veteran Ruins of Mazzatun without unleashing any Wamasu to assist you."
"188155806-0-1517";"Defeat Xal-Nur the Slaver in Veteran Ruins of Mazzatun with only one party member cleansing the Swamp Spice. Other party members may still touch the Swamp Spice."
"188155806-0-1518";"Defeat Tree-Minder Na-Kesh in Veteran Ruins of Mazzatun without any party members using the Reveal synergy to identify the real Avatar of the Hist."
"188155806-0-1519";"Defeat Tree-Minder Na-Kesh in Veteran Ruins of Mazzatun without any party members being struck by Blistering Amber."
"188155806-0-1520";"Enter either the Ruins of Mazzatun or the Cradle of Shadows for the first time."
"188155806-0-1522";"Defeat Sithera, Khephidaen the Spiderkith, the Votary of Velidreth, Dranos Velador, and Velidreth the Lady of Lace in the Cradle of Shadows."
"188155806-0-1523";"Defeat Sithera, Khephidaen the Spiderkith, the Votary of Velidreth, Dranos Velador, and Velidreth the Lady of Lace in Veteran Cradle of Shadows."
"188155806-0-1524";"Defeat Velidreth in Veteran Cradle of Shadows, after first enraging her by defiling her statue of Mephala."
"188155806-0-1525";"Defeat Sithera, Khephidaen the Spiderkith, the Votary of Velidreth, Dranos Velador, and Velidreth the Lady of Lace in Veteran Cradle of Shadows within 30 minutes of starting the dungeon. Timer starts on entering the initial caverns."
"188155806-0-1526";"Defeat Sithera, Khephidaen the Spiderkith, the Votary of Velidreth, Dranos Velador, and Velidreth the Lady of Lace in Veteran Cradle of Shadows without suffering a group member death."
"188155806-0-1527";"Destroy 50 statues of Velidreth's Devotion in Veteran Cradle of Shadows."
"188155806-0-1528";"Defeat 600 members of the Silken Ring or their Spiderkith allies in Veteran Cradle of Shadows."
"188155806-0-1529";"Complete the listed achievements for Veteran Cradle of Shadows."
"188155806-0-1530";"Pass through the spider caves in Veteran Cradle of Shadows without lighting more than two braziers."
"188155806-0-1531";"Defeat Khephidaen the Spiderkith in Veteran Cradle of Shadows without relighting any extinguished braziers."
"188155806-0-1532";"Defeat Dranos Velador in Veteran Cradle of Shadows without absorbing any orbs."
"188155806-0-1533";"Defeat Velidreth in Veteran Cradle of Shadows without any party members dying in the catacombs."
"188155806-0-1534";"Defeat Velidreth in Veteran Cradle of Shadows without using the Atronach's Light synergy."
"188155806-0-1535";"Defeat Velidreth in Veteran Cradle of Shadows without any party members being caught by her Shadow Sense."
"188155806-0-1536";"Defeat Velidreth in Cradle of Shadows without any party members being hit by venom sacs."
"188155806-0-1538";"Complete Veteran Cradle of Shadows and Veteran Ruins of Mazzatun."
"188155806-0-1539";"Drink the Witchmother's Brew during the Witches Festival."
"188155806-0-1540";"Earn your first Plunder Skull."
"188155806-0-1541";"Earn 50 Plunder Skulls."
"188155806-0-1542";"Earn 100 Plunder Skulls."
"188155806-0-1543";"Complete the Witchmother's Bargain quest."
"188155806-0-1545";"Learn every chapter of the Hollowjack style book, found in Witchly Gifts acquired when completing Witches Festival Writs, which can be obtained from Plunder Skulls during the Witches Festival."
"188155806-0-1546";"Complete the listed achievements for the Witches Festival."
"188155806-0-1548";"During the Mud Ball Merriment, share the joy of mud balls with each Alliance leader."
"188155806-0-1549";"Defeat Cell Haunter, Shadowrend, Angata the Clannfear Handler, the Skeletal Destroyer, and High Kinlord Rilis in Veteran Banished Cells I."
"188155806-0-1550";"Defeat 350 Skeletons in Veteran Banished Cells I."
"188155806-0-1551";"Defeat 100 Daedra in Veteran Banished Cells I."
"188155806-0-1552";"Defeat Cell Haunter, Shadowrend, Angata the Clannfear Handler, the Skeletal Destroyer, and High Kinlord Rilis in Veteran Banished Cells I, all within twenty minutes. Timer starts when a group member enters the first hallway."
"188155806-0-1553";"Defeat Cell Haunter, Shadowrend, Angata the Clannfear Handler, the Skeletal Destroyer, and High Kinlord Rilis in Veteran Banished Cells I, without suffering a group member death."
"188155806-0-1554";"Defeat High Kinlord Rilis in Veteran Banished Cells I, after invoking the Scroll of Glorious Battle."
"188155806-0-1555";"Defeat Keeper Areldur, the Maw of the Infernal, Keeper Voranil, Keeper Imiril, Sister Sihna and Sister Vera, and High Kinlord Rilis in Banished Cells II."
"188155806-0-1556";"Defeat Tazkad the Packmaster, War Chief Ozozai, Broodbirther, Clatterclaw, and Kra'gh the Dreugh King in Veteran Fungal Grotto I."
"188155806-0-1557";"Defeat 450 Goblins in Veteran Fungal Grotto I."
"188155806-0-1558";"Defeat 50 Dreugh in Veteran Fungal Grotto I."
"188155806-0-1559";"Defeat Tazkad the Packmaster, War Chief Ozozai, Broodbirther, Clatterclaw and Kra'gh the Dreugh King in Veteran Fungal Grotto I, all within 15 minutes. Timer starts when any player enters the tunnel after the first group of Goblins."
"188155806-0-1560";"Defeat Tazkad the Packmaster, War Chief Ozozai, Broodbirther, Clatterclaw and Kra'gh the Dreugh King in Veteran Fungal Grotto I, without suffering a group member death."
"188155806-0-1561";"Defeat the Dreugh King in Veteran Fungal Grotto I, after invoking the Scroll of Glorious Battle."
"188155806-0-1562";"Defeat Mephala's Fang, Gamyne Bandu, Ciirenas the Shepherd, the Spawn of Mephala, Reggr Dark-Dawn, and Vila Theran in Fungal Grotto II."
"188155806-0-1563";"Defeat Mephala's Fang, Gamyne Bandu, Ciirenas the Sheperd, Spawn of Mephala, Reggr Dark-Dawn, and Vila Theran in Veteran Fungal Grotto II, without suffering a group member death."
"188155806-0-1564";"Defeat Keepers Imiril, Areldur, and Voranil, as well as the Maw of the Infernal and the Sisters Sihna and Vera, before defeating High Kinlord Rilis in Veteran Banished Cells II, without suffering a group member death."
"188155806-0-1565";"Defeat Spindlekin, the Swarm Mother, Cerise the Widow-Maker, Big Rabbu, and the Whisperer in Veteran Spindleclutch I."
"188155806-0-1566";"Defeat 600 Spiders in Veteran Spindleclutch I."
"188155806-0-1567";"Defeat 350 Corrupted in Veteran Spindleclutch I."
"188155806-0-1568";"Defeat the Swarm Mother and the Whisperer in Veteran Spindleclutch I within twenty minutes of starting the dungeon. Timer starts when players engage the first group of spiders."
"188155806-0-1569";"Defeat the Swarm Mother and the Whisperer in Veteran Spindleclutch I, without suffering a group member death."
"188155806-0-1570";"Defeat the Whisperer in Veteran Spindleclutch I, after invoking the Scroll of Glorious Battle."
"188155806-0-1571";"Defeat Mad Martine, Bloodspawn, Praxin Douare, the Flesh Atronach Trio, Urvan Veleth, and Vorenor Winterbourne in Spindleclutch II."
"188155806-0-1572";"Defeat Mad Mortine, Bloodspawn, Praxin Douare, the Flesh Atronach trio, Urvan Veleth, and Vorenor Winterbourne in Veteran Spindleclutch II, without suffering a group member death."
"188155806-0-1573";"Defeat Akash gra-Mal, the Ancient Spriggan, Chokethorn, Nenesh gro-Mal, Leafseether, and Canonreeve Oraneth in Veteran Elden Hollow I."
"188155806-0-1574";"Defeat 400 Darkfern Orcs in Veteran Elden Hollow I."
"188155806-0-1575";"Defeat 100 Alit in Veteran Elden Hollow I."
"188155806-0-1576";"Defeat Akash gra-Mal, the Ancient Spriggan, Chokethorn, Nenesh gro-Mal, Leafseether, and Canonreeve Oraneth in Veteran Elden Hollow I within twenty minutes of starting the dungeon. Timer starts when players engage the first group of Thalmor."
"188155806-0-1577";"Defeat Akash gra-Mal, the Ancient Spriggan, Chokethorn, Nenesh gro-Mal, Leafseether, and Canonreeve Oraneth in Veteran Elden Hollow I, without suffering a group member death."
"188155806-0-1578";"Defeat Canonreeve Oraneth in Veteran Elden Hollow I, after invoking the Scroll of Glorious Battle."
"188155806-0-1579";"Defeat Dubroze the Infest, Dark Root, Azara the Frightener, Murklight, the Shadow Guard, and Bogdan the Nightflame in Elden Hollow II."
"188155806-0-1580";"Defeat Dubroze the Infestor, Dark Root, Azara the Frightener, Murklight, the Shadow Guard, and Bogdan the Nightflame, without suffering a group member death."
"188155806-0-1581";"Defeat Head Shepard Neloren, Foreman Llothan, the Hive Lord, the Cavern Patriarch, the Sentinel of Rkugamz, and the Cutting Sphere in Veteran Darkshade Caverns I."
"188155806-0-1582";"Defeat 175 Pit Rat Thugs in Veteran Darkshade Caverns I."
"188155806-0-1583";"Defeat 300 Kwama in Veteran Darkshade Caverns I."
"188155806-0-1584";"Defeat Head Shepard Neloren, Foreman Llothan, the Hive Lord, the Cavern Patriarch, the Sentinel of Rkugamz, and the Cutting Sphere  in Veteran Darkshade Caverns I within twenty minutes of starting the dungeon. Timer starts when a group member descends into the caverns."
"188155806-0-1585";"Defeat Head Shepard Neloren, Foreman Llothan, the Hive Lord, the Cavern Patriarch, the Sentinel of Rkugamz, and the Cutting Sphere in Veteran Darkshade Caverns I, without suffering a group member death."
"188155806-0-1586";"Defeat the Sentinel of Rkugamz in Veteran Darkshade Caverns I, after invoking the Scroll of Glorious Battle."
"188155806-0-1587";"Defeat the Fallen Foreman, Transmuted Hive Lord, Transmuted Alit, Grobull the Transmuted, the Engine Garrison, and the Engine Guardian in Darkshade Caverns II."
"188155806-0-1588";"Defeat the Fallen Foreman, Transmuted Hive Lord, Transmuted Alit, Grobull the Transmuted, the Engine Garrison, and the Engine Guardian in Veteran Darkshade Caverns II, without suffering a group member death."
"188155806-0-1589";"Defeat Slimecraw, Investigator Garron, the Rat Whisperer, Uulgarg the Hungry, Varain Pellingare, and Allene Pellingare in Veteran Wayrest Sewers I."
"188155806-0-1590";"Defeat 800 Skeevers in Veteran Wayrest Sewers I."
"188155806-0-1591";"Defeat 500 Pellingare Mercenaries in Veteran Wayrest Sewers I."
"188155806-0-1592";"Defeat Slimecraw, Investigator Garron, the Rat Whisperer, Uulgarg the Hungry, Varaine Pellingare, and Allene Pellingare in Veteran Wayrest Sewers I, all within fifteen minutes of starting the dungeon. Timer starts when any player enters the first tunnel to the right of the entrance chamber."
"188155806-0-1593";"Defeat Slimecraw, Investigator Garron, the Rat Whisperer, Uulgarg the Hungry, Varaine Pellingare, and Allene in Veteran Wayrest Sewers I, without suffering a group member death."
"188155806-0-1594";"Defeat Allene Pellingare in Veteran Wayrest Sewers I, after invoking the Scroll of Glorious Battle."
"188155806-0-1595";"Defeat Malubeth the Scourger, Skull Reaper, Uulgarg the Risen, Garron the Returned, the Forgotten One, and Varaine and Allene Pellingare in Wayrest Sewers II."
"188155806-0-1596";"Defeat Malubeth the Scourger, Garron the Returned, and Varaine and Allene Pellingare in Veteran Wayrest Sewers II, without suffering a group member death."
"188155806-0-1597";"Defeat the Infernal Guardian, Golor the Banekin Handler, the Warden of the Shrine, the Dark Ember, Rothariel Flameheart, and Razor Master Erthas in Veteran City of Ash I."
"188155806-0-1598";"Defeat 550 Banekin in Veteran City of Ash I."
"188155806-0-1599";"Defeat 60 Flame Atronach in Veteran City of Ash I."
"188155806-0-1600";"Defeat the Infernal Guardian, the Warden of the Shrine, and Razor Master Erthas in Veteran City of Ash I within twenty minutes of starting the dungeon. Timer starts when players engage the first group of Daedra."
"188155806-0-1601";"Defeat the Infernal Guardian, the Warden of the Shrine, and Razor Master Erthas in Veteran City of Ash I, without suffering a group member death."
"188155806-0-1602";"Defeat Razor Master Erthas in Veteran City of Ash I, after invoking the Scroll of Glorious Battle."
"188155806-0-1603";"Defeat Horvantud the Fire Maw, the Ash Titan, and Valkyn Skoria in City of Ash II."
"188155806-0-1604";"Complete Veteran Arx Corinium by defeating the Fanged Menace, Ganakton the Tempest, Sliklenia the Songstress, Matron Ixniaa, the Ancient Lurcher, and Sellistrix the Lamia Queen."
"188155806-0-1605";"Defeat 400 Lamias in Veteran Arx Corinium."
"188155806-0-1606";"Defeat 175 Giant Snakes in Veteran Arx Corinium."
"188155806-0-1607";"Defeat the Fanged Menace, Ganakton the Tempest, Sliklenia the Songstress, Matron Ixniaa, the Ancient Lurcher, and Sellistrix the Lamia Queen in Veteran Arx Corinium within twenty minutes of starting the dungeon. Timer starts when players engage the first group of nesting serpents."
"188155806-0-1608";"Defeat the Fanged Menace, Ganakton the Tempest, Sliklenia the Songstress, Matron Ixniaa, the Ancient Lurcher, and Sellistrix the Lamia Queen in Veteran Arx Corinium, without suffering a group member death."
"188155806-0-1609";"Defeat Sellistrix the Lamia Queen in Veteran Arx Corinium, after invoking the Scroll of Glorious Battle."
"188155806-0-1610";"Defeat the Mage Master, Archmaster Siniel, Death's Leviathan, Uulkar Bonehand, Dogas the Berserker, and the Ilambris Twins in Veteran Crypt of Hearts I."
"188155806-0-1611";"Defeat 400 Zombies in Veteran Crypt of Hearts I."
"188155806-0-1612";"Defeat 400 Skeletons in Veteran Crypt of Hearts I."
"188155806-0-1613";"Defeat the Mage Master, Archmaster Siniel, Death's Leviathan, Uulkar Bonehand, Dogas the Berserker, and the Ilambris Twins in Veteran Crypt of Hearts I within twenty minutes of starting the dungeon. Timer starts when players engage the first group of undead."
"188155806-0-1614";"Defeat the Mage Master, Archmaster Siniel, Death's Leviathan, Uulkar Bonehand, Dogas the Berserker, and the Ilambris Twins in Veteran Crypt of Hearts I, without suffering a group member death."
"188155806-0-1615";"Defeat the Ilambris Twins in Veteran Crypt of Hearts I, after invoking the Scroll of Glorious Battle."
"188155806-0-1616";"Defeat Ibelgast, Ruzozuzalpamaz, the Chamber Guardian, the Brothers Ilambris and the Ilambris Amalgam, Mezeluth, and Nerien'eth in Crypt of Hearts II."
"188155806-0-1617";"Complete Veteran Tempest Island by defeating Sonolia the Matriarch, Valaran Stormcaller, Yalorasse the Speaker, Stormfist, Commodore Ohmanil, and Stormreeve Neidir."
"188155806-0-1618";"Defeat 600 Lamias in Veteran Tempest Island."
"188155806-0-1619";"Defeat 550 Sea Vipers in Veteran Tempest Island."
"188155806-0-1620";"Defeat Sonolia the Matriarch, Valaran Stormcaller, Yalorasse the Speaker, Stormfist, Commodore Ohmanil, and Stormreeve Neidir in Veteran Tempest Island within twenty minutes of starting the dungeon. Timer starts when players engage the first group of Lamia."
"188155806-0-1621";"Defeat Sonolia the Matriarch, Valaran Stormcaller, Yalorasse the Speaker, Stormfist, Commodore Ohmanil, and Stormreeve Neidir in Veteran Tempest Island, without suffering a group member death."
"188155806-0-1622";"Defeat Stormreeve Neidir in Veteran Tempest Island, after invoking the Scroll of Glorious Battle."
