"Location";"Source"
"188155806-0-2165";"Defeat all encounters in addition to the Wyrd Sisters, Aghaedh of the Solstice, Dagrund the Bulky, Tarcyr, and Balorgh in Veteran March of Sacrifices in under 30 minutes. Timer starts when players jump or teleport into Bloodscent Pass."
"188155806-0-2166";"Defeat all encounters in addition to the Wyrd Sisters, Aghaedh of the Solstice, Dagrund the Bulky, Tarcyr, and Balorgh in Veteran March of Sacrifices without suffering a group member death."
"188155806-0-2167";"Complete the listed achievements for Veteran March of Sacrifices."
"188155806-0-2168";"Defeat all encounters in addition to the Wyrd Sisters, Aghaedh of the Solstice, Dagrund the Bulky, Tarcyr, and Balorgh after desecrating the Moon Hunter Pack's Banner in Veteran March of Sacrifices within 30 minutes without suffering a group member death."
"188155806-0-2170";"Complete Veteran Moon Hunter Keep and Veteran March of Sacrifices."
"188155806-0-2171";"Completed Bailiff Naramin's investigation of Choixth."
"188155806-0-2178";"Complete 10 Abyssal Geysers."
"188155806-0-2179";"Complete 25 Abyssal Geysers."
"188155806-0-2180";"Complete 50 Abyssal Geysers."
"188155806-0-2181";"Defeat three of the champions in Karnwasten."
"188155806-0-2182";"Defeat three of the champions in Sunhold."
"188155806-0-2183";"Win 5 PvP duels in the Colosseum of the Old Ways on Artaeum."
"188155806-0-2184";"Defeat Ruella Many-Claws at an Abyssal Geyser."
"188155806-0-2185";"Defeat Churug of the Abyss at an Abyssal Geyser."
"188155806-0-2186";"Learn every chapter in the Psijic Order style book, found by defeating bosses and opening treasure chests in Summerset."
"188155806-0-2187";"Learn every chapter in the Sapiarch style book, occasionally found as rewards for completing daily jobs for the Divine Prosecution."
"188155806-0-2188";"Learn every chapter of the Dremora style book, found in Dremora Plunder Skulls, earned by participating in the Witches Festival."
"188155806-0-2189";"Learn every chapter in the Scalecaller style book, occasionally found as rewards for completing the Scalecaller Peak dungeon."
"188155806-0-2190";"Learn every chapter in the Fang Lair style book, occasionally found as rewards for completing the Fang Lair dungeon."
"188155806-0-2191";"Catch all 12 rare fish in Summerset."
"188155806-0-2193";"Complete quests, defeat bosses, and explore delves to become the Savior of Summerset."
"188155806-0-2194";"Stop the conspiracy sowing chaos through Summerset, protect the Crystal Tower, and forge a new alliance to restore the Isles to order."
"188155806-0-2195";"Complete your first Divine Prosecution Assignment from Justiciar Tanorian."
"188155806-0-2196";"Complete ten Divine Prosecution Assignments from Justiciar Tanorian."
"188155806-0-2197";"Complete thirty Divine Prosecution Assignments from Justiciar Tanorian."
"188155806-0-2198";"Complete your first Divine Prosecution Assignment from Justiciar Farowel."
"188155806-0-2199";"Complete ten Divine Prosecution Assignments from Justiciar Farowel."
"188155806-0-2200";"Complete thirty Divine Prosecution Assignments from Justiciar Farowel."
"188155806-0-2201";"Complete the ""The Queen's Decree"" quest."
"188155806-0-2202";"Complete the ""A Pearl of Great Price"" quest."
"188155806-0-2203";"Complete the ""Buried Memories"" quest."
"188155806-0-2204";"Complete the ""The Tower Sentinels"" quest."
"188155806-0-2205";"Complete the ""The Dreaming Cave"" quest."
"188155806-0-2206";"Complete the ""Lost in Translation"" quest."
"188155806-0-2207";"Complete the ""A Necessary Alliance"" quest."
"188155806-0-2208";"Complete the ""The Crystal Tower"" quest."
"188155806-0-2209";"Complete 33 unique quests in Summerset."
"188155806-0-2210";"Complete ""The Towers' Fall"" Psijic Order quest in Summerset."
"188155806-0-2211";"Learn the fate of the Lost Sailor."
"188155806-0-2212";"Defeat Keelsplitter without stepping on any of the snakes."
"188155806-0-2213";"Defeat Sheefar of the Depths at an Abyssal Geyser."
"188155806-0-2214";"Learn the art of Jewelry Crafting. This can be learned in the Summerset Isle or by owning the Summerset chapter and interacting with a Jewelry Crafting Station."
"188155806-0-2215";"Attain a Jewelry Crafting rank of 50."
"188155806-0-2216";"Improve Jewelry Crafting items to all available Qualities."
"188155806-0-2217";"Harvest your first unit of Ochre."
"188155806-0-2218";"Harvest 25 units of Ochre."
"188155806-0-2219";"Harvest 100 units of Ochre."
"188155806-0-2220";"Defeat Girawell the Erratic at an Abyssal Geyser."
"188155806-0-2221";"Defeat Muustikar Wave-Eater at an Abyssal Geyser."
"188155806-0-2222";"Defeat Reefhammer at an Abyssal Geyser."
"188155806-0-2223";"Research a Trait for any jewelry type."
"188155806-0-2224";"Research every Jewelry Trait at least once, regardless of whether from a ring or necklace."
"188155806-0-2225";"Become certified in Jewelry Crafting. Find this quest in the Summerset Isles."
"188155806-0-2226";"Earn the rank 50 achievements for all the crafting professions."
"188155806-0-2227";"Earn each of the following achievements:"
"188155806-0-2228";"Collect and learn 10 full motifs."
"188155806-0-2229";"Collect and learn 25 full motifs."
"188155806-0-2230";"Collect and learn 50 full motifs."
"188155806-0-2231";"Defeat Z'Maja with each group member picking up and destroying only one Malevolent Core in Veteran Cloudrest."
"188155806-0-2232";"While battling Z'Maja with all three of the Welkynars' shades by her side, a player with the Hoarfrost affliction and two other players with the Voltaic Overload affliction share the damage of the Roaring Flare eruption in Veteran Cloudrest."
"188155806-0-2233";"While battling Z'Maja with Siroria's shade by her side, utilize a Roaring Flare attack and achieve 20 killing blows against Shadows of the Fallen in Veteran Cloudrest."
"188155806-0-2234";"While battling Z'Maja, after activating a single Welkynar's Light, activate two more Welkynar's Lights and destroy three Malevolent Cores within the next 6 seconds in Veteran Cloudrest."
"188155806-0-2235";"While battling Z'Maja during a single Shadow World event, prevent all yaghra from entering the gateway and crossing into the mortal realm on 15 separate occasions in Cloudrest."
"188155806-0-2236";"Have Galenwe's shade destroy 20 roaming Hoarfrost cyclones with his Spiked Ice attack in Cloudrest."
"188155806-0-2237";"While battling Relequen's shade by itself, no player is hit by Voltaic Overload and no player spreads Voltaic Current to other players throughout the entire encounter in Cloudrest."
"188155806-0-2238";"While battling Siroria's shade by itself, every Roaring Flare throughout the entire encounter must be split between at least 6 players in Cloudrest."
"188155806-0-2240";"Catch all 3 rare fish in Artaeum."
"188155806-0-2241";"Defeat Darkstorm the Alluring at an Abyssal Geyser."
"188155806-0-2242";"Defeat Eejoba the Radiant at an Abyssal Geyser."
"188155806-0-2243";"Defeat Tidewrack at an Abyssal Geyser."
"188155806-0-2244";"Defeat Vsskalvor at an Abyssal Geyser."
"188155806-0-2245";"Capture 15 farms, mines, or lumbermills during Whitestrake's Mayhem."
"188155806-0-2246";"Earn 25 Medals in Battlegrounds during Whitestrake's Mayhem."
"188155806-0-2247";"Kill a Trove Scamp in Imperial City Sewers during Whitestrake's Mayhem."
"188155806-0-2248";"Defeat all the Patrolling Horrors in the Imperial City during Whitestrake's Mayhem."
"188155806-0-2249";"Complete ""The Psijics' Calling"" Psijic Order quest in Summerset."
"188155806-0-2250";"Complete the ""Breaches on the Bay"" Psijic Order quest in Summerset."
"188155806-0-2251";"Complete the ""Breaches of Frost and Fire"" Psijic Order quest in Summerset."
"188155806-0-2252";"Complete ""The Shattered Staff"" Psijic Order quest in Summerset."
"188155806-0-2253";"Complete the ""A Breach Amid the Trees"" Psijic Order quest in Summerset."
"188155806-0-2254";"Complete the ""A Time for Mud and Mushrooms"" Psijic Order quest in Summerset."
"188155806-0-2255";"Complete ""The Towers' Remains"" Psijic Order quest in Summerset."
"188155806-0-2256";"Complete the ""Time in Doomcrag's Shadow"" Psijic Order quest in Summerset."
"188155806-0-2257";"Complete the ""A Breach Beyond the Crags"" Psijic Order quest in Summerset."
"188155806-0-2258";"Defeat 200 Rieklings in Veteran Frostvault."
"188155806-0-2259";"Defeat 20 Centurions in Veteran Frostvault."
"188155806-0-2260";"Defeat Icestalker, Warlord Tzogvin, the Vault Protector, Rizzuk Bonechill, and the Stonekeeper in Frostvault."
"188155806-0-2261";"Defeat Icestalker, Warlord Tzogvin, the Vault Protector, Rizzuk Bonechill, and the Stonekeeper in Veteran Frostvault."
"188155806-0-2262";"Defeat the Stonekeeper after pressing the Veracity Verifier in Veteran Frostvault."
"188155806-0-2263";"Defeat all encounters in addition to Icestalker, Warlord Tzogvin, the Vault Protector, Rizzuk Bonechill, and the Stonekeeper within 30 minutes of entering Veteran Frostvault. Your timer starts upon entering combat."
"188155806-0-2264";"Defeat all encounters in addition to Icestalker, Warlord Tzogvin, the Vault Protector, Rizzuk Bonechill, and the Stonekeeper in Veteran Frostvault without suffering a group member death."
"188155806-0-2265";"Enter either Frostvault or Depths of Malatar for the first time."
"188155806-0-2266";"Complete the listed achievements for Veteran Frostvault."
"188155806-0-2267";"Defeat all encounters in addition to Icestalker, Warlord Tzogvin, the Vault Protector, Rizzuk Bonechill, and the Stonekeeper after using the Veracity Verifier in Veteran Frostvault within 30 minutes without suffering a group member death."
"188155806-0-2268";"Defeat 350 of Meridia's Purified in Veteran Depths of Malatar."
"188155806-0-2269";"Defeat 150 Stone Watchers in Veteran Depths of Malatar."
"188155806-0-2270";"Defeat the Scavenging Maw, the Weeping Woman, the Dark Orb, King Narilmor, and the Symphony of Blades in Depths of Malatar."
"188155806-0-2271";"Defeat the Scavenging Maw, the Weeping Woman, the Dark Orb, King Narilmor, and the Symphony of Blades in Veteran Depths of Malatar."
"188155806-0-2272";"Defeat the Symphony of Blades after destroying the Dictates of the Lady of Light in Veteran Depths of Malatar."
"188155806-0-2273";"Defeat the Scavenging Maw, the Weeping Woman, the Dark Orb, King Narilmor, and the Symphony of Blades within 30 minutes of entering Veteran Depths of Malatar. Your timer starts on entering combat."
"188155806-0-2274";"Defeat the Scavenging Maw, the Weeping Woman, the Dark Orb, King Narilmor, and the Symphony of Blades without suffering a group member death in Veteran Depths of Malatar."
"188155806-0-2275";"Complete the listed achievements for Veteran Depths of Malatar."
"188155806-0-2276";"Defeat the Scavenging Maw, the Weeping Woman, the Dark Orb, King Narilmor, and the Symphony of Blades after destroying the Dictates of the Lady of Light in Veteran Depths of Malatar within 30 minutes without suffering a group member death."
"188155806-0-2277";"Complete both Frostvault and Depths of Malatar in Veteran."
"188155806-0-2285";"Learn every chapter in the Pyandonean style book, occasionally found by fishing in Summerset."
"188155806-0-2286";"Explore and clear Tsofeer Cavern."
"188155806-0-2287";"Explore and clear the Teeth of Sithis."
"188155806-0-2288";"Discover and clear all caves and striking locales in Murkmire."
"188155806-0-2289";"Discover and clear both explorable caves in Murkmire."
"188155806-0-2290";"Discover all of the striking locales in Murkmire."
"188155806-0-2291";"Discover all 6 Skyshards in Murkmire."
"188155806-0-2292";"Defeat both world bosses in Murkmire."
"188155806-0-2293";"Defeat the necromancer Baxilt-Gah at Bok-Xul."
"188155806-0-2294";"Defeat the miregaunt Walks-Like-Thunder at the Echoing Hollow."
"188155806-0-2295";"Catch all 12 rare fish in Murkmire."
"188155806-0-2297";"Defeat Mylenne Moon-Caller without cleansing her Enrage ability in Veteran Moon Hunter Keep."
"188155806-0-2298";"Defeat Archivist Ernarde without killing his first Hulking Werewolf ally in Moon Hunter Keep."
"188155806-0-2299";"Defeat the Archivist without taking group member damage from Symbols of Xarxes in Moon Hunter Keep."
"188155806-0-2300";"Defeat Vykosa the Ascendant without any party member taking damage from her restrained wolf pet in Veteran Moon Hunter Keep."
"188155806-0-2301";"Defeat Vykosa the Ascendant after reading the Scroll of Glorious Battle, defeating 7 Stranglers, and never causing her pet wolves to cower in Veteran Moon Hunter Keep."
"188155806-0-2302";"Complete all three Golden Indrik Hunts and gain their boons within March of Sacrifices."
"188155806-0-2303";"Defeat Aghaedh of the Solstice while making sure to defeat all of her Lurchers within their primary season in Veteran March of Sacrifices."
"188155806-0-2304";"Defeat Dagrund the Bulky while always dodging his Upheaval ability in Veteran March of Sacrifices."
"188155806-0-2305";"Defeat Tarcyr without the indrik teleporting any group members during its Shrouding Mist ability in Veteran March of Sacrifices."
"188155806-0-2306";"Lead Balorgh into Tharas' Trap 10 times in March of Sacrifices."
"188155806-0-2307";"Defeat Jailer Melitus without being damaged by Bloody Geysers in Moon Hunter Keep."
"188155806-0-2308";"Defeat Hedge Maze Guardian without any group member being caught by a Strangler Snare within the Moon Hunter Keep Gardens in Veteran Moon Hunter Keep."
"188155806-0-2309";"Defeat Hedge Maze Guardian while all party members avoid its Lurcher Roots attack in Veteran Moon Hunter Keep."
"188155806-0-2310";"Defeat the Wyrd Sisters while preventing them from ever using their auras to augment each other in Veteran March of Sacrifices."
"188155806-0-2311";"Defeat Balorgh while avoiding both Lightning Water and Poison Plants in Veteran March of Sacrifices."
"188155806-0-2312";"Defeat Balorgh after desecrating the Moon Hunter Pack's banner and without being hit by his Fire Remnant ability for the duration of the encounter in Veteran March of Sacrifices."
"188155806-0-2313";"Use the Witchmother's Cauldron summoned from the Witchmother's Whistle 10 times."
"188155806-0-2314";"Kill 100 Skeletons while under the effects of the Witchmother's Brew during the Witches Festival."
"188155806-0-2315";"Eat each of these Witches Festival foods during the Witches Festival."
"188155806-0-2316";"Acquire one of each type of Plunder Skull during the Witches Festival."
"188155806-0-2317";"Learn every chapter in the Huntsman style book, occasionally found as rewards for completing the March of Sacrifices dungeon."
"188155806-0-2318";"Learn every chapter in the Silver Dawn style book, occasionally found as rewards for completing the Moon Hunter Keep dungeon."
"188155806-0-2319";"Learn every chapter in the Welkynar style book, occasionally found as rewards for completing the Cloudrest Trial."
"188155806-0-2320";"Collect and restore all the stone tablets in the Xinchei-Konu, an ancient Argonian calendar."
"188155806-0-2321";"Defeat the four miregaunts who have swallowed Xinchei-Konu tablets."
"188155806-0-2322";"Help Cyrodilic Collections stop Margus Derius and prepare for expeditions to Murkmire."
"188155806-0-2323";"Complete a daily job for Jee-Lar to help Cyrodilic Collections prepare for their expedition to Murkmire."
"188155806-0-2324";"Complete 10 daily jobs for Jee-Lar to help Cyrodilic Collections prepare for their expedition to Murkmire."
"188155806-0-2325";"Complete 30 daily jobs for Jee-Lar to help Cyrodilic Collections prepare for their expedition to Murkmire."
"188155806-0-2330";"Get to know the Shadowscale with peculiar interest in your activities in Murkmire."
"188155806-0-2331";"Complete quests, defeat bosses, and explore delves to become the Hero of Murkmire."
"188155806-0-2332";"Complete 20 unique story quests in Murkmire."
"188155806-0-2333";"Complete the ""Sunken Treasure"" quest."
"188155806-0-2334";"Complete the ""Missing in Murkmire"" quest."
"188155806-0-2335";"Complete the ""Whispers in the Wood"" quest."
"188155806-0-2336";"Complete the ""Death and Dreaming"" quest."
"188155806-0-2337";"Complete the ""The Swamp and the Serpent"" quest."
"188155806-0-2338";"Complete the ""The Remnant of Argon"" quest."
"188155806-0-2339";"Complete the ""By River and Root"" quest."
"188155806-0-2340";"Travel to Lilmoth in Murkmire."
"188155806-0-2341";"Read the five poems written by Nisswo Xeewulm, located near Sithis Shrines throughout Murkmire."
"188155806-0-2342";"Kill 100 Voriplasms in Murkmire."
"188155806-0-2343";"Harvest a Scuttle Bloom and disarm a Gas Blossom, Static Pitcher, Catapult Cabbage, and Lantern Mantis."
"188155806-0-2344";"Complete 1 delve daily job for Varo Hosidias in Lilmoth within the Murkmire zone."
"188155806-0-2345";"Complete 10 delve daily jobs for Varo Hosidias in Lilmoth within the Murkmire zone."
"188155806-0-2346";"Complete 30 delve daily jobs for Varo Hosidias in Lilmoth within the Murkmire zone."
"188155806-0-2347";"Complete 1 world boss daily job for Bolu in Lilmoth within the Murkmire zone."
"188155806-0-2348";"Complete 10 world boss daily jobs for Bolu in Lilmoth within the Murkmire zone."
"188155806-0-2349";"Complete 30 world boss daily jobs for Bolu in Lilmoth within the Murkmire zone."
"188155806-0-2350";"Complete 1 solo daily job for Tuwul in Root-Whisper Village within the Murkmire zone."
"188155806-0-2351";"Complete 10 solo daily jobs for Tuwul in Root-Whisper Village within the Murkmire zone."
"188155806-0-2352";"Complete 30 solo daily jobs for Tuwul in Root-Whisper Village within the Murkmire zone."
"188155806-0-2353";"Help the Bright-Throats assure the future of their tribe."
"188155806-0-2354";"Help the Dead-Water follow their chosen path."
"188155806-0-2355";"Befriend the Bright-Throat, Dead-Water, and Root-Whisper tribes by offering them aid in times of need."
"188155806-0-2357";"Read the six Vine-Tongue books by activating various vine-tongues throughout Murkmire."
"188155806-0-2358";"Rescue villagers in peril from four different tribes throughout Murkmire."
"188155806-0-2359";"Learn every chapter in the Honor Guard style book, occasionally found as rewards for completing Blackrose Prison."
"188155806-0-2360";"Learn every chapter in the Dead-Water style book, occasionally found as rewards for completing daily jobs to defeat world bosses, explore delves in Murkmire, and help rebuild Root-Whisper Village."
"188155806-0-2361";"Learn every chapter in the Elder Argonian style book, occasionally found as rewards for completing daily jobs to defeat world bosses, explore delves in Murkmire, and help rebuild Root-Whisper Village."
"188155806-0-2362";"Defeat Battlemage Ennodius, Tames-the-Beast, Lady Minara, and Drakeeh the Unchained in Blackrose Prison."
"188155806-0-2363";"Defeat Battlemage Ennodius, Tames-the-Beast, Lady Minara, and Drakeeh the Unchained in Veteran Blackrose Prison."
"188155806-0-2364";"Defeat Battlemage Ennodius, Tames-the-Beast, Lady Minara, and Drakeeh the Unchained in Veteran Blackrose Prison without using Sigils during combat."
"188155806-0-2365";"Defeat Battlemage Ennodius, Tames-the-Beast, Lady Minara, and Drakeeh the Unchained in Veteran Blackrose Prison without dying."
"188155806-0-2366";"Defeat Battlemage Ennodius, Tames-the-Beast, Lady Minara, and Drakeeh the Unchained in Veteran Blackrose Prison in under 30 minutes. The timer starts when the first arena begins."
"188155806-0-2367";"Defeat Battlemage Ennodius, Tames-the-Beast, Lady Minara, and Drakeeh the Unchained in Veteran Blackrose Prison in under 40 minutes without dying. The timer starts when the first arena begins."
"188155806-0-2368";"Defeat Battlemage Ennodius, Tames-the-Beast, Lady Minara, and Drakeeh the Unchained in Veteran Blackrose Prison in under 40 minutes without dying and without activating Sigils during combat. The timer starts when the first arena begins."
"188155806-0-2369";"Defeat Battlemage Ennodius without group members taking flame damage while her Flame Spouts ability is active in Veteran Blackrose Prison."
"188155806-0-2370";"Defeat Tames-the-Beast without a group member becoming trapped by the Crushing Roots ability in Veteran Blackrose Prison."
"188155806-0-2371";"Defeat Lady Minara after three Bone Colossi are summoned within 30 seconds of the round beginning in Veteran Blackrose Prison."
"188155806-0-2372";"Defeat Battlemage Ennodius, Lady Minara, and Tames-the-Beast within 20 seconds of each other in Veteran Blackrose Prison."
"188155806-0-2373";"Defeat Drakeeh the Unchained while always ensuring he absorbs at least 2 spirits before casting Spirit Scream in Veteran Blackrose Prison."
"188155806-0-2374";"Use Battlemage Ennodius' Meteor ability to stun all four atronachs simultaneously in the first arena of Blackrose Prison."
"188155806-0-2375";"Use a Sigil of Resurrection in any arena to revive three other group members at once in Blackrose Prison."
"188155806-0-2376";"Have a single group member successfully absorb at least three of Drakeeh's targets during his Spirit Ignition ability and cleanse themselves without dying."
"188155806-0-2378";"Interact with a Swamp Jelly and harvest its resources."
"188155806-0-2379";"Complete 12 New Life Charity Writs, Deep Winter Charity Writs, or Imperial Charity Writs."
"188155806-0-2380";"Cause Icestalker to uppercut its allies during Frenzied Pummeling in Frostvault."
"188155806-0-2381";"Always dodge Warlord Tzogvin's Reckless Charges in Frostvault."
"188155806-0-2382";"Get Warlord Tzogvin to destroy all three of his banners with Raging Winds in Frostvault."
"188155806-0-2383";"Destroy 20 of the Vault Protector's Constructs by detonating Volatile Spheres near them in Frostvault."
"188155806-0-2384";"Defeat Rizzuk and Avalanche in Frostvault with each party member having been affected by Avalanche's Glacial Prison ability at least once during the fight in Veteran Frostvault."
"188155806-0-2385";"Knock 20 enemies off the Stonekeeper's platform in Frostvault."
"188155806-0-2386";"Take control of each type of custom skeevaton. Custom skeevatons are available during an Extermination Protocol phase of the Stonekeeper battle after having activated the Veracity Verifier in Veteran Frostvault. You cannot be Scrap Metal or dead at the end of the phase to receive credit."
"188155806-0-2387";"Shut down the Stonekeeper's Extermination Protocol using Tharayya's skeevatons within 35 seconds of her summoning them in Frostvault. Timer begins at the start of her warning."
"188155806-0-2388";"Don't allow any of the Scavenging Maw's Hunting Proboscis to be shattered and don't get hit by any of its shadow forms in Veteran Depths of Malatar."
"188155806-0-2389";"Have no group members get hit by Glaciation during your battle with the Weeping Woman in Veteran Depths of Malatar."
"188155806-0-2390";"Don't destroy any colored orbs during the Dark Orb encounter in Veteran Depths of Malatar."
"188155806-0-2391";"Prevent Quintus from ever winning his deadlock with Tharayya during the battle with King Narilmor in Depths of Malatar."
"188155806-0-2392";"Defeat each color of Auroran during the battle with the Symphony of Blades in Depths of Malatar."
"188155806-0-2393";"Prevent the Symphony of Blades from crossing the Auroran Phalanx and becoming empowered by Meridia's Light in Veteran Depths of Malatar."
"188155806-0-2394";"Destroy 5 Ice Pillars with Sunburst meteors during the encounter with the Symphony of Blades in Veteran Depths of Malatar."
"188155806-0-2395";"After reading the Dictate to the Lady of Light, enter the colored room without leaving any colored orbs alive during the Symphony of Blades encounter in Veteran Depths of Malatar."
"188155806-0-2396";"Explore and clear the Abode of Ignominy."
"188155806-0-2397";"Explore and clear Predator Mesa."
"188155806-0-2398";"Explore and clear Desert Wind Caverns."
"188155806-0-2399";"Explore and clear the Tomb of the Serpents."
"188155806-0-2400";"Explore and clear Darkpool Mine."
"188155806-0-2401";"Explore and clear the Tangle."
"188155806-0-2402";"Explore and clear all six explorable caves in Northern Elsweyr."
"188155806-0-2403";"Discover all of the striking locales in Northern Elsweyr."
"188155806-0-2404";"Discover and clear all caves and striking locales in Northern Elsweyr."
"188155806-0-2405";"Defeat the skullguard, Na'ruzz the Boneweaver, at the Bone Pit."
"188155806-0-2406";"Defeat the dro-m'Athra, Zalsheem, on the Nightmare Plateau."
"188155806-0-2407";"Defeat the terror bird, Wily Kee'va, at Talon Gulch."
"188155806-0-2408";"Defeat the necromancer, Thannar the Graveprowler, at Scar's Edge."
"188155806-0-2409";"Defeat Sword Master Vhysradue on the Hill of Shattered Swords."
"188155806-0-2410";"Defeat the criminal duo, Zav'i and Akumjhargo, at Red Hands Run."
"188155806-0-2411";"Defeat all six world bosses in Northern Elsweyr."
"188155806-0-2412";"Catch all 12 rare fish in Northern Elsweyr."
"188155806-0-2413";"Defeat 200 Hollowfang clan vampires in Veteran Moongrave Fane. Hollowfang Dire-Maws and Bloodpanthers do not give credit for this achievement."
"188155806-0-2414";"Defeat 25 Hollowfang Dire-Maws in Veteran Moongrave Fane."
"188155806-0-2415";"Defeat the Risen Ruins, Dro'zakar, the Kujo Kethba, Nisaazda, and Grundwulf in Moongrave Fane."
"188155806-0-2416";"Defeat the Risen Ruins, Dro'zakar, the Kujo Kethba, Nisaazda, and Grundwulf in Veteran Moongrave Fane."
"188155806-0-2417";"Defeat Grundwulf after using the Sangiin Hemo Helot in Veteran Moongrave Fane."
"188155806-0-2418";"Defeat all encounters in addition to the Risen Ruins, Dro'zakar, the Kujo Kethba, Nisaazda, and Grundwulf within 30 minutes of entering Veteran Moongrave Fane. Your timer starts when players engage the first group of enemies."
"188155806-0-2419";"Defeat all encounters in addition to the Risen Ruins, Dro'zakar, the Kujo Kethba, Nisaazda, and Grundwulf in Veteran Moongrave Fane without suffering a group member death."
"188155806-0-2420";"Enter either Moongrave Fane or Lair of Maarselok for the first time."
