"Location";"Source"
"139139780-0-5918";"A crude, nondescript whistle. Purportedly sounds like a crow's call when blown."
"139139780-0-5919";"This note appears to be from a rival skooma distributor, and is claiming responsibility for the attack."
"139139780-0-5920";"This custom dagger is etched with the symbol of a competing distributor."
"139139780-0-5921";"This bottle has an unusual label and clearly was not produced in Claw's Strike"
"139139780-0-5922";"This amulet is made of a crystalline material, with Nedic symbols carved into it."
"139139780-0-5923";"A royal seal granted to the sword shields of the Yokudan Emperor Tarish-Zi. Rumors say three of these seals are needed to gain entry to his sacred crypt."
"139139780-0-5924";"A royal seal granted to the sword shields of the Yokudan Emperor Tarish-Zi. Rumors say three of these seals are needed to gain entry to his sacred crypt."
"139139780-0-5925";"Throw the sands where the Lions do peer to reveal the Trial of Air."
"139139780-0-5926";"Use to read contents."
"139139780-0-5927";"Use to read contents."
"139139780-0-5928";"Use to read contents."
"139139780-0-5929";"Use to read contents."
"139139780-0-5930";"A Dwemer stone covered in symbols and pictures."
"139139780-0-5931";"A blackened gem from the center of a broken orrery."
"139139780-0-5932";"The rubbing reads: ""L f w s c e l o s p r t u I d a h e w l f n e c o h r."""
"139139780-0-5933";"A long journal filled with various notes and musings from Nhalan, including possible ideas for a solution to reverse the effects on newly infected patients."
"139139780-0-5934";"This ornate gem appears to flash different shapes and colors as you look at it."
"139139780-0-5935";"One of the gems needed to restore the Seeker's Sight."
"139139780-0-5936";"One of the gems needed to restore the Seeker's Sight."
"139139780-0-5937";"One of the gems needed to restore the Seeker's Sight."
"139139780-0-5938";"This will allow me to draw elemental infusions from shards in the Spellscar."
"139139780-0-5939";"A malfunctioning device of sorts used to track down the Aspects of the Mage celestial."
"139139780-0-5940";"A relic connected to the Celestial Mage that can be used to locate the Mage's missing aspects."
"139139780-0-5941";"These badges belonged to the caravan guards the Butcher fed to his trolls."
"139139780-0-5942";"A token of devotion to the stars above."
"139139780-0-5943";"The helmet of the Iron Orc shaman, Agganor, taken from his dead body."
"139139780-0-5945";"An enchanted blade that rejects any wielder save the chosen champion of the Celestial Warrior."
"139139780-0-5949";"A totem crafted from dried bone, feathers, and sinew. Despite its age, the fetish has bits of fresh gristle worked into its weaving."
"139139780-0-5950";"An unsettling idol covered in an oily sheen. It is unnaturally cool to the touch."
"139139780-0-5951";"A well-worn but beautifully crafted wooden bowl. Painted scenes of Argonian life cover the sides."
"139139780-0-5957";"A nondescript package, triple-wrapped with waxed parchment and sealed with twine."
"139139780-0-5958";"Small stones, each with a single Daedric rune carved upon them."
"139139780-0-5960";"The sand in this hourglass produces an eerie red glow. It is quite warm to the touch."
"139139780-0-5961";"An ornate goblet covered in a permanent rime of icy frost. It is cold to the touch."
"139139780-0-5962";"An ornamental helm encrusted with amber gems. There is a slight shock when it is first touched."
"139139780-0-5963";"These delicate flowers have a spicy aroma."
"139139780-0-5965";"This key opens the gate to the docks on Firemoth Island."
"139139780-0-5967";"A letter to Eraven Onthim from his master, Magister Therana."
"139139780-0-5968";"A blood-soaked straitjacket. Golden threads are woven into the sleeves and collar. Delicate embroidery accents the straps."
"139139780-0-5969";"A leathery half-mask with thick straps. Intended to be fitted over the head, the mesh cage over the mouth could prevent the unexpected mastication of clumsy digits."
"139139780-0-5970";"A pair of severed, mummified fingers."
"139139780-0-5971";"A cheese knife doesn't usually need serrations and a blood gutter, does it?"
"139139780-0-5972";"The flayed skin of an Imperial. One side reveals a visage contorted in pain and anguish. The other grins mercilessly."
"139139780-0-5973";"A worn fiddle with frayed, fuzzy strings. Strange whorls and haphazard scratches cover the back."
"139139780-0-5974";"A child's skull with a second, smaller set of teeth, nostrils, and eye sockets."
"139139780-0-5975";"A collection of dried and salted meat. Presumably made from the flesh of people transformed into animals. It is unknown whether consuming a small piece would count as cannibalism."
"139139780-0-5976";"A bottle containing the distilled spinal fluid of the Mad God's disciples from the Shivering Isles. A sip is said to reveal hidden truths."
"139139780-0-5977";"A tiny daedrat in a small cage. It stares at you with forlorn eyes, and chitters quietly. If you listened carefully, you might be able to understand what it has to say."
"139139780-0-5978";"A pearlescent button, presumably fitted for a doublet. Its color shifts in the light."
"139139780-0-5979";"A sealed treatise on the creation and consumption of eldritch cheeses and ingredients."
"139139780-0-5980";"This lamp glows in darkness without any flame or fuel. The shadows it casts cavort and dance in unsettling patterns."
"139139780-0-5981";"A pair of cracked spectacles with silver frames and amber lenses."
"139139780-0-5982";"This gnarled finger bone allegedly belonged to Saint Felms."
"139139780-0-5983";"A writ demanding Sun-in-Shadow's freedom. It bears the seal of Magister Therana."
"139139780-0-5984";"A pewter goblet engraved with faces in varying states of joy, sorrow, and despair."
"139139780-0-5987";"A chunk of cooled metal with a strange and appealing coloration."
"139139780-0-5988";"A bantam guar with a rope collar. A wooden disc attached to the collar reads, ""Tasty-Legs—In honor of the previous Tasty-Legs, who left us far too soon."""
"139139780-0-5989";"A bronze coin bears the face of Rajhin, the Khajiiti trickster god."
"139139780-0-5990";"A silver coin bears the face of Rajhin, the Khajiiti trickster god."
"139139780-0-5991";"A golden coin bears the face of Rajhin, the Khajiiti trickster god."
"139139780-0-5992";"A tiny pin worn by those participating in the Lava Foot Stomp."
"139139780-0-5993";"These star shells are valuable to at least one Telvanni mage."
"139139780-0-5994";"The contract designates Tirwin as a slave owned by Faras Givyn. If signed over, it can be used to free her."
"139139780-0-5995";"A small pouch filled with balls of soft mud, thin twigs, and leaves. Perfect for spreading festival cheer to the dour, arrogant, and self-important."
"139139780-0-5996";"This pack contains Nerise Venim's valuable potions and unguents."
"139139780-0-5997";"A well-made sword that matches the description of the weapon that was stolen from Nerise Venim."
"139139780-0-6000";"A set of three balanced daggers, a tinted bottle, and a dull sword."
"139139780-0-6005";"A pair of High Elf ears. They are still attached to the severed head of a former Veiled Heritance member."
"139139780-0-6006";"The wine-infused liver of a former Veiled Heritance member."
"139139780-0-6010";"A chunk of freshly killed meat. When thoroughly boiled, its origin will be a complete mystery."
"139139780-0-6011";"A succulent honeycomb."
"139139780-0-6012";"A napkin lathered with grease and honey."
"139139780-0-6013";"A napkin lathered with grease and honey."
"139139780-0-6017";"A note from Master Dren to Marshal Hlaren, requesting she send him more prisoners to work his plantation."
"139139780-0-6018";"A note from someone named ""H"" to Kharekh gra-Bagrat, promising they will falsely arrest more travelers passing through Suran."
"139139780-0-6019";"Right Click to Read"
"139139780-0-6020";"A leather-bound guide to herbal remedies."
"139139780-0-6021";"This colorful lichen smells faintly of evergreen and lemon-peel."
"139139780-0-6022";"A key to the private prison beneath Suran."
"139139780-0-6023";"A key to Warden Libo's trophy chest."
"139139780-0-6024";"A key to the back entrance of the Inanius Egg Mine."
"139139780-0-6025";"An archive of sworn testimony from prisoners sold into slavery on Arano plantation."
"139139780-0-6033";"Blue flames swirl within this polished black stone, but it remains cold to the touch. The right person might show great interest in this."
"139139780-0-6034";"Blue flames swirl within this polished black stone, but it remains cold to the touch. The right person might show great interest in this."
"139139780-0-6035";"Blue flames swirl within this polished black stone, but it remains cold to the touch. The right person might show great interest in this."
"139139780-0-6036";"Blue flames swirl within this polished black stone, but it remains cold to the touch. The right person might show great interest in this."
"139139780-0-6037";"Blue flames swirl within this polished black stone, but it remains cold to the touch. The right person might show great interest in this."
"139139780-0-6038";"Blue flames swirl within this polished black stone, but it remains cold to the touch. The right person might show great interest in this."
"139139780-0-6039";"Blue flames swirl within this polished black stone, but it remains cold to the touch. The right person might show great interest in this."
"139139780-0-6042";"Use to read contents."
"139139780-0-6043";"This stone pulses with a spark of Vivec's divine energy."
"139139780-0-6045";"A detailed description of an Ashlander ceremony to appease the Daedric Lords through ritual sacrifice."
"139139780-0-6046";"This page appears to have been haphazardly torn from a larger volume. It's still legible."
"139139780-0-6047";"An herbal mixture, guaranteed to give relief to those suffering from cat allergies."
"139139780-0-6048";"Disfigured bones from the corpse of a recently slain pilgrim. Little flesh still clings to them and their surface bears countless gouges."
"139139780-0-6049";"Defensive wounds suggest the owner of this helmet was desperate to fend off what attacked them. A vile briny sludge clings to it."
"139139780-0-6050";"A pilgrim's journal, detailing a religious pilgrimage that started in Molag Mar."
"139139780-0-6053";"A muddy mixture used by the Ashlanders to drive dreugh from the their nests."
"139139780-0-6054";"Lord Vivec's questions for the Andrano ancestor, inscribed on a simple scroll."
"139139780-0-6055";"A leather-bound journal filled with agricultural notes and diagrams."
"139139780-0-6056";"This crude glass decanter is filled with a noxious yellow liquid."
"139139780-0-6057";"This sack of cult ritual components includes a small, ornate rod covered in runes, a Dwemer crystal, and the burnt remains of a ritual scroll."
"139139780-0-6058";"This crystal feels warm."
"139139780-0-6059";"This crystal feels warm."
"139139780-0-6060";"This crystal feels warm."
"139139780-0-6061";"This crystal feels warm."
"139139780-0-6062";"This crystal feels warm."
"139139780-0-6064";"This mirror reflects the beauty of all who gaze into it."
"139139780-0-6065";"An ancient arrow, still straight and exquisite in its detail."
"139139780-0-6066";"A faint scent of almonds still lingers within this elegant drinking vessel."
"139139780-0-6067";"A sack full of the highest quality grain."
"139139780-0-6068";"Almost incomprehensible, these notes on energy transfer may mean something to Barilzar and Vivec, but not to you."
"139139780-0-6069";"The aspirations and ambitions of Chodala of the Ashlanders, including his claim to be the Nerevarine."
"139139780-0-6071";"This heavy iron key bears the seal of House Hlaalu."
"139139780-0-6073";"The bones of a wild guar. The Urshilaku Ashlanders believe the soul of the guar lingers with the remains and can guide them even in death."
"139139780-0-6074";"The broken weapon of an exiled Ashlander. Members of the Erabenimsun tribe slaughter banished Dark Elves on sight. This weapon is a fitting trophy."
"139139780-0-6075";"A rare fern native to the coasts of Vvardenfell. Rumor has it that Ahemmusa Ashlanders use this plant to mask their scent while hunting."
"139139780-0-6076";"The royal wax excreted by a kwama queen sometimes hardens into a jewel-like pit. The Zainab Ashlanders use it in a variety of crafts and religious ceremonies."
"139139780-0-6077";"A brittle relic that bears the scars of many battles. Too ancient to use, but filled with symbolic power."
"139139780-0-6082";"This once powerful Dwemer control device appears broken beyond repair."
"139139780-0-6083";"This scroll tells the tale of Incarnate Ranso and teaches the lesson that power alone doesn't make the Nerevarine."
"139139780-0-6084";"This scroll describes the ascension and fall of Incarnate Aduri, whose love of senseless war proved her undoing as the Nerevarine."
"139139780-0-6085";"This scroll tells the tale of Incarnate Danaat and teaches that the one who refuses wise counsel can never be the Nerevarine."
"139139780-0-6086";"This faceted crystal buzzes and flashes insistently. The pattern seems far from random."
"139139780-0-6087";"This key features two different blades of vastly divergent design. It likely opens the door to the Zaintiraris central chamber."
"139139780-0-6088";"This heavy, faceted stone emits a faint hum. It is clearly flush with power."
"139139780-0-6089";"The scroll bears a complex series of characters in a language you cannot decipher."
"139139780-0-6090";"A bantam guar with a rope collar. A wooden disc attached to the collar reads, ""Pouncer—In honor of the previous Pouncer. who still bounds through our hearts."""
"139139780-0-6091";"This polished stone is covered in complex etchings and seems to buzz in your grasp."
"139139780-0-6092";"A bantam guar with a rope collar. A wooden disc attached to the collar reads, ""Wobble-Claw—In honor of the previous Wobble-Claw. He fell and he fell but he always got back up. Until he didn't."""
"139139780-0-6093";"A bantam guar with a rope collar. A wooden disc attached to the collar reads, ""Sir Scratch-Scales—In honor of the previous Sir Scratch-Scales. May his legend last longer than the rash that killed him."""
"139139780-0-6094";"A complex Dwarven crank for making gears rotate and pistons operate."
"139139780-0-6095";"A sound-producing engine of Dwarven design."
"139139780-0-6096";"A negatively charged plate to transpose the flow of energy."
"139139780-0-6097";"This strange device emits a low hum."
"139139780-0-6098";"This strange, unwieldy device has been cobbled together from various Dwarven components and is supposed to counteract the power of Sunna'rah."
"139139780-0-6099";"Created by Sotha Sil, this staff-like device combines clockwork technology with magicka."
"139139780-0-6100";"This darkened mass of fungus writhes in your grasp—clearly the result of alchemical tampering."
"139139780-0-6101";"This chestnut flask is filled to the brim with a thick, black liquid."
"139139780-0-6102";"This yellowed legal document bears the Tribunal seal. It is clearly authentic."
"139139780-0-6103";"An instruction book prepared by Barilzar the mage."
"139139780-0-6105";"This crisply folded letter contains secret correspondence between Mertis Othren and Wizard Jinrisa."
"139139780-0-6106";"A tightly-wound scroll containing Firuth's endorsement of Sun-in-Shadow."
"139139780-0-6107";"Written orders commanding the Red Exiles to go to the deep chambers of the mine and acquire a staff of metal and gears used in the Nycotic cult's rituals."
"139139780-0-6108";"A magic gem that can record and project memories. It has been attuned to Gilan Lerano's soul."
"139139780-0-6109";"A magic gem that can record and project memories. It has been attuned to Gilan Lerano's soul."
"139139780-0-6110";"This large, plain key opens the door to the portion of the construction site where the third canton is being built."
"139139780-0-6111";"This stone pulses with a spark of Vivec's divine energy."
"139139780-0-6113";"Created by Sotha Sil, this staff-like device combines clockwork technology with magicka."
"139139780-0-6114";"Gold Coast Trading Company cargo recovered in Shipwreck Cove."
"139139780-0-6116";"Combining fire salts and kindlepitch, I created a fire bomb."
"139139780-0-6117";"A piece of the powerful nix-ox, Great Zexxin."
"139139780-0-6118";"A trophy collected from the mighty nix-hound known as Tarra-Suj."
"139139780-0-6119";"A trophy taken from the greater hive golem, Writhing Sveeth."
"139139780-0-6120";"A trophy collected from the giant mudcrab matriarch known as Mother Jagged-Claw."
"139139780-0-6121";"A trophy collected from the dire ash beetle known as Ash-Eater."
"139139780-0-6122";"A trophy collected from the ancient cliff strider known as Old Stomper."
"139139780-0-6123";"A trophy collected for the kagouti pack leader known as King Razor-Tusk."
"139139780-0-6124";"Delicately Pretty Marshmerrow Cakes, with a dusting of powdered pearl and sugar."
"139139780-0-6125";"This combustible ingredient can be combined with kindlepitch to start a fire."
"139139780-0-6126";"This combustible ingredient can be combined with fire salts to start a conflagration."
"139139780-0-6127";"Created by Sotha Sil, this staff-like device combines clockwork technology with magicka."
"139139780-0-6128";"Magister Otheri's journal detailing a complex experiment."
"139139780-0-6129";"The cog's brass is engraved with strange runes."
"139139780-0-6130";"A gear the size of a wagon's wheel."
"139139780-0-6131";"The gem atop this rod appears to still gently glow."
"139139780-0-6132";"The core remains warm to the touch."
"139139780-0-6134";"Near unintelligible writing covers these pages."
"139139780-0-6135";"Copy of a Dwemer Key"
"139139780-0-6136";"This crank shows signs of corrosion, but it looks like a perfect fit for Otheri's machine."
"139139780-0-6137";"This well-oiled gear looks like it was used recently. It probably fits into Otheri's machine."
"139139780-0-6138";"This elegant Dwarven lever feels well-oiled and lovingly polished. This must be Magister Otheri's favorite component."
"139139780-0-6139";"This map contains a code that shows the location of the Morag Tong safehouse."
"139139780-0-6140";"This map contains a code that shows the location of the Morag Tong safehouse."
"139139780-0-6143";"A key hidden by the Morag Tong, it opens the way to their secret safehouse."
"139139780-0-6144";"Official record of notable House Redoran events."
"139139780-0-6145";"Enchanted clumps of flower petals that will add some springtime flair to any occasion."
"139139780-0-6146";"A blank sheet of special parchment taken from the supply in the governor's private quarters."
"139139780-0-6147";"A relic from the Daedric shrine."
"139139780-0-6148";"A note from the slaver captain to his crew that accuses Governor Omellian of being in league with them while also betraying them."
"139139780-0-6149";"A tome detailing the earliest genealogy of the families that make up House Indoril."
"139139780-0-6150";"A tome detailing the earliest genealogy of the families that comprise House Dres."
"139139780-0-6151";"A tome detailing the earliest genealogy of the families that make up House Redoran."
"139139780-0-6152";"A tome detailing the earliest genealogy of the families that comprise House Hlaalu."
"139139780-0-6153";"A tome detailing the earliest genealogy of the families that make up House Telvanni."
"139139780-0-6154";"Five genealogies recovered from the Library of Andule."
"139139780-0-6155";"A small but weighty sack of gold coins"
"139139780-0-6156";"A relic from the Daedric shrine."
"139139780-0-6157";"A relic recovered from the Ashurnabitashpi shrine."
"139139780-0-6158";"A relic from the shrine of Ebernanit."
"139139780-0-6159";"A relic from the shrine of Dushariran."
"139139780-0-6160";"A relic recovered from the ruins of the Maelkashishi shrine."
"139139780-0-6161";"A relic recovered from the shrine of Ashalmawia."
"139139780-0-6162";"A small packet of finely ground powder that explodes on impact"
"139139780-0-6163";"A bag of small, smelly apples that not many people would consider appetizing."
"139139780-0-6164";"A stone that contains select remembrances of its owner."
"139139780-0-6165";"An Ordinator helm engraved with the name Nivel Omellian."
"139139780-0-6166";"A ruby left with a mysterious note as payment for sabotaging the lighthouse in Seyda Neen."
"139139780-0-6167";"A mysterious note suggesting that the Tribunal paid someone to sabotage the lighthouse in Seyda Neen."
"139139780-0-6168";"Tax assessment records for the residents of Vos."
"139139780-0-6169";"Tax assessment records for the residents of Sadrith Mora."
"139139780-0-6170";"Tax assessment records for the residents of Molag Mar."
"139139780-0-6172";"These bags of gold are the rightful property of Vvardenfell's ruling body."
"139139780-0-6173";"This list includes the names and probable locations of some of Barilzar's hirelings."
"139139780-0-6174";"This scroll describes a meeting between Chodala and the Red Exiles in which he calls himself the Nerevarine and talks about his upcoming appointment with the Wise Woman."
"139139780-0-6175";"A finely tailored sash, dyed a deep red and bearing the embroidered crest of the Hleran family."
"139139780-0-6176";"This massive Dwarven prism emits a low hum when handled."
"139139780-0-6177";"The essence of a slain daedra, temporarily trapped in Nirn by Azura's crystal."
"139139780-0-6178";"An expertly crafted, deep blue crystal. It is remarkably light and hums faintly. Its function remains a mystery."
"139139780-0-6179";"According to the Daedric Prince, Azura, this crystal will capture the essence of any Daedra killed in its proximity."
"139139780-0-6180";"This crystal flashes and buzzes insistently—filled to capacity with captured Daedric Essence."
"139139780-0-6182";"A single black feather hangs from this roughly hewn jet. It likely grants access to one of the pocket realms of Oblivion."
"139139780-0-6183";"This expertly carved stone seems to glimmer like gold, so long as you don't look directly at it. It likely opens a nearby pocket realm of Oblivion."
"139139780-0-6184";"This lustrous red stone feels warm to the touch and emits faint, indecipherable whispers. It likely opens a nearby pocket realm of Oblivion."
"139139780-0-6186";"The residual magicka saturating these ancient bones should add some kick to any magical mixture."
"139139780-0-6187";"Glittery dust that crackles with magical energy."
"139139780-0-6188";"A thick satin cowl, dyed black as midnight. Putting it on would be unwise."
"139139780-0-6189";"A glistening ruby pin. The inlaid jewel whirls menacingly on a silver spindle. Only a great fool would handle it for long."
"139139780-0-6190";"Glittering gold coins spill out of this purse like water from a fountain. A pity they're all cursed."
"139139780-0-6191";"A small bauble filled with colorful powders and enchanted to produce a dazzling display."
"139139780-0-6192";"A small bauble filled with colorful powders and enchanted to produce a dazzling display."
"139139780-0-6193";"A small bauble filled with colorful powders and enchanted to produce a dazzling display."
"139139780-0-6194";"This key opens the locked door that leads to Kudanat Mine."
"139139780-0-6195";"This hastily written letter details the locations of Azura's abducted oracles—including Rhea herself."
"139139780-0-6204";"A letter sent to Mabkir from his lover back home, now stained crimson."
"139139780-0-6205";"This key unlocks the doors into the ancient Dark Elf fortress."
"139139780-0-6206";"This key opens the cells in the Hlormaren stronghold."
"139139780-0-6208";"A questionable love poem written by Brelan Neloren."
"139139780-0-6210";"A heartfelt letter written by a runaway slave to her love."
"139139780-0-6215";"Research notes titled ""Proven Moon-Sugar Fertilization Techniques."""
"139139780-0-6216";"Research notes titled ""Recommended Methods of Moon-Sugar Cultivation."""
"139139780-0-6219";"A kwama egg from the Matus-Akin Egg Mine."
"139139780-0-6220";"A list of various plants and their effects on the kwama of Matus-Akin Egg Mine."
"139139780-0-6221";"Kwama feed which has been covered in poison. Handle with caution."
"139139780-0-6223";"This bag smells strongly of garlic and other spices."
"139139780-0-6224";"The frayed cover and bent pages of this popular mystery novel appear to have seen a lot of use."
"139139780-0-6225";"Stibbons's initials are etched into this humble bowl."
"139139780-0-6229";"A tiny spider, small enough to fit in a backpack and perfect for testing the effectiveness of Lady Laurent's potent tea."
"139139780-0-6233";"What kind of mysterious properties could this mushroom contain?"
"139139780-0-6240";"Mysterious bones from a creature long since departed."
"139139780-0-6241";"Mysterious writing covers this tablet. What could it say?"
"139139780-0-6242";"The skull of a fearsome beast of unknown origins."
"139139780-0-6246";"This letter bears the seal of the Undaunted."
"139139780-0-6247";"Water collected from a place where sea water and swamp water meet in perfect harmony."
"139139780-0-6249";"A page torn from the journal of Menwendel, Mistress Dratha's herbalist. It looks like it may have fallen during a struggle."
"139139780-0-6250";"This broken bottle was surrounded by a noxious fluid and other alchemical reagents. Menwendel may have tried to use it as a weapon."
"139139780-0-6251";"A torn and tattered piece of clothing stained with grass, mud and blood. It smells faintly of berries."
"139139780-0-6252";"This ectoplasm still writhes with an unnatural life."
"139139780-0-6255";"This large seal bears the mark of the Tribunal and Vivec's personal symbol."
"139139780-0-6256";"This bag seems unusually heavy for its size, but looking inside reveals only darkness."
