"Location";"Source"
"139139780-0-3996";"This crystal radiates an aura of weariness and lethargy."
"139139780-0-3997";"Wood treated with fire salts in order to burn with magically intense heat."
"139139780-0-3998";"This crystal seems to absorb heat from anywhere around it."
"139139780-0-3999";"This small, metal skull is surprisingly heavy. It's cold to the touch, and gives off a chill aura."
"139139780-0-4000";"A mysterious decoction of shifting color and horrid aroma."
"139139780-0-4001";"Apparently, a spikeball is just a sharp rock."
"139139780-0-4003";"Its slick surface pulses with the rhythm of life."
"139139780-0-4007";"This crystalline object pulses with incredible power."
"139139780-0-4008";"This crystal is a Light of Meridia."
"139139780-0-4009";"Place this gem in the proper statue at the top of the southern pyramid."
"139139780-0-4010";"Place this gem in the proper statue at the top of the southern pyramid."
"139139780-0-4011";"Place this gem in the proper statue at the top of the southern pyramid."
"139139780-0-4013";"Use to read contents."
"139139780-0-4014";"Use to read contents."
"139139780-0-4015";"Use to read contents."
"139139780-0-4016";"This list of instructions is signed ""Alchemist Ruuvitar."""
"139139780-0-4017";"This slippery, fist-sized egg quivers slightly at your touch."
"139139780-0-4018";"A small amount of viscous fluid in a stoppered phial."
"139139780-0-4019";"This linen bandage has a medicinal smell to it."
"139139780-0-4021";"This list of instructions is signed ""Alchemist Ruuvitar."""
"139139780-0-4022";"This war horn belonged to Warcaller Targoth."
"139139780-0-4023";"Give this amulet to the Argonian that best represents this spiritual virtue."
"139139780-0-4024";"Give this amulet to the Argonian that best represents this spiritual virtue."
"139139780-0-4025";"Give this amulet to the Argonian that best represents this spiritual virtue."
"139139780-0-4026";"The prized bow of General Malgoth, leader of the Blackroot invaders who overran Vullain."
"139139780-0-4027";"This gooey, sticky substance glows faintly within its bottle. It has a sickly sweet smell."
"139139780-0-4029";"This talisman, taken off a dead Reachwitch, can enslave the spirits of those recently killed and force them to answer a question."
"139139780-0-4030";"An order for the resupply of the inn at Applewatch."
"139139780-0-4031";"Use to read contents."
"139139780-0-4033";"These patches look like flexible wood treated with some sort of sap or sticky tar."
"139139780-0-4034";"A bundle of roots that glow white."
"139139780-0-4037";"An irridescent liquid, made from ground pearls, used in transformation potions."
"139139780-0-4038";"This stylized tool appears well-made, if a little the worse for wear."
"139139780-0-4041";"A small amount of moon-sugar in a paper pouch, known to cause drowsiness in some people."
"139139780-0-4042";"Use to read contents."
"139139780-0-4043";"A love letter written to the Maormer guard. Unfortunately for him, it's fake."
"139139780-0-4044";"With a handful of moon-sugar stirred inside, it's sure to knock out anyone who takes a deep swig."
"139139780-0-4045";"Use to read contents."
"139139780-0-4046";"Use to read contents."
"139139780-0-4047";"Use to read contents."
"139139780-0-4048";"This sack of fertilizer certainly smells nice."
"139139780-0-4049";"This round disc, engraved with runes, features an elegantly inscribed signature that reads, ""Telenger the Artificer."""
"139139780-0-4051";"A treatise on transmuting living flesh, written by Zur of the Mages Guild."
"139139780-0-4053";"A plain rag doll. This has no monetary value but may have sentimental value for someone."
"139139780-0-4054";"A sealed letter addressed to Octavimus Bincal of Cropsford."
"139139780-0-4055";"A small, ornate key."
"139139780-0-4056";"A simple, leather pouch filled with sand."
"139139780-0-4057";"A soaking bag of water damaged gifts."
"139139780-0-4058";"One of the eggs stolen from the lamias."
"139139780-0-4059";"Use to read contents."
"139139780-0-4060";"Use to read contents."
"139139780-0-4061";"Use to read contents."
"139139780-0-4062";"A crystal used to change the illusions set up around Arenthia."
"139139780-0-4065";"This is a bundle of newly tailored robes. A label on the package reads ""Verro Sertorius, Weynon Priory."""
"139139780-0-4066";"One of two shards that form the key to the council portal."
"139139780-0-4067";"One of two shards that form the key to the council portal."
"139139780-0-4068";"Tools left behind by Laurent's expedition."
"139139780-0-4069";"Standard uniform of all staff at Hadran's Caravan."
"139139780-0-4071";"Certificate for entrance into the Summoner Division of Thizzrini Arena"
"139139780-0-4072";"Certificate for entrance into the Swordmaster Division of Thizzrini Arena"
"139139780-0-4073";"Certificate for entrance into the Sorcerer Division of Thizzrini Arena"
"139139780-0-4074";"This Ninwand Crystal recovered from an Aldmeri Dominion soldier can be used to activate the pillars on the surface over the ruins so that the portal to Alinor can be closed."
"139139780-0-4075";"A multifaceted crystal matrix used for dispersing magicka energy."
"139139780-0-4078";"A note written by an unknown person…"
"139139780-0-4079";"Dense ore with veins of dark metal running through it."
"139139780-0-4080";"Use to read contents."
"139139780-0-4081";"Void salts that have been refined to remove all impurities."
"139139780-0-4082";"This plain metal key has flecks of rust along the teeth."
"139139780-0-4083";"This small crate contains Sea Viper uniforms and flags, proving a direct connection between the Maormer embassy and the Sea Vipers."
"139139780-0-4084";"This finely crafted silver flute is enscribed, ""Halion of Chorrol."""
"139139780-0-4085";"Blood taken from a feral creature and corrupted through Daedric experiments in the Vile Laboratory."
"139139780-0-4086";"The combined shards form a key to activate the council portal."
"139139780-0-4087";"A letter from Gungrim addressed to his cousin, Asvorn Hairy-Legs."
"139139780-0-4088";"The dark red sludge in this vial has the consistency of honey."
"139139780-0-4090";"The last meal of a blood-drinking creature of the Shademist Moors."
"139139780-0-4091";"A crystal used to change the illusions set up around Arenthia."
"139139780-0-4092";"Use to read contents."
"139139780-0-4094";"This greenish paste glows slightly with energy."
"139139780-0-4095";"This is a small package of fresh cold-water fish."
"139139780-0-4096";"A green leaf used in some medicines."
"139139780-0-4097";"A stinky fruit that grows on a particular palm."
"139139780-0-4098";"A pungent bundle of medicinal herbs."
"139139780-0-4099";"A crystal used to change the illusions set up around Arenthia."
"139139780-0-4100";"A rare flower that is extremely hallucinogenic."
"139139780-0-4101";"A green powder extracted from the Torturer's Pillow cactus."
"139139780-0-4102";"The head of the lamia champion."
"139139780-0-4103";"Just a sharp rock."
"139139780-0-4104";"This bag is damp from a recent rain. Inside are some medical instruments and a map."
"139139780-0-4105";"This is a small sealed vial containing an aged scrap of paper."
"139139780-0-4106";"This golden tiara is set with heart-shaped precious stones."
"139139780-0-4107";"This simple crystal goblet in an ancient style seems to be softly humming a soothing tune."
"139139780-0-4108";"The hilt of this ornamental dagger is mounted with heart-shaped precious stones."
"139139780-0-4110";"A Daedric device used to extract essences and other energy from the Soul Shriven."
"139139780-0-4111";"A Daedric key used to activate Coldharbour portals."
"139139780-0-4112";"A Daedric key used to activate Coldharbour portals."
"139139780-0-4114";"This large key opens the gates to the Hall of Judgment."
"139139780-0-4115";"Used for the Ash'abah initiation ritual."
"139139780-0-4116";"Use to read contents."
"139139780-0-4117";"Use to read contents."
"139139780-0-4118";"Use to read contents."
"139139780-0-4119";"Use to read contents."
"139139780-0-4120";"Use to read contents."
"139139780-0-4122";"Tiny arcs of lightning crackle over the surface of this clutch of eggs."
"139139780-0-4123";"An ancient Bosmeri rune capable of repairing the seals in Serpent's Grotto."
"139139780-0-4125";"A bundle of scrolls, each detailing a critical Aldmeri Dominion project or military strategy."
"139139780-0-4127";"Use to read contents."
"139139780-0-4129";"A petition from Chief Tazgol to allow the Seamount Orcs to join the Daggerfall Covenant."
"139139780-0-4130";"Use to read contents."
"139139780-0-4131";"Use to read contents."
"139139780-0-4132";"A cloth sack holding eight dozen skooma vials."
"139139780-0-4135";"An ancient Bosmeri rune capable of reparing the seals in Serpent's Grotto."
"139139780-0-4136";"The key to Feluni's office"
"139139780-0-4137";"This stoppered tube contains the potent intoxicant, skooma."
"139139780-0-4138";"The Wilderking's hunting horn."
"139139780-0-4139";"A recipe for crafting a potion of transmutation, written by Zur of the Mages Guild."
"139139780-0-4140";"A small rod, crafted from ebony ore, crystalline essence, and refined void salts, and valued for its diametrically opposed nature."
"139139780-0-4141";"Use head of a decapitated Scamp to prevent portals from opening in Moonlit Maw."
"139139780-0-4142";"A fresh, cold bottle of ale."
"139139780-0-4143";"A box of munitions for siege weapons."
"139139780-0-4144";"A blue gem, pulsing with energy. It feels wet to the touch."
"139139780-0-4145";"Use to read contents."
"139139780-0-4147";"Blood taken from a vampire, for use in Vanus Galerion's ritual."
"139139780-0-4149";"A heavy key that opens a door in the Dwarven laboratory."
"139139780-0-4151";"The combined, liquified components needed to forge two antipodal rods."
"139139780-0-4152";"A bundle of supplies given to me from Lliae the Quick."
"139139780-0-4153";"This ancient tome has the power to activate the pillars in Salas En and to close the portal beneath the ruins."
"139139780-0-4157";"This ancient tome has the power to activate the pillars in Salas En and to close the portal beneath the ruins."
"139139780-0-4158";"A sturdy wooden ring engraved with the names ""Zariya"" and ""Darius."""
"139139780-0-4164";"These hewn limbs and organs are harvested from the corpses and broken atronachs in the Tower of Bones."
"139139780-0-4168";"Use to read contents."
"139139780-0-4170";"A key found in Fakimal's home."
"139139780-0-4171";"Relics and bones from Yenamu's Last Stand near Thormar."
"139139780-0-4172";"Relics and bones from Moon-Scythe's final battle near Willowgrove."
"139139780-0-4173";"This well-worn hourglass leaks sand."
"139139780-0-4174";"The handle of this mug is well-worn from use."
"139139780-0-4175";"The wood on this lute has lost its sheen, if it ever had one to begin with."
"139139780-0-4176";"Relics and bones from the massacre of Khajiiti troops near Falinesti Autumn site."
"139139780-0-4179";"Key found in Tsona-Ei's Journal."
"139139780-0-4180";"This is a bloody heart of a large wolf."
"139139780-0-4182";"A finely crafted musical instrument that belongs to Minstrel Idria."
"139139780-0-4183";"A notebook with notes about Ayleid wells.The binding is embossed with ""Atia Tucca of Weynon Priory."""
"139139780-0-4184";"Two names are engraved on the back of this pendant."
"139139780-0-4185";"Use to read contents."
"139139780-0-4186";"Use to read contents."
"139139780-0-4187";"Use to read contents."
"139139780-0-4188";"Use to read contents."
"139139780-0-4190";"Leg bones from a Lost Fleet skeleton."
"139139780-0-4191";"A ribcage from a Lost Fleet skeleton."
"139139780-0-4192";"Arm bones from a Lost Fleet skeleton."
"139139780-0-4193";"A hip bone from a Lost Fleet skeleton."
"139139780-0-4195";"These are the designs for the new warship being constructed at Tava's Blessing."
"139139780-0-4196";"These are the designs for the new warship being constructed at Tava's Blessing."
"139139780-0-4197";"These are the designs for the new warship being constructed at Tava's Blessing."
"139139780-0-4198";"This unlocks the cellars of the vile manse."
"139139780-0-4199";"This plate of chitin is sturdy but flexible."
"139139780-0-4200";"This detached torchbug body part glows faintly."
"139139780-0-4201";"Even detached from its tree, this fragment of heartwood blossoms with shoots and leaves."
"139139780-0-4203";"This goat's milk should attract Morwha's Blessing to reforge the Ansei Ward."
"139139780-0-4204";"This earth from a fallen warrior's grave should attract Zeht's Blessing to reforge the Ansei Ward."
"139139780-0-4205";"This breeze should attract Tava's Blessing to reforge the Ansei Ward."
"139139780-0-4206";"These recovered gems may help prove Zariya's innocence."
"139139780-0-4207";"Use to read contents."
"139139780-0-4208";"A used but well-maintained pipe. There's a faintly sweet smell wafting from the oiled wood."
"139139780-0-4209";"A half empty bottle of pungent wine."
"139139780-0-4210";"A large slab of cured meat."
"139139780-0-4211";"This well-worn iron helmet belongs to Captain Arakh of the Fighters Guild."
"139139780-0-4212";"This was left after the Flame Atronach exploded."
"139139780-0-4213";"This was pried out of the chest of a slain Frost Atronach."
"139139780-0-4214";"Even after the Storm Atronach's energy dispersed, this core remained."
"139139780-0-4215";"This simple wand should help pinpoint the source of the corruption in Willowgrove."
"139139780-0-4216";"The Ansei Ward has been reforged."
"139139780-0-4217";"A box of munitions for siege weapons."
"139139780-0-4218";"Use to read contents."
"139139780-0-4219";"A piece of an elaborate carnival mask."
"139139780-0-4220";"A piece of an elaborate carnival mask."
"139139780-0-4221";"A bundle of roots."
"139139780-0-4222";"A box of munitions meant for siege warefare."
"139139780-0-4223";"This key has a dangling series of beads attached to it."
"139139780-0-4225";"The heart of the oldest strangler in Valenwood."
"139139780-0-4227";"Some of the gold is in coins and some in the form of jewelry."
"139139780-0-4228";"The silk is folded in several lengths of brightly colored fabric."
"139139780-0-4229";"A scroll containing a spell that uses a Sigil Stone to create a great destructive force."
"139139780-0-4230";"This is one of the sacred relics stolen from the High Temple of Satakalaam."
"139139780-0-4231";"This is one of the sacred relics stolen from the High Temple of Satakalaam."
"139139780-0-4232";"This is one of the sacred relics stolen from the High Temple of Satakalaam."
"139139780-0-4233";"A crystal key made from a greater welkynd stone."
"139139780-0-4234";"A crystal key made from a greater welkynd stone."
"139139780-0-4235";"A crystal key made from a greater welkynd stone."
"139139780-0-4238";"Use to read contents."
"139139780-0-4239";"Use to read contents."
"139139780-0-4240";"Use to read contents."
"139139780-0-4241";"This thigh bone glows with an eerie light."
"139139780-0-4242";"This large key, decorated with arcane runes, controls the protective wards surrounding the Fighters Guild hall."
"139139780-0-4243";"This shinbone glows with an eerie light."
"139139780-0-4244";"This calf bone glows with an eerie light."
"139139780-0-4245";"This elbow bone glows with an eerie light."
"139139780-0-4246";"This radial bone glows with an eerie light."
"139139780-0-4247";"This arm bone glows with an eerie light."
"139139780-0-4248";"This collarbone glows with an eerie light."
"139139780-0-4249";"This shoulder blade glows with an eerie light."
"139139780-0-4250";"This breastbone glows with an eerie light."
"139139780-0-4251";"These finger bones glow with an eerie light."
"139139780-0-4252";"These toe bones glow with an eerie light."
"139139780-0-4253";"This backbone glows with an eerie light."
"139139780-0-4254";"These rib bones glow with an eerie light."
"139139780-0-4255";"This stone can be used to tune a runic portal."
"139139780-0-4259";"This pelvic bone glows with an eerie light."
"139139780-0-4260";"While mostly undamaged, the egg looks like it has spent a long time in the sun."
"139139780-0-4261";"In this sack are a complete arm, 8 ribs, and the fingers from one hand."
"139139780-0-4262";"A complete skeleton made up of faintly glowing bones."
"139139780-0-4263";"This is the legendary artifact that was allegedly wielded by Magnus himself. I must now return it to Queen Ayrenn for safekeeping."
"139139780-0-4264";"This lodestone crackles with energy as if is ready to burst."
"139139780-0-4265";"A list of names given to you by Prefect Antias."
"139139780-0-4266";"This horn was carved from an enormous tooth."
"139139780-0-4267";"A rough and badly chipped quartz idol. Its outline suggest it once depicted a stylized lion."
"139139780-0-4268";"A crown made of living branches and leaves."
"139139780-0-4269";"A tomb urn carved with runes. If you examine it closely you can hear faint whispers emanating from within."
"139139780-0-4270";"A single large claw, carved with Daedric runes and secured with wire on a leather thong."
"139139780-0-4271";"This rib of Dringoth's can be used to coerce enemy undead into fighting at one's side, or sometimes, it will simply destroy them."
"139139780-0-4272";"The lodestone's energy is palpable, and it radiates warmth and a crackling energy."
"139139780-0-4273";"A fresh-baked meat pie, straight from Shasirba the cook."
"139139780-0-4275";"This sack contains keepsakes of Severus Tappo's victims."
"139139780-0-4276";"Use to capture wisps"
"139139780-0-4277";"This sack of fluid is still leaking from where it was torn from the snake."
"139139780-0-4278";"A legendary sword once wielded by Ansei Maja."
"139139780-0-4279";"The mauled body of a very old harpy."
"139139780-0-4282";"This sturdy bucket is full of cold water."
"139139780-0-4283";"An unusual, triangular key that allows access to the Labyrinth."
"139139780-0-4285";"A legendary sword once wielded by Ansei Halelah."
"139139780-0-4286";"A seed given by Angof to grant a zombie companion when used on humaniod corpses."
"139139780-0-4287";"This is the ivory hide of the Pale Senche."
"139139780-0-4289";"Use to read contents."
"139139780-0-4290";"Use to read contents."
"139139780-0-4291";"Use to read contents."
"139139780-0-4292";"The severed head of Roog, Chief Gorzesh's son."
"139139780-0-4293";"The severed head of Grashla, Chief Gorzesh's Hearth-Wife."
"139139780-0-4294";"The severed head of Thushleg, Chief Gorzesh's Hunt-Wife."
"139139780-0-4295";"The severed head of Dushgor, Chief Gorzesh's torturer."
"139139780-0-4296";"Playing this flute will lead you to Erinel's flute."
"139139780-0-4297";"This smoothly-polished stone feels heavy for its size."
"139139780-0-4298";"This cold, icy fire can be used to power Daedric devices."
"139139780-0-4300";"This key opens the prisoner cages in the Holding Cells beneath the Hall of Judgment."
"139139780-0-4301";"Use to read contents."
"139139780-0-4302";"The pages of this book are empty."
"139139780-0-4303";"Use to read contents."
"139139780-0-4304";"Use to read contents."
"139139780-0-4305";"Use to read contents."
"139139780-0-4306";"Use to read contents."
"139139780-0-4307";"Use to read contents."
"139139780-0-4308";"There are five letters, each with the same message, addressed to Earrastel, Quertasse, Laurosse, and Calastil. Use to read contents."
"139139780-0-4309";"An unusual glowing crystal that was used to power a strange Dwarven machine."
"139139780-0-4310";"Use to read contents."
"139139780-0-4312";"This is one of the legendary Ansei Swords."
"139139780-0-4313";"Use to read contents."
"139139780-0-4314";"Use to read contents."
"139139780-0-4315";"Use to read contents."
"139139780-0-4316";"An expensive-looking bundle of rare and colorful cloth."
"139139780-0-4318";"Use to read contents."
"139139780-0-4319";"Ash from the erruption of Red Mountain, many years ago."
"139139780-0-4320";"Inscribed on the side are the words ""Valencia Nasica, the Exalted Bard of Dune."""
"139139780-0-4321";"Use to read contents."
"139139780-0-4322";"Use to read contents."
"139139780-0-4323";"Use to read contents."
"139139780-0-4327";"A badge of membership, bearing a name etched in the metal."
"139139780-0-4328";"A badge of membership, bearing a name etched in the metal."
"139139780-0-4329";"This bag of dried fruit doesn't seem very appealing."
"139139780-0-4330";"This is an ornate cane with Earrastell's initials embossed along its length."
"139139780-0-4331";"It's a drinking horn made of antique ivory and lined with gold."
"139139780-0-4332";"This is a small incense censer with engravings commemorating the founding of the Aldmeri Dominion."
"139139780-0-4333";"This is the pelt of Calastil's deceased dog Pluck."
"139139780-0-4334";"Two twitching, stitched together masses of rodent parts."
"139139780-0-4335";"Use to read contents."
"139139780-0-4336";"Blue light pulses from this small crystal."
"139139780-0-4337";"This lightning charred rock was found at the site of the Merchant's shattered cart. It is just the sort of mystical sign the Bosmer require for the trial."
"139139780-0-4338";"The eyes upon this Dominion coin protrude slightly more than normal. It's only noticeable when you pass it between your fingers."
"139139780-0-4339";"Ash from the erruption of Red Mountain, many years ago."
"139139780-0-4340";"Ash from the erruption of Red Mountain, many years ago."
"139139780-0-4341";"This plant cutting matches the magical plant in the sacred cave and was found in the Spinner's home."
"139139780-0-4342";"Use to read contents."
"139139780-0-4343";"Use to read contents."
"139139780-0-4345";"A smelly, dark, viscous liquid fills this glass bottle. A small marking indicates the contents are highly flammable."
"139139780-0-4346";"This arrangement of found branches used to sit above the Spinner's door. It's been shattered into several pieces."
"139139780-0-4347";"This small, tin whistle is crudely made."
"139139780-0-4348";"A mammoth tusk."
"139139780-0-4350";"The arm of the nasty troll I killed that I need to bring to Ledronor."
"139139780-0-4351";"The rest of the rat was too damaged to use, but its head was intact and should suffice."
"139139780-0-4352";"The rat's body proved too smashed to be useful, but its legs should be perfect for Adamir."
"139139780-0-4353";"This lump of rat flesh is missing its head, legs, and tail."
"139139780-0-4354";"This is a long, hairless rat tail."
"139139780-0-4357";"This key opens the prisoner cage."
"139139780-0-4358";"A large, exquisite emerald."
"139139780-0-4359";"A large, dazzling diamond."
"139139780-0-4360";"The head of a giant wasp."
"139139780-0-4361";"These are the seeds the treethane told me to plant in the Orcs' camp to sprout guardians to drive the Orcs away."
"139139780-0-4362";"This exquisitely crafted sword features the words ""Marcelle Stenric of Shornhelm"" engraved upon its blade."
"139139780-0-4363";"This is a live red frog; it wiggles in your backpack."
"139139780-0-4364";"Use to read contents."
"139139780-0-4365";"A special blend of fragrant oils, herbs, and pumice."
"139139780-0-4367";"One of the fabled Lights of Meridia."
"139139780-0-4368";"Lady Estre's repaired mask, used to call forth the Shadow Court."
"139139780-0-4369";"Use this rune to harness the power of the dead."
"139139780-0-4370";"A small glowing gemstone that emanates magic."
"139139780-0-4371";"Useful for burning corpses that might have been tainted by bloodfiends."
"139139780-0-4372";"A combustible substance on the end of a stick, used as a source of light or to set flammable object aflame."
"139139780-0-4374";"The battered skull of the scholar Jonne."
"139139780-0-4375";"The badge of office worn by the Mayor of Crestshade."
"139139780-0-4376";"A small, delicate creature which hums around inside your pocket."
"139139780-0-4377";"This ring bears the sigil of Stendarr, God of Righteous Might."
"139139780-0-4378";"This enchanted staff belonged to the mage Tharlas."
"139139780-0-4379";"An essence pulled from untainted soil."
"139139780-0-4380";"The vial used to contain some kind of noxious substance, but is mostly empty now."
"139139780-0-4381";"A tarnished and ancient blade of an Alessian general."
"139139780-0-4384";"This scepter is made entirely of bone, and inlaid with obsidian filigree."
"139139780-0-4385";"A tarnished and ancient blade of an Alessian general."
"139139780-0-4386";"A tarnished and ancient blade of an Alessian general."
"139139780-0-4387";"This scepter is made entirely of bone, and inlaid with obsidian filigree."
"139139780-0-4389";"This is a compound made from the dust of Elementals."
"139139780-0-4391";"Something mist-like and glowing swirls within this opaque bottle. Faint whispering emanates from the bottle, but you can't make out the words."
"139139780-0-4392";"This skull appears blackened, but not by fire. The bone itself bears a strange discoloration."
"139139780-0-4393";"Use to read contents."
"139139780-0-4394";"Use to read contents."
"139139780-0-4395";"In this sack are a complete arm, 8 ribs, 11 vertebrae, a clavicle, and a sternum."
"139139780-0-4396";"In this sack are two complete arms, 16 ribs, 11 vertebrae, a clavicle, and a sternum."
"139139780-0-4397";"In this sack are two complete arms, a complete leg, 16 ribs, 22 vertebrae, a clavicle, and a sternum."
"139139780-0-4398";"In this sack are two complete arms, a complete leg, 24 ribs, 22 vertebrae, 2 clavicles, a sternum, and a pelvis."
"139139780-0-4399";"This glowing skull claims to be named Dringoth."
"139139780-0-4400";"Rare and putrid, this must be the least desirable of all mushrooms."
"139139780-0-4401";"An ordinary radish."
"139139780-0-4402";"So white it almost seems to glow."
"139139780-0-4403";"A Mages Guild signet ring, belonging to Malangwen."
"139139780-0-4404";"A Mages Guild signet ring, belonging to Ancalmo."
"139139780-0-4405";"A Mages Guild signet ring, belonging to Dannic."
"139139780-0-4406";"A Mages Guild signet ring, belonging to Jahadar."
