"Location";"Source"
"259945604-0-1";"Thank you for the unexpected gift, my friend!"
"259945604-1-1";"Many thanks, my five-clawed friend! Bright moons light your path!"
"259945604-2-1";"By bark and birth, your kindness is appreciated, Hist-friend!"
"259945604-3-1";"Thanks beyond measure, my fine f'lah!"
"259945604-4-1";"Fortune favors me with a friend such as you. Walk in radiance."
"259945604-5-1";"Many thanks, and may Auriel protect you!"
"259945604-6-1";"May the Eight protect and reward you for your kindness."
"259945604-7-1";"By Shor's Bones, you honor me greatly!"