"Location";"Source"
"115318052-0-1";"DLC quest starters are available in the Stories section of the Collections menu"
"115318052-1-1";"Crowns to spend in the Crown Store (|c76BCC3Paid Members Only|r)"
"115318052-2-1";"Access to exclusive Crown Store offers and deals (|c76BCC3Paid Members Only|r)"
"115318052-3-1";"Craft Bag is accessible via your Character's Inventory menu"
"115318052-4-1";"Double Bank Space capacity|r for your account"
"115318052-5-1";"10% increase to Experience, Gold, Alliance Points (Currency, PvP Skill Lines, and Alliance rank only), Tel Var Stones (monster kills only), Archival Fortunes acquisition, Crafting Inspiration, and Trait Research speed."
"115318052-6-1";"2x Bonus to allowable Furnishings and Collectibles in Homestead player housing"
"115318052-7-1";"Double currency cap for Transmutation Crystals"
"115318052-8-1";"Costume Dyeing|r is available at Outfit Stations throughout the world"