"Location";"Source"
"219317028-0-1001";"I understand you're in the market for a hireling. Someone to acquire components for you. Materials. Of the woodworking variety. Then look no further! I'm Margog the Hammer, and I'm just the Orc for the job. My rates are cheap, my deliveries are on time, and I know Orcs who know Orcs, if you understand my intention."
"219317028-0-1002";"Margog the Hammer here, sending greetings and salutations. I'm proud to say that my business has really taken off. As you can plainly see, the quality of my merchandise is of the highest caliber. It all has to do with my suppliers. I've made arrangements to provide the best materials to you on a regular basis. Arrangements that can't be refused."
"219317028-0-1003";"This latest shipment didn't fall off the back of a merchant wagon--at least not all of it! But I jest. You'll discover as we get to know each other that Margog the Hammer has a wonderful sense of humor. I'm even funnier than most Orcs, or so I've been led to believe. All of my henchmen say so. Of course, that's what I pay them for! Ha!"
"219317028-0-1004";"I have a confession to make. I'm not supplying you with crafting components out of any sense of duty or obligation. I have an ulterior motive. I'm using the profits to finance my grander ambitions. You see, I plan to build an organization that has its fingers in all kinds of related businesses. I guess you could call me an entrepreneur."
"219317028-0-1005";"Some of my business ventures might be considered criminal. I'm all right with that. I supply the necessary services to meet the ever-growing demands, and if that's a crime then I'm a skinny Wood Elf! But never fear, boss. For you, everything will always be above board and totally honest. For the most part. And you have my word on that!"
"219317028-0-1006";"Greetings, boss. It's me, Margog the Hammer. Since you seem interested in my various enterprises, I thought I'd tell you about my latest venture. I'm in the middle of establishing a method for redistributing appropriated goods in the town I call home. Turns out, someone already thinks they have that business locked up--and they're angry with me."
"219317028-0-1007";"Do I care about a filthy Khajiit? Do I care about his claim to have cornered the market on the redistribution of goods acquired by questionable means in my town? Of course not! Who does Splendid-Paws think he is? He's not my boss! He's not even an Orc! If he sends his thugs around here again, I can't be held responsible for what happens."
"219317028-0-1008";"An unfortunate accident befell Splendid-Paws' associates today. They demanded their share of gold from my business. A business they had nothing to do with. That's when the hammer hanging over my work table slipped from its hook and bashed both of the poor fellows in the head. Repeatedly. I hope the Khajiit has a good healer on his payroll."
"219317028-0-1009";"Hello, boss. I hope this shipment of woodcrafting components finds you well. At least, I hope you're feeling better than those thugs the so-called Khajiit crime lord sent to talk to me. I understand one of them may not make it. I imagine this could lead to further trouble between the cat and I, but such is the cost of doing business. Am I right?"
"219317028-0-1010";"With all of my other business ventures going so well, you're probably wondering why I continue to serve as a hireling for crafting components. That's a fair question. Woodworking calms me. It lets me clear my head and relax. Call it a hobby. I figure I might as well make some gold in the process, so here we are. Your materials are enclosed."
"219317028-0-1011";"Well, boss, as I was telling you last time, woodworking calms me. As you know, I'm an Orc, and I have an Orc's temper. Maybe even two Orcs' worth! My other businesses often require me to give my temper free rein. So at the end of the day I need to do something that relaxes me and lets the tension slide away. Sawing and hammering works wonders!"
"219317028-0-1012";"I had a visit from thugs working for the Khajiit known as Splendid-Paws. I decided to open a tavern across from his inn, and that has his fur standing on end. Doesn't he know that competition is good for the digestion? And I'm building the place with my own two hands. Consider it a massive woodworking project to help me deal with my anger issues!"
"219317028-0-1013";"Greetings, boss. Margog here. Another unfortunate accident sent Splendid-Paw's employees to the healer again. That's what happens when you wander into a construction site without paying attention to where you're walking. You fall into a pile of wooden beams and iron nails. Over and over again. Maybe now the Khajiit will mind his own business."
"219317028-0-1014";"My tavern should be ready for its grand opening very soon. I'm going to call the place ""Hammer and Saw"" because woodworking means so much to me. I'm one busy Orc! Crafting supplier, tavern owner, dealer in dubiously acquired goods, conveyer of illicit materials—like I said, an entrepreneur! Speaking of which, your materials are enclosed."
"219317028-0-1015";"While we'd never have cause to be disagreeable to one another, my other business ventures often require me to let my inner Orc out to play. I'm not proud of my violent tendencies, but they do help me keep the gold flowing. Sometimes you have to break a few legs to make a kwama egg omelet, am I right? At least, that's how my uncle explained it."
"219317028-0-1016";"Hello, boss. If I don't sound like my usually cheerful self, that's because I'm upset. I've always felt a little bad after a client or a rival requires me to accidentally injure them repeatedly in the course of a transaction. It's the cost of doing business. But today's transaction has left me feeling out of sorts. Regretful, even."
"219317028-0-1017";"You're probably wondering what could have happened to make old Margog the Hammer into a melancholy horker. Where's the happy-go-lucky Orc with a million ideas that I hired, you're probably asking yourself. Well, he feels bad about something that happened the other day. And instead of evaporating like so much dew, that feeling remains. Guilt."
"219317028-0-1018";"So what did Margog do to feel guilty about? I injured one of my rival's associates! That's right. Splendid-Paws got his fur in a bunch over something or another I did and sent a couple of thugs to teach me a lesson. That never works out well for either Splendid-Paws or his thugs, as you well know. But one of those thugs was Fahdah the Eyeful."
"219317028-0-1019";"Fahdah the Eyeful. She's a Redguard brawler whose brawn is matched by her stunning beauty. I've had the opportunity to watch her work as an interested bystander and her beatings are legendary. She accomplishes more with a look and a snarl, however, than most thugs can even get close to with a barrel full of weapons. I hope the healer can help her!"
"219317028-0-1020";"I admit it. I, Margog the Hammer, busted up Fahdah the Eyeful. I think I broke her arm! And I feel terrible about it! Of course, she and her associate had come into my not-quite-ready-for-business tavern with the express purpose of delivering a message of pain and suffering to me from their boss, Splendid-Paws. But it was Fahdah! What should I do?"
"219317028-0-1021";"Now, boss, in case you think I'm getting soft, let me educate you on the facts. I'm Margog the Hammer! I'm an entrepreneur who enjoys woodworking and sometimes has to put on a tough facade with my various business associates. But I never provide a beating to someone who doesn't deserve it. Fahdah certainly deserved it. So why am I so unhappy?"
"219317028-0-1022";"After talking to the healer, I've determined that Fahdah the Eyeful is going to be all right. Turns out, her arm isn't broken. It's just a bad bruise. She'll be back on her feet and breaking skulls in no time. I'll probably have to watch my back for a while, but at least I'll get to see her around a little more often. Your materials are enclosed."
"219317028-0-1023";"The Hammer and Saw opened its doors today. What a grand turn out we had! The place was packed, the drinks were flowing, and the crowd was happy and excited. It was everything I hoped for. If you ever visit Forlorn, feel free to drop by. Your first ale is on the house! And I'd love to get your opinion on the woodwork."
"219317028-0-1024";"What a strange turn of events. The Khajiit crime lord, Splendid-Paws, decided to pay a visit to my humble little tavern. He rarely leaves the comfort and safety of his inn, but he walked in like he owned the place, surrounded by an entourage of toughs--including Fahdah the Eyeful. He had a drink and toasted to my success. So why do I feel worried?"
"219317028-0-1025";"Have I told you much about the town of Forlorn? It's a small but growing community in the wilds of High Rock. We have an inn, a tavern, a stable, and the usual mix of merchants and crafters. We even have a healer, but she mostly caters to Splendid-Paws and his thugs. We don't have a temple, but traveling priests pass through from time to time."
"219317028-0-1026";"A traveling priest of Mara wandered into town today. I'm not a religious Orc. I barely acknowledge Mauloch. But I'm still dealing with these conflicted emotions concerning my businesses and the necessities of violence when the priest entered my tavern. We got to talking and she actually has me contemplating a more peaceful approach to life."
"219317028-0-1027";"Can Margog the Hammer become Margog the Serene? That's what the priest of Mara says is my best hope for a happy existence. She wants me to ignore my violent impulses. She says I should stop using rude and obscene language. That I should look for the beauty in all things and endeavor to be more friendly. This might just kill me, but I'll try."
"219317028-0-1028";"Greetings, boss. Here's another shipment of crafting materials. I'm trying real hard to maintain a calm, serene exterior, even though everyone around me is as annoying as a room full of skinny Wood Elves. It's taking all of my considerable willpower not to reach for one of my hammers every time someone opens their mouth. But you have a good day."
"219317028-0-1029";"That damn cat and rival crime lord Splendid-Paws! He decided to interfere with my business operations again. This time, he's hired brigands to intercept my shipments of illicit materials. You know, my smuggling endeavors? Oh, pardon my bluntness, but maintaining this serene exterior is starting to wear on my nerves! I really need to hit something!"
"219317028-0-1030";"It's me, Margog the Hammer. I've lost two shipments of smuggled goods in as many days because of those brigands working for Splendid-Paws the Khajiit crime lord. Well, enough is enough! I'm taking a few of my employees and we're going to find these brigands. And when we do, I'm going to serenely and calmly beat them to bloody pulps!"
"219317028-0-1031";"Excuse the terseness, but can't write much. We're on the trail of Splendid-Paws' brigands. Here are your crafting components. I'm feeling better than I have in days. More later. Margog the Hammer."
"219317028-0-1032";"Hello, boss. Margog the Hammer here. I thought you'd like to know that I recovered my stolen goods from the brigands that stole them from me. And I dealt with the brigands. Just like hammering a few nails. The roads around Forlorn should be safer. At least for a while. I guess that serenity, like all things, needs to be practiced in moderation."
"219317028-0-1033";"I returned to discover that we had a new arrival in town. Someone in their infinite wisdom decided we needed some sort of law in our burgeoning community. So now I have to figure out how to deal with Constable Chedric Celd and his pledge to bring order to the wilds of High Rock. I can't tell you how safe and secure I feel now. Really. I can't."
"219317028-0-1034";"Splendid-Paws. Fahdah the Eyeful. Uncooperative merchants. I know how to deal with these things. Constable Chedric Celd? Not so much. He's so full of righteous indignation, stern honor, and unflappable honesty. In fact, he's so incorruptible it makes me want to gag! He refused my bribe and said he'd be watching me. How annoying!"
"219317028-0-1035";"The brave and honorable Constable Chedric, how I detest the man! I should have let Splendid-Paws make the first move, but I had to try to buy his loyalty. I still have my gold, but now the good constable is aware of my possible affiliation with the less-than-honest aspects of society. It's enough to make me consider that crime really doesn't pay."
"219317028-0-1036";"Here you go, another shipment of crafting components. Pardon my tone, but the new constable has crawled up my business and put me in the foulest of moods. If I don't get him to turn his attention in another direction soon, I'm going to lose out on a lot of gold. I might have to arrange for an accident to happen, but you didn't hear that from me."
"219317028-0-1037";"Hello, boss. Margog the Hammer here. I'm in a better mood today. It appears that the good Constable Chedric finally noticed that Splendid-Paws refers to himself as ""the crime lord of Forlorn!"" While he was merely suspicious of me, he's now actively investigating the Khajiit's business dealings. Let's hope he finds something vile and incriminating."
"219317028-0-1038";"One of the suppliers I deal with, a Dark Elf named Beranzen, decided he wanted to expand his options by eliminating the middle man. Unfortunately, that would mean leaving me out of the business altogether.  That, as I'm sure you can understand, isn't what I'd call an acceptable situation. I think we need to have a talk. I'll bring my hammer."
"219317028-0-1039";"The Dark Elf Beranzen, let's call him a collector of lost goods. He always came to me to turn his illicit items into gold. Gold for him. Gold for me. I heard that the thief wants to start shopping for the best deal. He wants to take advantage of the free market, I guess. We're going to have a discussion. After I ship your materials."
"219317028-0-1040";"Sad news, boss. Beranzen and I couldn't come to an equitable agreement. I'm truly sorry that we won't be doing business going forward. And that I had to drop him into the town's pig pen after he accidentally tripped and hit his head on my hammer. Twice. It's unfortunate, but things happen when people try to take advantage of my generous nature."
"219317028-0-1041";"Margog the Hammer, at your service! May these components find you happy and rolling in gold! You may be curious about my cheerful disposition. It's all because good Constable Chedric brought the sword of justice down on Splendid-Paws' illegal operation. That has me feeling ecstatic! Now if you'll excuse me, I have some celebrating to do."
"219317028-0-1042";"That happy moment was short lived. Talk about unfortunate circumstances! All of the witnesses that Constable Chedric had rounded up to speak against the Khajiit crime lord have mysteriously vanished. Oh, there were the usual notes about being called away unexpectedly, but if you ask me, they're swimming with the mudcrabs at the bottom of the lake."
"219317028-0-1043";"My nemesis (I have a nemesis!) Splendid-Paws is free and clear--at least for the moment. But Constable Chedric isn't happy about the turn of events any more than I am. He let us both know it in no uncertain terms. And he warned that he'd be watching us. Both of us. Oh joy! Maybe I have two nemeses. I'll need to think about that. Materials enclosed."
"219317028-0-1044";"Hello, boss. Let me tell you about a new project I've started to help calm my nerves and bring me to a state of serenity. I'm building an elaborate house for the bantam guar that congregate behind my tavern. Have you seen one of those creatures? They're kind of cute--in a lizardy, scaly sort of chicken way. I love the little guys!"
"219317028-0-1045";"Woodworking is so relaxing, especially when I'm working on something that really matters. I was watching a few bantam guar frolicking outside my tavern the other day, pecking for food and doing their little dance, when the sky opened and a drenching rain fell. That's when I decided. Those guar need a place to live--and I'm going to build it!"
"219317028-0-1046";"Margog the Hammer again. Along with this batch of material, here are more details on the bantam guar house I'm building behind my tavern. It's got four entrances, two exits, three levels, and an exterior deck so the guar can sun themselves. I'm also adding two feeding troughs and three fountains so there's plenty of food and water to go around."
"219317028-0-1047";"Calm. Serene. Woodworking does wonders for my aggressive tendencies. I haven't wanted to hit anyone in days! Must have something to do with banging nails into wood, I guess. Anyway, the bantam guar house is almost ready for the little guys to move into. I can't wait to see how they like it! In the meantime, this package is for you."
"219317028-0-1048";"It's done and it's a masterpiece. Maybe my finest work ever. A home worthy of the most noble of bantam guar, with plenty of room for lots of inhabitants. I can't wait to see how they like it. The water and food troughs are full, the doors are open, and it's all ready for the little guys to move in. I had some materials left over, so here you go."
"219317028-0-1049";"Oh no! My perfect bantam guar cottage has become a home for wayward scuttlers! Those pests moved right in and made themselves comfortable, eating all the food and drinking all the water. Now they won't move out and the poor bantam guar remain homeless. I guess I could construct a second house. But I need to hurry before the rainy season begins."
"219317028-0-1050";"Margog the Hammer again. Did you miss me? Here're your components. Have you ever heard the saying, ""The enemy of my enemy is my friend?"" Well, that's got me thinking. I have two enemies at the moment: Splendid-Paws and Constable Chedric. They also are opposed to each other. I wonder if I should ally myself with one of them. For convenience's sake."
"219317028-0-1051";"I extended the hand of friendship to Constable Chedric. That was a mistake! He looked like I tried to offer him a poisonous viper instead of a handshake. Then he went on a short tirade about how he would never allow himself to associate with scum like me. If I were a sensitive sort, his words would have cut me like a knife. Instead I just hit him."
"219317028-0-1052";"Hello again, boss. My recent efforts to befriend Constable Chedric have met with failure. The good and noble constable, it seems, is too pure to associate with a common woodworker, tavern owner, and somewhat shady entrepreneur such as me. Oh well. I don't really like the man much, anyway. I guess I should go talk to Splendid-Paws next."
"219317028-0-1053";"Now I'm nervous. That cagey Khajiit showed up at my tavern and offered to buy me a drink before I could do the same at his place. Splendid-Paws has been a thorn in my side almost from the day I met him, but it seems we'd rather team up than allow Constable Chedric to take us both out of the picture. And at least I know there's no poison in my ale."
"219317028-0-1054";"Splendid-Paws the Khajiit crime lord is a surprisingly pleasant fellow. He tells amusing stories, laughs at jokes, and knows how to hold his liquor. He does have an annoying habit of talking about himself in the third person, but I suppose nobody's perfect. He eventually got around to why he was here. ""It's time to retire the constable,"" he said."
"219317028-0-1055";"Boss, this is by no means a confession. It's just talk between business associates, understand? And when Splendid-Paws used the word ""retire,"" he just meant ""put out to pasture,"" ""take out the trash,"" ""dispose of the problem,"" or ""liquidate our stock."" And by ""stock,"" I mean the good Constable Chedric. Your components are enclosed."
"219317028-0-1056";"What an amazing world this is. Who would have ever thought that Splendid-Paws the crime lord and Margog the Hammer would ever work together on anything. But as my hunt-mother used to say, you can't take down a mastodon with a single arrow, no matter how steady your aim. In this case, Constable Chedric is our mastodon. And we need two arrows."
"219317028-0-1057";"We decided that we had to be discrete in our efforts to remove Constable Chedric. Make his disappearance too spectacular and we run the risk of bringing even more law-enforcers down upon our little hamlet. We also had to be precise. Missing a target such as the good constable is a sure way to turn the pointed side of the arrow in your direction."
"219317028-0-1058";"So discretion and precision were the keystones of our operation. And since neither of us trusted our own associates to excel at either of those approaches, we decided that a hired expert was in order. We agreed to split the cost, but somehow it fell to me to make contact with the expert. And by expert, I mean the Dark Brotherhood."
"219317028-0-1059";"Hello, boss. I don't know if you've ever tried to set up a meeting with the Dark Brotherhood, but what a pain in the arse! First, I need to perform some sort of ritual with the delightful-sounding name of ""the Black Sacrament."" Where in the world am I going to find a heart, a skull, bones, and flesh? If you have any suggestions, pass them along."
"219317028-0-1060";"What a gruesome ritual! I made an effigy of Constable Chedric, as instructed, but I'm still waiting for the Nightshade petals to arrive from the alchemist. Then I have to sit inside a circle of candles, stab the effigy, and whisper some inane words that don't make a lick of sense. If this is just an elaborate prank, someone's going to get hurt."
"219317028-0-1061";"I was beginning to think the whole ritual thing to summon a representative of the Dark Brotherhood was some kind of prank to make me look silly, but no sooner had I finished reciting the words than a figure in a black-hooded robe stepped out of the shadows. ""Who do you need dealt with, petitioner?"" the hooded figure asked."
"219317028-0-1062";"Those sermons I endured at the side of the priest of Mara must have rubbed off on me, after all. Staring into the depths of that shadowy hood, I suddenly didn't want to go through with this dark contract anymore. What was I thinking, trying to have an officer of the law assassinated by the Dark Brotherhood? I'm sure the figure will understand."
"219317028-0-1063";"""You made a mistake?"" the dark figure said with more than a hint of incredulity. ""That must be the first time such a thing has happened. You mistakenly built an effigy, set up candles, accidentally stabbed the effigy multiple times, and inadvertently spoke the prescribed words of power. Is that what you're telling me?"" I nodded an affirmation."
"219317028-0-1064";"""Let me get this straight,"" the figure in the black-hooded robe said, asking me to clarify the situation for the third time. ""You really didn't mean to contact the Dark Brotherhood? You don't want to have someone put to death? So, in essence, you've wasted my time? Is that what you'd have me believe?"" I nodded earnestly and apologized profusely."
"219317028-0-1065";"Well, boss, deciding not to make a deal with the Dark Brotherhood was the most stressful moment of my life. I was certain that the black-hooded figure wanted to kill something, and if it wasn't going to be for a contract then my blood would have to do. I offered to compensate him for his trouble, hoping I'd live to send you more components."
"219317028-0-1066";"The hooded figure begrudgingly took the gold I offered, mumbling under her breath. ""Stupid, Orc,"" and ""waste of time,"" were the only words I heard clearly enough to understand. Then the figure turned back to me and pointed a wickedly curved dagger. ""One mistake is all you get, Orc,"" the figure said. ""Don't make me regret even that much leniency."""
"219317028-0-1067";"Boss, it's Margog the Hammer here. I have a bit of a dilemma. Since I decided not to go through with the Dark Brotherhood contract, I need to figure out if I'm going to adhere to my deal with Splendid-Paws the crime lord or reach out to Constable Chedric. I'm in a quandary. Neither option really appeals to me, but I can't see an alternative."
"219317028-0-1068";"Here you go. Another shipment of crafting materials. I couldn't sleep last night, anyway, so I figured I might as well do something useful. Now, as dawn breaks over our little town, I need to decide on the lesser of two evils. Should I come up with another way to fulfill my deal with Splendid-Paws, or should I ally myself with Constable Chedric?"
"219317028-0-1069";"My life was much simpler and clear-cut when I was just a woodworker, before I became an entrepreneur. Now things have become exceedingly complex. I find I need to be much more subtle in my dealings. Not everything can be dealt with using a hammer and a nail. That was the thought going through my head as I went out to deal with Constable Chedric."
"219317028-0-1070";"The good constable was surprised to see me when I entered his tiny keep. It was basically a two-story, free-standing tower that served as his office, the town jail, and his living quarters. The life of a law officer certainly isn't glamorous, but I don't suppose glamour is what drives that sort of person. I closed the door behind me."
"219317028-0-1071";"The deed done, my next stop was a visit to my current partner-in-crime, the Khajiit named Splendid-Paws. Usually my rival, the crime lord and I had come to an arrangement of sorts because of the threat posed by Constable Chedric. But now that I had made sure the law officer wouldn't be a problem any longer, I had to deal with Splendid-Paws."
