"Location";"Source"
"219317028-0-494";"A Nord female challenged Pacrooti to a bare-fisted fight today. This one knows there is no easy way out of a tavern fight with Nords, so he wasted no time in responding to her and began swinging. She was heavily inebriated, and though Pacrooti ravaged her with rabbit punches and dirty kicks, she felt nothing. Pacrooti quickly surrendered."
"219317028-0-495";"Sometimes Pacrooti wonders whether the tales of Dragons were true or not. Creatures that snort fire seem like they would be very dangerous, indeed. This one does not think the people of Tamriel could have survived in a world where such beasts regularly patrolled the skies."
"219317028-0-496";"Pacrooti would make a great Altmer. He would spend all his days walking with his chest puffed out and bragging about all the great things he had accomplished on any given day. Like getting out of bed."
"219317028-0-497";"Please make good use of these components, dear friend. Pacrooti had to fight a terrifying Dwarven machine to get to them. No one in town had any. Pacrooti checked everywhere. Including the houses."
"219317028-0-498";"Speaking in the first-person is something Pacrooti will never be able to grasp, he thinks. Pacrooti has trouble understanding those Khajiit who have mastered that nuance of the common tongue. Combining that speech with a Khajiiti rasp and accent, and it sounds to Pacrooti like a little man or mer speaking out of a Khajiit face. Most disturbing."
"219317028-0-499";"Another shipment of components for you, dear friend. Pacrooti wants you to know how much he appreciates you, and included the usual amount of components (more or less) even though the town guards confiscated a large portion of Pacrooti's hunt. With this many guards on patrol, Pacrooti wonders how the component hunters make coin in this place."
"219317028-0-500";"Pacrooti's current landlord is very arrogant. The landlord looks down on the things that Pacrooti does to earn pay, even though the landlord never refuses rent. If the landlord knew he was paying Pacrooti's rent for him, he would be even unhappier at Pacrooti."
"219317028-0-501";"Every time Pacrooti smashes a Dwarven contraption into malfunction, he wishes there were a way to salvage them, make them wait at his beck and call. With a little paste and some dishes, the spinning hammers of a Dwarven centurion would become a marvelous serving device."
"219317028-0-502";"Pacrooti's friends were bragging today about their horses, arguing about whose was swiftest. If Pacrooti had the money, he would purchase a senche-tiger to ride. They are more cordial than horses, and Pacrooti can read the mood on their faces. They are not unlike Pacrooti. But horses have a cunning stare that Pacrooti does not like."
"219317028-0-503";"It's me, Valinka Stoneheaver. You know, the one you hired to source components for your use. You still want the stuff, right? I've included a sample. I can't thank you enough for this opportunity. This job will really help me pursue my true calling - delver of dungeons and collector of ancient relics! Not what you'd expect from a Nord, huh?"
"219317028-0-504";"Valinka again. I hope this package finds you well. Me? I've been better. My brothers are giving me grief about my chosen profession. They say it isn't proper for a Nord maiden to rummage around the countryside, collecting components and crawling around ancient ruins. But what do those horkers know? I'm so angry right now I could punch a mammoth!"
"219317028-0-505";"Sorry this shipment is late. Who knew mammoths were such sensitive creatures? I barely gave it a love tap, but it went rampaging through the town square like I really hurt it or something. It took forever to calm it down and clean up the mess. Good thing mammoths like mead-soaked fruit balls. But all my brothers could do was laugh, the horkers!"
"219317028-0-506";"I know, I know. Late again. But at least the components arrived, right? I had another incident with my brothers. It involved a lot of mead and a few well-placed blows to the head. Milk-drinkers! They never could best me in a fair fight! Still, I think I'll go farther afield for your next shipment. Give us all a little time to cool off."
"219317028-0-507";"Who do you love? Valinka, that's who! Look at what I was able to find for you this time. Premium grade materials, if I do say so myself. And I discovered a new ruin to explore. I'll tell you all about it when I send your next shipment."
"219317028-0-508";"That ruin I told you about? Turned out to be some Orc's hovel. And he wasn't very happy to find me inside and digging through his stuff. Who knew Orc hovels looked so much like ancient ruins? Live and learn, I guess."
"219317028-0-509";"I shared a fire with a camp of Argonians. After a few cups of some foul-tasting beverage they obviously enjoyed more than I did, they loosened up enough to tell me about a ruin they had passed in their travels. Finally, a real lead to a dungeon! But don't despair. I won't neglect my duties to you while I delve into the unknown."
"219317028-0-510";"Dear patron, please accept this latest shipment of components. Now, to other matters. I must tell you how the search for the ruins goes. Those Argonians provided the strangest directions. Something about how melting water flows to the maw of the ruins or some such. I thought I was wandering in circles, but then—oh! More later. I have to run now."
"219317028-0-511";"Sorry about that. I really had to run! And those horkers that were chasing me were fast! But I'm getting ahead of myself. Let me start at the beginning. When I was a little girl with pigtails—no, that's too far back. I found the dungeon the Argonians told me about! And it was right where they said it would be. More or less."
"219317028-0-512";"Valinka here, with more components and another report about my quest to become the greatest explorer in Tamriel. I'm going to be even better than that show-off, Narsis Dren! I found the ruins. Only a half-crumbled tower of rock jutted from the ground, but I was sure that the structure continued beneath the surface. That's when the Orc spotted me."
"219317028-0-513";"Who knew Orcs could run so fast? I was hoping for Dwarven or Daedric relics, but it turns out the ruins were old Nord in origin. The Orcs were using the place as a hideout. They were obviously bandits, and obviously mean. I was able to double back and sneak in while the Orcs were out looking for me. That's when I saw the—oops, got to go!"
"219317028-0-514";"More components, as requested. Now where was I? Oh, yes. The Orc bandits were using the ancient Nord ruin as a hideout. While they were out looking for me, I returned to look around their hideout. It was a single stone chamber beneath the crumbling tower. Hardly a proper ruin at all. And locked in a small metal cage in one corner was a mangy dog."
"219317028-0-515";"When the mangy dog saw me, it whined pitifully. Now, I'm not some milk-drinker with a soft spot for furry animals, but something about the dog touched my heart. He had a noble bearing and a fire in his eyes. And who hasn't found themselves locked in a cage after a night of mead and good cheer? So I did the only reasonable thing—I opened the cage."
"219317028-0-516";"That was when the first of the bandits returned. He was a fat Orc with rotting leather armor and a thick mace hanging from his belt. He was as surprised to see me as I was to see him. We both reached for our weapons. But before we could draw on each other, the dog burst from the opened cage and charged right for the Orc's—um, delicates."
"219317028-0-517";"I hope my tale isn't boring you, patron. Here are more components, as requested. These would never have reached you if not for that mangy dog. ""Plucky"" clamped sharp teeth on that fat Orc's … private parts … giving me time to unsling my warhammer and bring the business end down with all my might. The Orc dropped like a sack of rabbit meatballs."
"219317028-0-518";"Speaking of rabbit meatballs, that dog Plucky certainly likes the spicy little orbs of tastiness. And who can blame him? I was feasting on the things myself when Plucky helped himself to a meatball or three. Now he can't get enough of the delicious spheroids of rabbity goodness. I must stock up the next time I'm in a town or city."
"219317028-0-519";"It's me again. Valinka Stoneheaver. And Plucky, the brave dog! We escaped the Orc bandits and have left the Nord ruins behind us. Now we're back to tracking down crafting components for you, full time. Well, at least until we hear about another ruin to explore. Enjoy this shipment, with our compliments!"
"219317028-0-520";"While gathering the components for this shipment, I heard the most amazing news. My hero, the famous delver of dungeons, Narsis Dren, is going to be visiting the city in a few days. And even better, he's going to give a talk at the inn about his latest adventure! I think I'm going to hang around so I can meet him."
"219317028-0-521";"Here you go. I hope this suffices, but I didn't want to range too far afield while Narsis Dren is visiting the city. He is my hero, after all. I plan to be just like him! Well, maybe half as good. He is the preeminent dungeon explorer of our time, so I need to set my sights accordingly. I'll tell you all about his talk next time."
"219317028-0-522";"Just wanted to get this off to you before Narsis Dren takes the stage at the inn. Oh! There he is! For a Dark Elf, he doesn't look half bad. Got to go!"
"219317028-0-523";"What an amazing tale Narsis Dren told us! The inn was packed. It seemed like the whole city wanted to see the famous explorer and hear what he had to say. You should have heard his story about the time he was trapped in an Ayleid ruin by a group of Daedric cultists. It was so exciting!"
"219317028-0-524";"After Narsis Dren got away from the Daedric cultists (what a tale that was!), he read an excerpt from his new book, Narsis Dren and the Lost Ruins of Salinvord. I can't wait to get a copy and see how he escaped from the atronachs! I must sound like a unbloodied cub before her first battle, but I can't help it. He's so … intense!"
"219317028-0-525";"How embarrassing! I can't believe I looked up to that skeever! After his talk, I went up to Narsis Dren and asked him to sign a copy of his book, Dungeon-Delving Secrets. He said, ""Sure, right after you come to my room and examine my artifact."" You know, for a famous adventurer, he dropped like a sack of rabbit meatballs when I hit him."
"219317028-0-526";"Hi. It's me. Valinka. Sorry about going on and on about Narsis Dren. Turns out, he's just like most of the stupid males I've ever met and not a hero or anything. I'm not opposed to a good romp in the hay, so to speak, but a woman likes to be won over, you know? Like in those poems by Fjokki the Bard? Anyway, here's your shipment."
"219317028-0-527";"Valinka has a new mission in life. I plan to become an even greater dungeon explorer than that diseased skeever, Narsis Dren. And I may have a lead on just the dungeon to explore. Turns out, Dren dropped a scrap of parchment when I socked him in the nose. I didn't notice it, but Plucky picked it up and brought it to me. It's a map!"
"219317028-0-528";"Even hear of a place called Bthunzel? Neither did I. But that's where this map that Narsis Dren dropped seems to be pointing. And it's covered with notes like ""Dwarven ruin?"" ""Never explored!"" and ""Treasure?"" Needless to say, Valinka is one excited horker. But I promise to fulfill the terms of our contract—no matter how famous I may become."
"219317028-0-529";"While purchasing supplies in a small town—the closest town to the spot marked on Dren's map—I accidentally mentioned that I was a relic hunter of some renown. A small exaggeration, I grant you, but I was anxious and excited. But now I think I'm being followed! I sure am glad I have Plucky with me. He's such a good dog! Oh, enjoy the shipment!"
"219317028-0-530";"I hope this shipment of components finds you well. I continue to travel toward the ruins of Bthunzel, intent on reaching the place as soon as I can. As for thinking that I was being followed, it must have been a false alarm. I haven't seen any sign of cultists or bandits since I left the town. Plucky, however, continues to seem ill at ease."
"219317028-0-531";"The oddest thing happened. I was just settling into my camp for the night—after a fine day of gathering components for your use, I might add—when Plucky started barking and ran off into the darkness. As I write this, he still hasn't returned. I feel like a horker waiting for the butcher's cleaver. But he's probably just chasing a rabbit, right?"
"219317028-0-532";"Oh, patron, what should I do? I woke up to find a note pinned to the tree above my sleeping mat. ""We have your dog,"" it says. ""If you want to see him alive again, tell us the location of the ruins."" And it was signed by Narsis Dren's infamous nemesis, Morella the Cruel. Oh, what should I do? By the way, your components are included."
"219317028-0-533";"I am not ready to have a nemesis of my own! Especially not one powerful enough to threaten the mighty Narsis Dren for so many years. Still, Plucky needs me. He's a good dog and he doesn't deserve to be left in the hands of the evil Morella the Cruel. Excuse the quality of this shipment, but as you can see I have a lot on my mind of late."
"219317028-0-534";"The clearing near the river is a perfect place to stage an ambush. I know I'm walking into a trap, but what choice do I have? I have to try to save Plucky from the villainous Morella the Cruel. But my parents didn't raise a milk-drinker. I have a plan of my own. I'll tell you all about it. Next time. Wish me luck!"
"219317028-0-535";"Remember the time I punched the mammoth? I learned a valuable lesson that day—mammoths love mead-soaked fruit balls! As it happens, I'm carrying a pouch full of the delicious sweets at this very moment. And that gives me an idea for how to approach my meeting with Morella the Cruel. Oh, and more components are included with this missive."
"219317028-0-536";"I entered the clearing cautiously. Plucky was tied to a stake, growling at the woman beside him. She wasn't as tall as me, but for a Breton lass she was taller than average. By her manner and her impeccable outfit, I knew she was Morella the Cruel. There were six thugs with her. ""I hope you plan to cooperate,"" she said, tugging on Plucky's tether."
"219317028-0-537";"Valinka here. Please find another shipment of components included with this letter. And in case you were getting anxious about it, Plucky is back with me, all safe and sound. Now that the suspense is out of the way, let me tell you what happened. But next time. We're still trying to put some distance between ourselves and Morella's gang."
"219317028-0-538";"So there I was, in the clearing facing down Morella the Cruel and her gang of thugs. I want to tell you how I said something witty, dispatched the evil-doers, and rescued Plucky. What actually happened was a lot more chaotic. And it all started when I tossed the pouch with the remaining mead-soaked fruit balls to Morella."
"219317028-0-539";"Morella the Cruel caught the pouch of mead-soaked fruit balls. The look on her face told me it was reflex and not a desire for one of the luscious treats that drove her dexterity. As the ground began to shake and Morella's eyes went wide with panic, I quickly grabbed Plucky's leash and ran from the clearing. That's when the mammoth arrived."
"219317028-0-540";"Getting a mammoth to follow you isn't as hard as you might imagine. Since they share a particular fondness for mead-soaked fruit balls with Nords, I'm surprised more of us don't have a line of the giant beasts tagging along behind us. Of course, a hungry mammoth was the last thing Morella the Cruel expected to charge into the clearing that day."
"219317028-0-541";"Plucky and I watched from the tree line as the mammoth trampled through the clearing, trying to get to the mead-soaked fruit balls I tossed to Morella the Cruel. We stayed just long enough to make sure Morella and her gang were fully engaged, then we ran as fast as we could. I guess Bthunzel will have to wait until things calm down."
"219317028-0-542";"Another town, another tavern. A letter caught up with me when I arrived. From my brother, Olgath. He never could put two sentences together, so the meaning of the missive wasn't perfectly clear. But I got the intent. He wants me to come home to attend some sort of celebration. Don't worry. This won't affect the shipment of your components."
"219317028-0-543";"What a pain in the arse! I just want to find a fast way to travel back home but I run into obstacles at every turn! Did you ever try to get a portal from those stuffed robes in the Mages Guild? They charge a small fortune if you aren't one of their milk-drinking band of book readers! I guess I'll just have to keep looking."
"219317028-0-544";"A Khajiit trader! Such wonders I've seen since accepting your contract. And he's even willing to allow me to travel with his caravan—all the way back home. If all goes well, I should arrive in time to attend the celebration, even though I couldn't tell from Olgath's letter what we're celebrating."
"219317028-0-545";"Yadus the Khajiit trader tells such wonderful stories. I never know how much to believe, but they're always amusing and he seems so sincere. He also appears quite fond of Plucky and the two definitely enjoy each other's company. I also made a number of connections that should keep you stocked with components for some time to come. You're welcome!"
"219317028-0-546";"I got to see a trade caravan in operation. From procuring goods at one location, to selling goods at another, these lessons will prove invaluable in expanding my own procurement services. I'm not sure about dealing with the general public, though. Yadus never gets angry, no matter how a customer behaves—while I just want to hit most of them."
"219317028-0-547";"Plucky and I said our farewells to Yadus the Khajiit trader today. It was with more than a touch of sadness that we parted ways, but at least I'm back in Skyrim. As promised, here's another shipment of components. Now I need to find my brothers and figure out why it was so important I drop everything and return home."
"219317028-0-548";"By all the snow in the Nine Holds, I can't believe what my brothers have done to me! Do you know why they called me home? Do you know what we're celebrating? My marriage! Oblivion take the horkers, I don't want to get married! I'm just furious about this! Oh, and here are your components."
"219317028-0-549";"I seriously want to crack skulls together! In order to settle a debt my foolish brothers have accumulated in my absence, they decided to marry me to old Thorgrim Wartnose. They think to sell me as so much cattle? Well, think again! And Olgath gave the amulet of Mara to me! My brother! It wasn't even presented properly—not that it matters, anyway."
"219317028-0-550";"Dear patron. I am not some commodity to be auctioned off to the highest bidder. If and when I decide to accept the amulet of Mara and enter into marriage, it will be of a time and place of my choosing—and with someone I desire. It will certainly NOT be with old Thorgrim Wartnose! Now to tell my brothers what they can do with their ""celebration."""
"219317028-0-551";"Another typical family reunion for the Stoneheavers. It involved a lot of yelling, three separate altercations, plenty of bruises, a few broken bones, and gallons of mead. Great times! I love these get-togethers! And I think I got my point across. Olgath will have to figure out another way to clear his debts, because I'm not getting married today."
"219317028-0-552";"So I didn't marry old Thorgrim, but the celebration wasn't a total loss. We got to talking, and one thing led to another, and … well, I let him show me his artifact, if you catch my meaning. Hey, I'm a healthy Nord woman. I'm young and I have … needs. And the poor old horker isn't all bad. Your components are included."
"219317028-0-553";"Dear patron. Plucky and I are back on the road, following up on some component source leads I gathered while traveling with Yadus the trader. I may even head back toward Bthunzel, provided I don't run into Morella the Cruel and her gang again. I'm feeling refreshed and rejuvenated and ready to go!"
"219317028-0-554";"I came across an odd sight in the wilderness today. A circle of stones stood in an otherwise empty clearing, and strange runes were inscribed on the ground. It was eerily silent in the clearing, but also surprisingly peaceful. Plucky refused to approach the circle, but I decided to sit within it and take a short rest."
"219317028-0-555";"Not much to say today. I'm just sitting in this circle of stones, taking a short rest. I think I hear Plucky barking, but he sounds so very far away."
"219317028-0-556";"I must have dozed off. When I woke up, I was still sitting in the circle of stones, but someone was kind enough to leave a mug of some kind of liquid in the circle with me. How nice of them! I hope it's mead. I suddenly realized I have a powerful thirst. But why is Plucky still barking at me?"
"219317028-0-557";"Bad dog, Plucky! Bad dog! He leaped into the circle of stones and knocked the mug from my hand before I could take so much as a sip of the sweet-smelling liquid. Well, that's interesting. The spilled liquid sizzles and steams as it melts strange patterns in the ground. Perhaps Plucky is a good dog after all."
"219317028-0-558";"It took some effort and a few not-so-gentle nips from Plucky's sharp teeth, but I finally stumbled out of the circle of stones. The place cast some sort of spell over me, but now that I'm outside the circle I can already feel the fog lifting from my mind. It's time to leave this place—and find a worthy treat for Plucky!"
"219317028-0-559";"Dear patron. Forgive my tardiness and the tone of my last few letters. Obviously, I was not myself due to the spell cast by that strange circle of stones. I promise I'll be more careful in the future. Please find the components I've included with this message."
"219317028-0-560";"I met the most interesting Argonian. A traveling alchemist, Aleet-Uka. I encountered him on the road, beside his small cart with its potions and reagents. We got to talking and realized we were heading in the same direction, so he invited me to accompany him. After that incident with the circle of stones, I find the lizard's presence comforting."
"219317028-0-561";"Aleet-Uka enjoys showing off his alchemy expertise. He mixed together some foul-smelling components and handed me the concoction. He was extremely pleased with himself, explaining that when poured into an alcoholic beverage, the potion would prevent the imbiber from getting drunk. Really? What's the point of that? Oh. I hurt Aleet's feelings."
"219317028-0-562";"For a creature one step removed from a pair of boots, Aleet-Uka's feelings are easily bruised. I spend most of my time trying to make up for the latest innocent remark I uttered that sent the poor alchemist into a deep depression. Perhaps I should just accept his worthless potions without offering any opinions. But where's the fun in that?"
"219317028-0-563";"I have to admit, Aleet-Uka's latest potion might actually serve a useful purpose. He said he was trying to craft an elixir of flight so that he could soar above the mountain peaks. Instead, the potion seems to attract birds to the imbiber. We ate well after all those wild geese perched upon Aleet's head and shoulders. Easiest hunt I ever had!"
"219317028-0-564";"With a tinge of regret, I bid farewell to the alchemist Aleet-Uka today. He decided to continue on, while I needed to see a man about a rumor in the little village on the hill. Turns out, he may have a lead on another ruin I can investigate. In the meantime, enjoy this shipment of components!"
"219317028-0-565";"On the way to the village on the hill, Plucky decided to run off and chase a rabbit. Stupid dog thinks that if he catches the rabbit, it will magically give him rabbit meatballs—cooked and ready to eat! If only that were true. Maybe if we catch a few of the long-eared creatures, I can find a cook in town who knows how to prepare the delicacy."
"219317028-0-566";"I followed Plucky as he chased the rabbit, but a strange noise ahead gave me pause. I drew my weapon and approached, using what cover I could to conceal my presence. From my hiding place, I saw a sight that made my blood run cold. Daedric cultists! Three robed figures tossed nets over both Plucky and the rabbit. And the day had started so well."
"219317028-0-567";"How do I get myself into these situations? Now I have to save Plucky and his rabbit from a trio of Daedric cultists who are preparing to begin some kind of ritual. And Plucky and the rabbit are the main components in the foul ceremony! Think, Valinka, think! There has to be something—wait, Aleet's potion! I have an idea …."
"219317028-0-568";"Oh, patron! You should have seen the cultists' faces as I came storming into their camp with a flock of birds. Aleet's potion worked amazingly well, attracting winged creatures of all shapes and sizes. They surrounded me like a cloud of wings and talons—like the fury of Kyne herself burst upon them! Now if I had only planned my next move."
"219317028-0-569";"I charged the cultists, surrounded by all manner of birds attracted to me after I drank Aleet's potion. Now we stared at each other, the cultists confused and nervous, me unsure how best to proceed with my daring plan to rescue Plucky and the rabbit. My moment of surprise was quickly evaporating, but I didn't have a clue as to what to do next."
