"Location";"Source"
"265851556-0-3831";"The time to confront Vox has arrived—but it seems that to defeat her, I need to die by her hammer. The Blessing of Veloth should protect me, but can I return from the dead?"
"265851556-0-3837";"With Tanval's help, we've lowered the final ward guarding the prison of Sadal, the Brother of Strife. The mages who originally imprisoned Sadal linger on the Tormented Spire as spirits, angered by Tanval's ritual."
"265851556-0-3838";"Priest Dilyne asked me to close the Daedric portals that Vox opened within the shrine. All kinds of vile creatures are emerging from these blasphemous wounds in the world."
"265851556-0-3840";"Shadowfen's Vicecanon Hrondar sent Saervild Steel-Wind to Bogmother's ruins to collect Argonian relics."
"265851556-0-3841";"I discovered a battered Dwarven construct that seems to have killed its Imperial caretaker. The Imperial's notes imply that they are searching for something within the Dwemer ruin at <<1>>."
"265851556-0-3845";"The vicecanons tracked an ancient keystone to <<1>>. This artifact would be a major boon to Pact forces in <<2>>. However, the prisoners seem unwilling to negotiate directly with the vicecanons."
"265851556-0-3846";"The keystone is located within the White Rose Prison Dungeon. I've agreed to find it and use it to free the prisoners here."
"265851556-0-3847";"<<1>>, a former prisoner of White Rose Prison, is dead, but her grieving spirit lingers on."
"265851556-0-3849";"<<1>> believes his mother's remains lie in <<2>>, away from the swamp waters. Her spirit is unable to return to the Hist."
"265851556-0-3850";"I've encountered a Covenant scout named <<1>> in <<2>>. She was captured by Imperials and has asked for my aid."
"265851556-0-3852";"The Forlorn One asked me to use the decanter of holy water to rescue two people trapped by the fires."
"265851556-0-3854";"While attempting to test a new spell, <<1>> transformed his brother, Dithis, into a female Goblin. The Goblin lass has been kidnapped by a local Goblin warlord named <<2>>."
"265851556-0-3855";"<<1>> believes the spirit of a long-dead mage may know the secret to imprisoning Balreth again. An Argonian scout named <<2>> has already left for Othrenis."
"265851556-0-3856";"The Guildmaster of the Fighters Guild wants me to perform a task for her."
"265851556-0-3858";"Sees-All-Colors has had Doshia's journal translated. From it she believes she may have discovered information relating to the mysterious Mortuum Vivicus."
"265851556-0-3860";"A shady character named <<1>> contacted me at Davon's Watch. He said we could both profit if I ""procured"" a rare and expensive bottle of wine for him."
"265851556-0-3863";"<<1>> turned up again in Ebonheart looking to collaborate on another ""business venture."" He wants me to procure a bottle of <<2>> from an innkeeper."
"265851556-0-3864";"Sibling explorers Raynor and Kireth Vanos are investigating the Dwarven ruins of Bthanual."
"265851556-0-3865";"The wilderness of Stonefalls is filled with predators and hostile creatures. The citizens of the region would sleep better knowing the worst ones are dead."
"265851556-0-3868";"I've accomplished great deeds with Tanval Indoril, <<1>>, and Walks-in-Ash. We've returned Tanval's Vanguard to the Ebonheart Pact, and convinced the spirits of Tormented Spire to open Sadal's prison."
"265851556-0-3872";"This is the Talking Quest.  The purpose of this quest is to talk to people and things, to  make sure the conversation system is still working.  Tally-ho!"
"265851556-0-3874";"A Dwarven device fills a chamber deep within the ruins of Bthanual. Kireth has repaired it. Beams of light now shine through prisms set around the room."
"265851556-0-3880";"The Ordinators are outnumbered. They asked me to reduce Vox's forces to help even things up a bit."
"265851556-0-3885";"Guildmaster Sees-All-Colors has plans to make use of the crystal and tome we found in the depths of Mzeneldt."
"265851556-0-3886";"I purchased a strange statue from an Ashlander merchant in the wilderness. It may be a religious fetish."
"265851556-0-3888";"Researchers seeking ancient relics around the xanmeers found Renrijra pirates camped in the Argonian ruins they were planning to search."
"265851556-0-3889";"The artifacts buried beneath Sunscale Strand are dangerous. <<1>> warns that we may have trouble with them. I need to be careful when searching the ruins."
"265851556-0-3890";"I left the ancient Argonian ruins with a single Fang of Sithis. According to <<1>>, the Renrijra pirates are in an uproar. They may be feeling the effects of the other Fang in their midst."
"265851556-0-3893";"Deshaan's Academy of Magic, Shad Astula, trains only the most promising mages to become leaders of the Ebonheart Pact. However, the Academy only accepts those who've received a special invitation."
"265851556-0-3896";"I met a Dunmer named <<1>> in Apocrypha's Gate. He's a devotee of Hermaeus Mora. He and his fellows were attacked by rival cultists of Mehrunes Dagon, and their sanctum was put to the torch."
"265851556-0-3898";"The Council of Province Generals has ordered an investigation into the death of the former Guildmaster, Jofnir Iceblade."
"265851556-0-3900";"Dominion troops invaded <<1>>'s village, trapping her husband and the other villagers. Whatever the soldiers are doing in <<2>>, they must be stopped."
"265851556-0-3902";"I met a Dark Elf named Telbaril in a pocket of Evergloam known as Crow's Wood. He's trying to find his missing father, Rulantaril. He asked for my help."
"265851556-0-3903";"Arch-Mage Valeyn believes I'm here to help protect the Academy against some unnamed threat. While he determines what this threat is, he asked me to help him with another matter."
"265851556-0-3904";"Aamela Rethandus needs healing supplies to treat Selfora's wounded."
"265851556-0-3905";"<<1>>'s husband <<2>> won't speak since his ordeal with the Dominion. I must find a way to heal him."
"265851556-0-3907";"The Dark Brotherhood has given me a contract."
"265851556-0-3908";"Arch-Mage Valeyn thinks his visions are somehow connected to the evil Magistrix Vox. Unfortunately, before he could learn more, something blocked his magic."
"265851556-0-3909";"<<1>> tracked the Dominion's movement to <<2>>, where she hopes to end the Dominion invasion of Shadowfen."
"265851556-0-3910";"<<1>> asked me to retreive <<A:2>> from <<3>>, the architect of the Dominion invasion in Shadowfen."
"265851556-0-3911";"<<1>> is one of the few surviving prisoners from the Dominion's march into Loriasel."
"265851556-0-3912";"After picking up an ancient sword in <<1>>, I learned an Ayleid knight's spirit haunts the ruins."
"265851556-0-3914";"<<1>> asked me to find his son who hasn't returned to the village."
"265851556-0-3915";"A talking crow claims to represent the Blackfeather Court. It says I must pay a toll to pass safely through the court's domain."
"265851556-0-3916";"A high-ranking member of the Mages Guild, <<1>> wants me to perform a task for her."
"265851556-0-3917";"Nojaxia wants to join the Mages Guild in Ebonheart. She's trying to create an elixir that replicates the visions an Argonian receives after licking a Hist Tree."
"265851556-0-3918";"Sheogorath's book is supposed to lead me to the next trial, the ""<<1>>."" Let's see what the Mad God has planned for me this time."
"265851556-0-3919";"I've traveled to Shor's Stone, which is under attack by Reachmen. The Companions and Pact military have marshaled a defense."
"265851556-0-3920";"I've breached the barrier to the mine beneath Shor's Stone. The Reachmen have assaulted the foreman and his crew. I need to find the foreman, Gandis, and figure out what the Reachmen are doing here."
"265851556-0-3921";"Some of the miners beneath Shor's Stone still live!"
"265851556-0-3923";"The residents of Treva's Farm have fled. A Worm Cult attack drew the attention of nearby giants. The besieged farmers ran for their lives."
"265851556-0-3924";"The sky over the bardic college of Skald's Retreat is something out of nightmares, and monsters stalk its paths."
"265851556-0-3925";"There are tomes scattered across the islands of Skald's Retreat that all have something to do with Vaermina."
"265851556-0-3927";"The city of Riften has been devastated by Sinmur's assault. The town guard is overwhelmed trying to help all the refugees. They're asking everyone to help with the recovery effort."
"265851556-0-3928";"The military has tracked Stral Blackthroat, the leader of the Reachmen, to Vernim Wood. When they arrived, they found Worm Cultists performing dark rituals with his warriors."
"265851556-0-3929";"The Crystal of Power has been stolen and shattered, and  Geoffroi wants me to help him retrieve it."
"265851556-0-3930";"I'm helping Geoffroi restore his Crystal of Power. The Supernal Dreamers have stolen and shattered his Crystal of Power into five pieces."
"265851556-0-3931";"I met a noble, B. Stower, who's power crystal was stolen by the Supernal Dreamers and broken in 5 shards."
"265851556-0-3932";"Julian Kalere told me that Supernal Dreamers have stolen his Crystal of Power and shattered it into five shards. They plan to use the shards as foci for Daedric summoning rituals."
"265851556-0-3933";"Distraught noble Geoffroi's antique crystal was stolen by Supernal Dreamers and split it into shards for their Daedric rituals."
"265851556-0-3937";"Geoffroi's son has been kidnapped by Supernal Dreamers. I need to make sure he gets back safely."
"265851556-0-3938";"I'm helping a young man escape from captivity. The Dreamers have chained him in a cage."
"265851556-0-3939";"I found a guy tied up in a cage. He wanted to be free."
"265851556-0-3940";"I met a prisoner held by the Supernal Dreamers, who asked that I set him free."
"265851556-0-3941";"I guess I should let this guy go."
"265851556-0-3942";"Marcus has told me that he was captured by Supernal Dreamers. I have freed him."
"265851556-0-3944";"Kidnapped Guy has been kidnapped."
"265851556-0-3945";"Geoffroi wants me to murder the leader of the supernal dreamers."
"265851556-0-3946";"Julia Kalere has told me that I must kill the Twilight Boss to put an end to this madness."
"265851556-0-3947";"Geoffroi has asked me to kill Remelie Frinck, the Fire Mage leading the Supernal Dreamers."
"265851556-0-3948";"After retrieving the crystal shards, <<1>> wants me to defeat the leader of the Supernal Dreamers."
"265851556-0-3949";"Geoffroi has asked me to kill Remelie, the leader of the cultists. This should send them fleeing back to Stormhaven. She should be near one of the Dreamer camps."
"265851556-0-3951";"I need to kill the Beast to stop the Dreamers once and for all."
"265851556-0-3952";"Troggg has discovered that it was his brother, Clogg, who stole the bongos."
"265851556-0-3953";"I've been tasked with finding another book for the Mages Guild. Once again I need to return to the Shivering Isles, to a place called the Chateau of the Ravenous Rodent."
"265851556-0-3955";"The mysterious operative called Naryu has been investigating the evidence I discovered at the Maulborn camp."
"265851556-0-3956";"Varon asked me to travel to Mournhold. I should inform the Ordinators about the events at the Obsidian Gorge."
"265851556-0-3957";"The Reachmen are being magically augmented by the Worm Cult. They must be stopped."
"265851556-0-3958";"Maulborn cultists are causing trouble throughout Deshaan. Quarantine Serk was only the beginning. A House Hlaalu guard asked me to take word of what happened to Narsis, a town south of the Serk."
"265851556-0-3959";"Boulderfall Pass has been attacked by Sinmur and the Reachmen. The soldiers defending this area need my help."
"265851556-0-3961";"A dying soldier named <<1>> has asked me to avenge his death."
"265851556-0-3963";"In the wake on an Imperial attack, homes are on fire and Daedric creatures are shambling through the village."
"265851556-0-3964";"I met a Redguard named Paldeen, held prisoner by the Khajiit bandits in the Lost City of the Na-Totambu. He asked for my help in opening the sealed inner chamber."
"265851556-0-3966";"Magister Vox stole an item of power from the Tribunal Temple—the hammer known as Veloth's Judgment. She fled east, away from Mournhold. Almalexia asked me to track her down before she gains the full power of the artifact."
"265851556-0-3968";"Our final goal at Vernim must be to kill Stral and end the threat of the Reachmen. Unfortunately he's protected by a death shroud in the central ruin."
"265851556-0-3970";"I found a letter on a dead man named Tavo in the Lost City of the Na-Totambu. His wife, Nahrina, wanted him to recover some Yokudan relics  and return to Sentinel to pay off a debt. I can recover the relics in his stead."
"265851556-0-3973";"The Fighters Guild has sentenced <<1>> to death for the murder of <<2>>."
"265851556-0-3974";"The Reachmen attacked Shor's Stone and brought the giant Sinmur back to life. Now they've overrun Fallowstone Hall, an ancient seat of the Companions. Vigrod wants my help regaining the Hall."
"265851556-0-3977";"A scout sent by Centurion Gjakil has found me near Fallowstone Hall. The scout reports Reachmen movement near <<1>>."
"265851556-0-3978";"Netapatuu and his colleagues came to Pinepeak Caverns to consult with the spirit of Hakra, one of Ysgramor's Companions. Worm Cultists attacked and drove them out. The cultists cannot be allowed to gain control of Hakra's spirit."
"265851556-0-3980";"A researcher named Nila feels terrible about her colleague's capture. The Worm Cult was torturing him at the far end of the cavern."
"265851556-0-3981";"Netapatuu fears the Worm Cult may try to enslave Valdur's spirit, much as they tried with Hakra's."
"265851556-0-3982";"<<1>>, an agent of the Vicecanons, asked me to join the expedition to <<2>>. They'll be searching for Argonian relics."
"265851556-0-3984";"I'd been told previously Ulrich, a former Lion Guard soldier, died at the hands of the cultists. <<1>> believes he may actually be imprisoned somewhere within Silaseli instead."
"265851556-0-3985";"I've encountered a wounded hunter in the wilds near Bleakrock Village. <<1>> is seriously wounded. He wants some help killing his prey."
"265851556-0-3986";"A strange woman came up to me as I was walking through the woods. She said something about skeevers before leading me into the hills."
"265851556-0-3987";"I met up with Seyne near Hozzin's Folly. Bandits have landed on the island. They're exploring an abandoned mine that was once home to Daedra worshipers."
"265851556-0-3988";"I found a Fighters Guild camp where an Argonian soldier is recovering from a fierce battle with spiders."
"265851556-0-3991";"The Daggerfall Covenant has assaulted Bleakrock Village. Captain Rana sent the surviving refugees to Last Rest, a tomb near the town. Rana and I must clear a path through the tomb for the refugees."
"265851556-0-3992";"I caught up with Darj near Skyshroud Barrow. Skeletons attacked and wounded him before he could find a way to get its door open."
"265851556-0-3993";"I met a group of Dark Elves in the Fungal Grotto. They want to reach a shrine within the caves. A tribe of hostile Goblins occupies most of the area, pushing out a colony of dreugh. The two fighting sides block access to the rest of the cave."
"265851556-0-3995";"Rolunda came to Orkey's Hollow looking for her brother, Eiman. The cave is said to be haunted, and young Nords on the island sometimes enter it to prove their bravery. Eiman went in, but he hasn't come out."
"265851556-0-3996";"I found a note on a dead bandit. Their leader, a man named Oath-Breaker, has orders to capture villagers, so he can trade them for supplies."
"265851556-0-3997";"Valaste and Shalidor have finished analysis of Sheogorath's books. Now I need to help them take possession of Eyevea, the Mages Guild Sanctuary."
"265851556-0-3999";"<<1>> has lost track of her husband and her dog. I've offered to help her look for both of them."
"265851556-0-4002";"I've helped the community leaders of Bleakrock Village. Rana's preparing the villagers to evacuate."
"265851556-0-4016";"I found evidence that the Daggerfall Covenant may soon attack Bleakrock and the rest of the Pact. We need to evacuate as soon as possible, but anyone who doesn't rally to the village will be left behind."
"265851556-0-4018";"Giants have attacked the village of Lower Yorgrim, destroying everything in their path."
"265851556-0-4022";"The Covenant sent an advance force into Bal Foyen. They're destroying the fields behind Dhalmora."
"265851556-0-4023";"We've landed safely. Captain Rana is going to muster the remaining Bleakrock villagers and the people of Dhalmora. She wants me to ensure the fires are lit in the nearby watchtower so we can warn Davon's Watch, the port city in Stonefalls."
"265851556-0-4024";"An Argonian named <<1>> lost most of his guar herd. They were spooked by scary noises in the fields behind Dhalmora. He wants me to collect the missing ones."
"265851556-0-4026";"I've made my decision. I'm standing with <<1>> and defending Fort Zeren."
"265851556-0-4028";"The Daggerfall Covenant has seized control of Foyen Docks. An injured Argonian fisherman saw Rana fighting through their ranks."
"265851556-0-4030";"I met two Nord soldiers near the shrine of Kynesgrove. They claim that the shrine has been taken over by evil witches and that the rest of their brigade never returned from the shrine. Now they just wait, afraid to enter the shrine."
"265851556-0-4034";"Stormfist soldiers ransacked Voljar's Meadery and slaughtered the family—all because they wanted free mead. Haraldar's wife was one of the Voljars killed in the attack. He wants to reopen the meadery, and he recruited his four brothers to help."
"265851556-0-4037";"Yraldar Snowpeak was wounded trying to drive the Stormfist soldiers away from the meadery. He wants their leader, an Orc named Kazok, dead and his head on a pike. He asked for my help."
"265851556-0-4038";"<<1>> thinks he's found a way to use the otherwise docile netch against the Daggerfall Covenant."
"265851556-0-4041";"I returned to Dhalmora. All of the Bleakrock villagers are gone. Aera informed me of a large Covenant attack on Bal Foyen. Darj has lead some of the non-combatants to Fort Zeren. Captain Rana is leading a defense of the docks."
"265851556-0-4043";"After giants and wolves overran the village of Lower Yorgrim, the survivors found shelter in a tiny fishing camp outside the village walls."
"265851556-0-4048";"<<1>> says that Shadowed Path cultists have taken over Haynote Cave, north of Vlastarus."
"265851556-0-4051";"I should head to Davon's Watch, so I can ensure the troops have been warned about the Covenant."
"265851556-0-4052";"Nisin Cave is now a danger to Vlastarus. Shadowed Path necromancers and a Dremora named <<1>> have taken up residence."
"265851556-0-4054";"Praxin and his comrades from the Fighters Guild explained that spiders infest the Spindleclutch caves. And maybe something else. It whispers in the darkness."
"265851556-0-4055";"The Nord soldier Droi burns with fever from a witch's curse. I need to collect a plant called Kyne's Breath to help reduce his fever."
"265851556-0-4056";"The Keepers of the Kynesgrove shrine have become Daedric witches. The loss of their loved ones to war has made them lash out against Kyne. I need to find a way to resolve this."
"265851556-0-4058";"I arrived in Eastmarch, in the Nord city of Windhelm. The place bustles with revelers as a celebration honoring the Skald-King is underway."
"265851556-0-4059";"Thane Mera has named me the Champion of Windhelm and wants me to enter the Footrace of the Nine Holds."
"265851556-0-4060";"Thane Mera, enraged by the death of the racer Hadring, demands that the assassins pay for this crime. She wants me, Windhelm's Champion, to deal with this—personally."
"265851556-0-4061";"Fildgor, King Jorunn's exiled brother, has returned to Skyrim. Nords from the Stormfist clan, loyal to Fildgor, have infiltrated the Konunleikar to get close to King Jorunn."
"265851556-0-4062";"A renegade clan of Nords known as the Stormfists launched a surprise attack against Fort Morvunskar."
"265851556-0-4065";"<<1>> says a skeleton invaded Vlastarus a few days ago. She thinks it came from a graveyard to the southwest."
"265851556-0-4066";"A giant bear named <<1>> has been attacking travelers near Vlastarus."
"265851556-0-4067";"An Argonian named Bishalus is afraid that nix-hounds have devoured her friend, Gena. She claimed to have made a flute that could tame the beasts, but she has yet to return."
"265851556-0-4068";"Refugees fleeing the war were often preyed upon by bandits. Many of their possessions were stolen on the way to Vlastarus."
"265851556-0-4069";"The Skald-King and the other Ebonheart Pact leaders have established a base at Jorunn's Stand. While the Skald-King recovers, the leaders need to decide how to deal with Fildgor Orcthane."
"265851556-0-4070";"The sentry captain, Ula-Reen, keeps the camp secure. She asked me to help."
"265851556-0-4071";"The orders from Fildgor Orcthane suggest that the Stormfists are after something precious in the royal tomb. The spirit of Queen Nurnhilde and Lieutenant Koruni both asked me to return the relics. While I'm at it, I'll see what else is going on."
"265851556-0-4072";"Rock Bone Goblins have made camp to the northeast of Vlastarus."
"265851556-0-4073";"<<1>>'s family banner has been stolen. He believes it was taken by bandits who visited Vlastarus."
"265851556-0-4074";"To the east of Vlastarus lies Juras Falls, home to the restless undead, including the former Captain Juras."
"265851556-0-4075";"I met a frightened young woman. Her and her friend were attacked by monsters on their way back to Windhelm."
"265851556-0-4076";"The Ebonheart Pact is at war with the Daggerfall Covenant and the Aldmeri Dominion for control of Cyrodiil.\n\nEveryone is needed in the war effort."
"265851556-0-4077";"A Daedric cult called the Supernal Dreamers stole a Crystal of Power from <<1>>.  The cult shattered the Crystal in five <<m:2>> and are using them in Daedric rituals.  <<1>> has asked me to kill the cultists and bring back the shards."
"265851556-0-4078";"The Dark Elves and Argonians are finally willing to work with Prince Irnskar and meet in a council of war. Now the Prince wants me to convince the Eastmarch thanes to attend the war council as well."
"265851556-0-4079";"Flame atronachs are plaguing the Ayleid ruins at <<1>>."
"265851556-0-4080";"I entered a secluded grove near Daggerfall Harbor called Bad Man's Hallows. The people here are engaged in a festival honoring the Bad Man, an ancient harvest god."
"265851556-0-4081";"<<1>> asked me to gather some silver scales for the local artist to use in her next project."
"265851556-0-4083";"The Supernal Dreamers have retaliated against <<1>> for having me steal back his Crystal of Power.  The Daedric cult captured him and threw him into a cage."
"265851556-0-4085";"I've found the temple of the spinners of Malabal Tor, where their ""story"" has gotten away from them."
"265851556-0-4086";"Aspera Giant-Friend says the giants are about to go to war against the Stormfists that hold Cradlecrush because their mammoths were stolen. As long as I oppose the Stormfists, these giants will consider me to be an ally."
"265851556-0-4087";"King Jorunn wants me to make my way to Skuldafn. He wants to deal with Fildgor Orcthane and then bring the rest of the Pact leaders to the ancient dragonshrine."
"265851556-0-4088";"<<1>>, a Wood Elf down in the Bad Man's tunnels, claims he is one of the mages that originally summoned the Dremora Lord now posing as the Bad Man."
"265851556-0-4089";"The Green Lady's sister, <<1>>, may have been kidnapped from <<2>>, a village famous for being the birthplace of several previous incarnations of the Green Lady as well."
"265851556-0-4091";"The Worm Cult invaded Ouze and captured its primary protector, <<1>>."
"265851556-0-4092";"The Worm Cult is trying to enslave the spirits of Ouze."
"265851556-0-4095";"Aspera and the giants are ready to begin the siege of Cradlecrush. Using the documents I recovered from the Stormfist scouts, they formulated a plan of battle."
"265851556-0-4096";"I wandered into Cragwallow, a small settlement used by the Skald-King's royal work crews. After a lot of hard work maintaining the roads, they're preparing to throw a party."
"265851556-0-4099";"Lothgar Steady-Hand was grievously wounded by the creatures that attacked Cragwallow. He appears to be dying."
"265851556-0-4101";"A recent conflict between the Wood Elves and Drublog Orcs of Bloodtoil Valley threatens to end in bloodshed."
"265851556-0-4103";"I found a journal written by a priest of Z'en, which details part of Bloodtoil Valley's history. The local spinner may find this information valuable if I can find the rest of the journals."
"265851556-0-4104";"Raynor and Kireth Vanos, self-proclaimed Dwemer experts, left Morrowind to look for long lost knowledge and lore within Skyrim's Dwarven ruins."
"265851556-0-4105";"Kireth Vanos has been exploring the ruins of Mzulft, looking for a valuable piece of forgotten lore. Her brother Raynor and her plan to use their findings to get invited into either Shad Astula or the Mages Guild."
"265851556-0-4106";"Valeric believes vampires don't have to be monsters. He wants my help to stop his father, Majorn, who plans to create an army of bloodfiends."
"265851556-0-4107";"The Banished Cells have been overrun by Daedra. They have set free the immortal High Kinlord Rilis, an evil being of great magical power. I have agreed to help Keeper Cirion, the warden of the Banished Cells, deal with this crisis."
"265851556-0-4108";"<<1>> offered to tell me the story of the Green Lady and show me the most sacred sites of Deepwoods."
"265851556-0-4111";"Vicious raiders known as the Steel Shrikes attacked a troupe of traveling entertainers. They hold several performers captive at Fuller's Break."
