"Location";"Source"
"265851556-0-6312";"I agreed to retrieve mysterious Akaviri relics from the Tomb of the Serpents so that a messenger named Kiseravi can share their secrets with the world."
"265851556-0-6313";"A vain Khajiit named Sarazi challenged me to kill all the master hunters lurking on Predator Mesa, as well as a feisty gryphon called Quillmane."
"265851556-0-6314";"A Khajiit named Tahara asked me to find an escaped monster called Burtle. She promised to pay me handsomely for its safe return."
"265851556-0-6315";"The moons have begun to align. When the eclipse occurs, the Moon Gate of Anequina will open and grant access to Jode's Core. We need to try to prevent the Dragons from accessing the portal and attaining the power stored there."
"265851556-0-6316";"Travelers in the Weeping Scar are falling prey to an ancient clan of vampires called the Tenarr Zalviit, but I met an exile of this clan named Yushiha, who is determined to stop the bloodshed."
"265851556-0-6317";"Mazdurr the Moonstruck, a Khajiit dedicated to the Daedric Prince Azurah, is trapped by bandits in the caverns of the Tangle. I agreed to help him escape."
"265851556-0-6318";"From ancient Khajiit legends, Zahari has learned that weapons imbued with enchantments powered by Daedric souls are particularly powerful against Dragons. I need to collect these souls to help fight back against the Dragon threat."
"265851556-0-6319";"Iraya and Izanji, two siblings in charge of a museum in Riverhold called the House of Histories, have fallen on hard times after a recent theft. I intend to help them solve this theft and return the missing items."
"265851556-0-6320";"The ancient Khajiiti mural known as the Rithana-di-Renada has been completed, but Iraya feels like something is still missing. Legends say the mural emits some kind of music."
"265851556-0-6321";"Hundreds of Khajiiti undead emerge from the ruins of the Ashen Scar. A mysterious High Elf mage named Vastarie is trying to keep the corpses at bay, but without my help, the waves of undead might overwhelm Elsweyr."
"265851556-0-6322";"An ancient Khajiiti lich named Arum-Khal threatens to emerge from the depths of the Ashen Scar. If Vastarie and I are to have any hope of stopping him, I'll need to learn more about the monastic order he betrayed: The Order of the Hidden Moon."
"265851556-0-6323";"Mazza-Mirri, the last surviving member of the Hidden Moon Order, led me to an enchanted Moonlight Blade. The soul of an ancient Khajiiti warrior resides within. With this enchanted blade, and Vastarie's help, I may be able to stop Arum-Khal."
"265851556-0-6324";"I awoke in Star Haven Adeptorium, home to an order of peaceful Khajiit adepts. It seems that I was asleep for many days, recovering from a devastating Dragon attack."
"265851556-0-6325";"Sweetwater Farmstead in Merryvale seeks workers to replace those that have gone missing. I should investigate this mystery and see if I can help."
"265851556-0-6326";"A young Khajiiti mage named Narama-ko sought my help outside the Abode of Ignominy. Apparently, the notes and memory stones of a powerful mage lie within this crumbling, subterranean temple. She assures me she could put them to good use."
"265851556-0-6328";"Despite our victories and the events on the Plane of Jode, Khamira is not yet officially the queen. Before Khamira can receive the crown of Anequina, she needs to receive the blessing of the Mane."
"265851556-0-6329";"Zahari asked me to help train new recruits for the Khajiit Defense Legion to fight enemies they may not have encountered in training."
"265851556-0-6336";"Battlemage and former Imperial advisor Abnur Tharn summoned me to Northern Elsweyr to help him and the Khajiiti deal with a rage of Dragons."
"265851556-0-6337";"A Redguard warrior, Khud af-Hadajja, requested my help in destroying a Daedric device inside a mysterious doomvault before either the servants of Mephala or Mehrunes Dagon get their hands on it."
"265851556-0-6338";"After learning that Mulaamnir the Dragon considers Euraxia, the usurper queen of Rimmen, to be nothing more than a puppet, Abnur Tharn believes parley is our best course of action—especially considering the current state of the Khajiiti army."
"265851556-0-6339";"Someone's lost an item and needs help finding it."
"265851556-0-6341";"Zahari asked me to help train new recruits for the Khajiit Defense Legion to fight enemies they may not have encountered in training."
"265851556-0-6342";"Zahari asked me to help train new recruits for the Khajiit Defense Legion to fight enemies they may not have encountered in training."
"265851556-0-6343";"Zahari asked me to help train new recruits for the Khajiit Defense Legion to fight enemies they may not have encountered in training."
"265851556-0-6344";"Zahari asked me to help train new recruits for the Khajiit Defense Legion to fight enemies they may not have encountered in training."
"265851556-0-6345";"Dragons have not been seen in Tamriel for generations, and the Khajiit are unsure how best to fight against them. The ancient Nords recorded Dragon fighting techniques on scrolls they keep in their crypts. I need to find these scrolls."
"265851556-0-6346";"Dragons have not been seen in Tamriel for generations, and the Khajiit are unsure how best to fight against them. The ancient Nords recorded Dragon fighting techniques on scrolls they keep in their crypts. I need to find these scrolls."
"265851556-0-6347";"Dragons have not been seen in Tamriel for generations, and the Khajiit are unsure how best to fight against them. The ancient Nords recorded Dragon fighting techniques on scrolls they keep in their crypts. I need to find these scrolls."
"265851556-0-6348";"I found a notice urging me to take up arms in defense of Northern Elsweyr."
"265851556-0-6349";"Chevalier Renald enlisted my aid in stopping his comrade, Grundwulf, from consuming the blood of a Dragon that he's trapped inside a ruined Khajiiti temple with the help of the Hollowfang vampire clan."
"265851556-0-6350";"<<1>> of the Undaunted has challenged me to explore Moongrave Fane."
"265851556-0-6351";"I met a couple of Wood Elves who want to enlist a mage's and a nature spirit's help to kill a Dragon that threatens Elden Root."
"265851556-0-6352";"<<1>> of the Undaunted has challenged me to explore the Lair of Maarselok."
"265851556-0-6353";"Word has spread that the Divine Alkosh has descended to his mountain temple of Sunspire to be the Khajiit's savior in these troubled times."
"265851556-0-6354";"A preacher from Sunspire invited me to travel to the temple to see the god Alkosh incarnate."
"265851556-0-6355";"A Khajiit spirit has awakened from eternal slumber. His descendent Saviwa needs me to find a proper place for the urn in Rimmen Necropolis, so that his ancestor can be at peace, and Saviwa can have some peace and quiet."
"265851556-0-6356";"Nisuzi's Baandari clan needs oil from Darkpool Mine, but a flock of Mehrunes Dagon-worshipers took control of the cavern—blocking access to the oil with hordes of newly summoned Daedra."
"265851556-0-6357";"To combat the Dragon menace, I accepted a contract from Battlereeve Tanerline to kill them at their hunting grounds."
"265851556-0-6358";"A follower of Peryite, the Daedric Prince of Pestilence, has asked me to rescue his friend from the flu-ridden city of Orcrest."
"265851556-0-6359";"Euraxia's troops have descended upon Desert Wind Caverns, scouring the ruins for ancient scrolls. Nisuzi, the Baandari job broker, wants me to claim these texts before the Imperials."
"265851556-0-6360";"The Baandari job broker, Nisuzi, tasked me with finding enchanted charms and talismans in the forbidding Abode of Ignominy."
"265851556-0-6361";"According to Nisuzi, some of Elsweyr's most terrifying beasts stalk Predator Mesa. Hunting these creatures and making blood offerings to the Daedric Prince, Hircine, might earn Nisuzi's clan the favor that they seek."
"265851556-0-6362";"According to the Baandari broker, Nisuzi, ensorcelled relics draw dozens of minotaurs to the Tomb of the Serpents. She asked me to break the enchantment's grip on the tomb so that her clan can return to looting the crypt's Akaviri treasures."
"265851556-0-6363";"Nisuzi's Baandari caravan suffers a tea shortage, but not just any tea will do as a replacement. Apparently, rare Samar tea shrubs grow in the Tangle, and the pekoe leaves they produce are the finest in Tamriel."
"265851556-0-6364";"I found a keg of sweet rotmeth brew. If I return it to its rightful owner, I may receive a reward."
"265851556-0-6365";"I crossed paths with a scoundrel named Jakarn. He invited me to join him on a job that could make us both rich. Unfortunately, some seedy Khajiit are intent on stopping him."
"265851556-0-6366";"A ragged preacher warned me that my wealth and status attract a lot of dangerous attention in Elsweyr, particularly from the folk-hero-turned-god, Rajhin. The preacher solicited me to steal offerings to appease the Khajiit thief-god."
"265851556-0-6370";"I received a voucher for a special-occasion cake from the renowned master baker, Chef Donolon."
"265851556-0-6371";"Rigurt the Brash was sent to Elsweyr to improve relations with the Khajiit, but he's already lost his collection of Nord peace offerings. I agreed to help Rigurt deliver his missing gifts, and complete his diplomatic mission."
"265851556-0-6373";"The Daedric Prince Sheogorath appeared at my alliance's camp in Cyrodiil, promising to show me how to make war more exciting."
"265851556-0-6374";"A Khajiit named <<1>> needs me to burn the wasp nests in his fields and find his lost guar, Gordon."
"265851556-0-6375";"I found a note offering a reward for three mysterious bottles of stolen wine. I should find the bottles and bring them to Hofgrad Kjisorssen in the Stitches to receive the reward."
"265851556-0-6376";"A Goutfang master fled the adeptorium after stealing scrolls and earning the title of pariah. I agreed to help kill the master and return these scrolls."
"265851556-0-6377";"The elderly job broker, Ri'hirr, urged me to defeat Sword Master Vhysradue—a peerless warrior who camps on the Hill of Shattered Swords."
"265851556-0-6378";"An eerily clever terror bird called Wily Kee'va has been harassing sugar traders and devouring their camels near Scar's End. Left unchecked, this beast could bring trade in southwestern Anequina grinding to a halt."
"265851556-0-6379";"An ancient dro-m'Athra called Zalsheem lurks in the ruins of a Hidden Moon shrine south of Predator Mesa. Her corrupting influence will surely spread if I don't act quickly."
"265851556-0-6380";"A powerful necromancer named Na'ruzz the Boneweaver lurks in the Bone Pits—a cursed gulch near Orcrest. His dark influence presents a danger to any Khajiit who strays too close."
"265851556-0-6381";"According to Ri'hirr, a pair of Khajiiti criminals named Akumjhargo and Zav'i bleed Northern Elsweyr dry through a combination of theft, murder, and extortion. Honest trade cannot flourish as long as these lawbreakers remain alive."
"265851556-0-6382";"A Senche-raht necromancer named Thannar the Graveprowler stalks the ruins southwest of Rimmen, urging the corpses buried there to rise from their graves. Left unchecked, his ranks of undead followers could swell."
"265851556-0-6384";"To combat the Dragon menace, I accepted a contract from Battlereeve Tanerline to kill them at their hunting grounds."
"265851556-0-6389";"An Imperial named <<1>> asked me to recover her stolen belongings from a nearby camp of Ruddy Fang bandits."
"265851556-0-6390";"Grand Warlord Dortene has authorized a reward for any Covenant soldier who slays 20 enemy Necromancers."
"265851556-0-6391";"Grand Warlord Zimmeron has authorized a reward for any Pact soldier who slays 20 enemy Necromancers."
"265851556-0-6392";"Grand Warlord Sorcalin has authorized a reward for any Dominion soldier who slays 20 enemy Necromancers."
"265851556-0-6393";"Sai Sahan received a letter from Abnur Tharn. It seems the old battlemage discovered something about a threat to Southern Elsweyr and needs our help."
"265851556-0-6394";"Nahfahlaar knows of a Dragon who may join our alliance, but has no idea where to find him. I need to find Yahgrondu and extend an offer to join us."
"265851556-0-6395";"Blademaster Kasura has agreed to search a nearby Dragonguard tomb for a former student interested in finding some way to fight back against the Dragons in Elsweyr. I agreed to help her in this endeavor."
"265851556-0-6396";"I met the Twilight Cantor, Adara'hai, and her sister, Ka'ishka, in the village of Black Heights. Ka'ishka's husband, Vijari, is terminally ill and needs to perform the last rights of his faith, but something is not right at the Wall of Life."
"265851556-0-6397";"Kaalgrontiid's plan to fulfill the prophecy of the Dark Aeon and become a god continues as he sent his island, Dragonhold, into the sky. Now we need to find a way to reach the island."
"265851556-0-6398";"Sai Sahan and I discovered the location of the Horn of Ja'darri, a powerful Dragonhorn made by the Dragonguard. It awaits us in a Dragon's lair, nestled within a dormant volcano in Southern Elsweyr."
"265851556-0-6399";"Sai Sahan wants me to infiltrate the Dragon cult and learn more about them."
"265851556-0-6400";"A good-hearted scoundrel named Daini wants to rob local bandits of their ill-gotten goods. She means to use their wealth to leave Elsweyr with her brother, but seems intent on settling scores before she departs."
"265851556-0-6401";"A Dragon lairs on a nearby island, and Sai Sahan believes it plans to attack Senchal. I agreed to help Sai sail to the island and slay the beast before it can harm the city."
"265851556-0-6402";"We reformed the Dragonguard and defeated Kaalgrontiid. I should see if there's anything else we need to take care of here in Southern Elsweyr."
"265851556-0-6403";"The Order of the New Moon plans to attack Pridehome, a reclusive temple dedicated to the worship of Alkosh. The Dragonguard is determined to stop the cult's assault and uncover the motives behind the attack."
"265851556-0-6404";"With Ra'khajin defeated and the Mask of Alkosh in our possession, Sai Sahan is determined to defeat Laatvulon once and for all. It's time to make our final stand against the Order of the New Moon."
"265851556-0-6405";"Dirge Truptor tasked me with intercepting a courier for the Order of the New Moon."
"265851556-0-6406";"Dirge Truptor gave me an old bandit map that will supposedly lead me to a lost grave from the Akaviri Invasion."
"265851556-0-6408";"Kidnappers abducted Skordo the Knife, but their caravan fell prey to a Dragon attack. The abductors left the hard-nosed Orc behind, but dragged off two of his companions. Skordo wants to free his friends and put a stop to the kidnappers' schemes."
"265851556-0-6409";"Sai Sahan is reforming the Dragonguard and wants to know if our companions will join us."
"265851556-0-6412";"A band of smugglers have turned the sacred Moonlit Cove into a skooma distillery and poisoned the waters with their shoddy spirits."
"265851556-0-6413";"Zhasim, a Khajiit raised by Orcs in Wrothgar, came to Southern Elsweyr to help his uncle get his shipment of gourmet moon-sugar to market in Rimmen. But Zhasim and his guard Maezi were robbed and his cat Winks ran away."
"265851556-0-6414";"The Skald-King dispatched a party of sword-thanes to investigate unnatural storms swirling around Icereach. Alas, a coven of witches killed most of the warriors. I must venture into the aged keep, kill the witches within, and search for survivors."
"265851556-0-6415";"<<1>> of the Undaunted challenged me to explore Icereach."
"265851556-0-6416";"A mysterious band of necromancers and graverobbers breached the defenses of the Unhallowed Grave. The burial site's last living defender, Shelaria, asked for my help in ridding the tomb of these invaders."
"265851556-0-6417";"<<1>> of the Undaunted has challenged me to explore Unhallowed Grave."
"265851556-0-6418";"A young Imperial named Catina recently lost her mother, Honoria. In the weeks that followed, images of the Forsaken Citadel plagued her dreams. Honoria clearly has unfinished business in the ruined academy, and she needs the living to help settle it."
"265851556-0-6419";"The Senchal job broker, Guybert, urged me to search the Forsaken Citadel for sealed Akaviri tomes."
"265851556-0-6420";"I found a notice urging me to take up arms in defense of Southern Elsweyr."
"265851556-0-6421";"A rogue Goutfang monk trains students in forbidden techniques where a rare herb grows. I agreed to help kill the monk, plus gather herbs to help heal Dragon hunters."
"265851556-0-6422";"A rogue Goutfang master and his students waylaid a supply caravan, stealing all the rice. I agreed to deal with the master and return any rice I find."
"265851556-0-6423";"A territorial guardian watches over a temple of Meridia in Southern Elsweyr. I agreed to help kill the guardian and gather some temple dust."
"265851556-0-6424";"A scholar made an ill-advised trek to a guarded temple. Now I must destroy the temple guardian and gather the scholar's scattered notes."
"265851556-0-6425";"A driver took a dangerous route and died at the hands of a Meridian temple guardian. Now the Shields of Senchal are short on arrows. I agreed to collect arrows and deal with this guardian."
"265851556-0-6427";"I accepted a crafting writ related to the Witches Festival."
"265851556-0-6428";"Dirge Truptor said the New Moon are scheming with a necromancer in the Bone Orchard of Grahtwood."
"265851556-0-6429";"Dirge Truptor informed me that an Akaviri solder was interred in a crypt in Deshaan. He's asked me to search it for secrets of the Dragonguard."
"265851556-0-6430";"Dirge Truptor told me to recover some old Dragonguard scrolls secreted away beneath the Reliquary of Stars."
"265851556-0-6431";"The Senchal job broker, Guybert Flaubert, asked me to travel to the Forsaken Citadel and acquire cursed swords."
"265851556-0-6432";"The Senchal job broker, Guybert Flaubert, urged me to place enchanted candle orbs in the halls of the Forsaken Citadel. According to his client, the candles may help the restless dead that dwell in the Citadel find peace."
"265851556-0-6433";"Dirge Truptor asked me to remove an Order of the New Moon recruiter operating in Stormhaven."
"265851556-0-6434";"Dragons continue to rage across Elsweyr. Chizbari the Chipper charged me with slaying some of these great beasts in the Dragonguard's name."
"265851556-0-6435";"Dragons continue to rage across Elsweyr. Chizbari the Chipper charged me with slaying some of these great beasts in the Dragonguard's name."
"265851556-0-6436";"The Senchal job broker, Guybert Flaubert, has a client who wants some lilies planted in Moonlit Cove as a tribute to her late grandmother."
"265851556-0-6437";"The Senchal job broker wants me to harvest the mushrooms found in Moonlit Cove. The fungus' unique flavor is greatly prized by some Khajiiti cooks."
"265851556-0-6438";"A new form of skooma plagues the coves and alleys of Southern Elsweyr. The Senchal job broker, Guybert Flaubert, urged me to collect blood samples from addicts in Moonlit Cove to help a healer develop a treatment."
"265851556-0-6439";"I accepted a crafting writ related to the Witches Festival."
"265851556-0-6441";"A traveler from Skyrim named Vigwenn Owl-Watcher claims to have the recipe for a secret concoction that allows the imbiber to see the invisible sand-whales of Elsweyr and hear their haunting song."
"265851556-0-6442";"I found a note next to a cat named Tender Claw. I should return him to his owner in Senchal."
"265851556-0-6444";"I accepted a dangerous bounty to kill a Dragon!"
"265851556-0-6445";"I found the body of the Khajiit J'saad along with a letter. I should return the letter to his beloved Adhimba in Black Heights."
"265851556-0-6447";"Nomu and his friends from Murkmire were chased out of the quarry by cultists and now his friends are missing. I promised to try to find them."
"265851556-0-6448";"An herbalist hired me to deliver his product, an herbal remedy, to multiple customers in Senchal. He's being somewhat cryptic, but he offered to pay well if I hurry."
"265851556-0-6449";"I found a lumpy sack abandoned in the wilderness. Its contents seem to be alive."
"265851556-0-6453";"A man named <<1>> recently arrived at the Dragonguard Sanctum, claiming we should be gathering ingredients from Dragon corpses on our hunts."
"265851556-0-6454";"Jorunn the Skald-King requested I meet with his agent to look into a plot that threatens not only Skyrim, but potentially all of Tamriel."
"265851556-0-6455";"I awoke in a cold stone cell after my caravan was attacked on the way into Western Skyrim. I have no clue where I am, but I need to find a way out of here."
"265851556-0-6456";"High King Svargrim refuses to act, so Svana has decided to take matters into her own hands. With Fennorian's help, she plans to develop a strategy for fighting back against the Gray Host."
"265851556-0-6459";"Attacks by unnatural forces plague the area around Morthal. Villagers report undead wolf attacks and visions of ghosts. I should find the source of these attacks and stop them."
"265851556-0-6460";"The Silver Cormorant was hit by a strange ice storm that seemed to come out of nowhere. The ship is locked in ice and unable to move. I offered to help the crew."
"265851556-0-6461";"A sickness is spreading through Dark Moon Grotto that is causing werewolves to act violent and feral. They were close to a cure, but the alchemist working on it, Alchemist Rasir, disappeared. I should investigate to see if the cure can be found."
"265851556-0-6462";"With the high queen's murderer brought to justice and a clear connection established between the assassin and the Icereach Coven, Svana thinks we have enough evidence to convince High King Svargrim that the threat to his kingdom is real."
"265851556-0-6463";"Lyris Titanborn and I uncovered a conspiracy involving the witches of the Icereach Coven. The trail leads to an isolated inn somewhere in the wilds of Eastmarch. We need to determine what the coven has planned before it's too late."
"265851556-0-6464";"High King Svargrim revealed his alliance with the Gray Host and their plans to unleash a harrowstorm over Solitude. I need to help Svana find a way to stop him."
"265851556-0-6465";"A strange storm has devastated the area around Kilkreath Temple. Now the priests of the temple want my help to find the priests and pilgrims that were lost in the storm."
"265851556-0-6466";"The high king has finally taken steps, but it isn't enough. Svana thinks we need to develop a defense against the harrowstorms. To that end, she wants to recruit the vampire scholar, Fennorian, to aid us."
"265851556-0-6467";"When I approached the gates of Solitude, a wounded man stumbled out, fleeing for his life. He left me a bundle of papers and told me to keep them safe before he died."
"265851556-0-6468";"A harrowstorm destroyed the town of Karthwatch and left it overrun with monsters. I agreed to help with the efforts to rescue any survivors."
"265851556-0-6469";"Leiborn, a member of the Bards College, asked me to recover a famous instrument called Petraloop. Apparently, this lute's safe return might help two rival factions in the College reconcile."
"265851556-0-6471";"Miners working in Blackreach have gone missing. Some of the miners believe spirits are to blame, and ghost hunters were hired to investigate. I should look into these disappearances."
"265851556-0-6472";"Gwendis of House Ravenwatch recruited me to help free captives trapped inside Greymoor Keep by Lady Essenia, a cruel vampiric sovereign. Gwendis's friend, Adusa-daro, is among those prisoners."
"265851556-0-6473";"Supplies for the Dragon Bridge Garrison keep mysteriously disappearing, which puts a strain on their operations. I should investigate and see what I can find out."
"265851556-0-6474";"I encountered a wounded High Elf named <<1>> who requested my assistance stopping a Reachmen's ritual in the Shadowgreen that could cause the eruption of the mountain above it."
"265851556-0-6475";"Alwyn Felsdottar has been haunted by visions ever since someone scattered her ancestor's bones and belongings in Midnight Barrow. I promised to help her retrieve his remains to uncover the truth about his past, and allow his spirit to rest again."
"265851556-0-6476";"The Icereach Coven and its allies can call down devastating and unnatural harrowstorms on Western Skyrim. Fennorian thinks these storms can turn people into harrowfiends and mindless harrowed. We need to inform Solitude."
"265851556-0-6480";"A High Elf woman named Telline is worried about her husband, Viggol. He wants to go on one last adventure that involves hunting rumored creatures in the mine."
"265851556-0-6481";"Solitude has survived High King Svargrim's harrowstorm, but the damage done by his betrayal remains. Can Princess Svana pick up the pieces and carry on for the kingdom?"
"265851556-0-6482";"Leiborn intends to host a salskap—a bard's gathering to celebrate the recovery of the Bards College instruments. It's sure to be quite a show."
"265851556-0-6484";"An accident at the Mor Khazgur Stronghold trapped workers inside the mine and caused strange creatures to emerge from below. Any efforts to rescue them have been stalled by infighting and a difference of opinion over the chief's new methods."
"265851556-0-6491";"Hedrynne, sister of Hamvir, has been poisoned by the bite of a giant insect near the cave known as Chillwind Depths. I should see if I can help save her life."
"265851556-0-6492";"I found a notice seeking brave and able-bodied adventurers for work."
"265851556-0-6493";"<<1>>, of the Coterie of Organized Scholars, asked me to help him complete an alchemical tonic that will imbue those who drink it with the strength of Giants."
