"Location";"Source"
"249633428-0-1";"Full access to all DLC game packs — new zones, quests, dungeons and more!"
"249633428-1-1";"Crowns each month to spend in the in-game Crown Store (|c76BCC3Paid Members Only|r)"
"249633428-2-1";"Access to exclusive Crown Store offers and deals (|c76BCC3Paid Members Only|r)"
"249633428-3-1";"Unlimited storage for crafting materials with the Craft Bag"
"249633428-4-1";"Double Bank space for your account"
"249633428-5-1";"10% increase to Experience, Gold, and Archival Fortunes acquisition and Crafting Inspiration & Trait Research rates"
"249633428-6-1";"Double Furnishings and Collectibles space in your homes"
"249633428-7-1";"Double currency cap for Transmutation Crystals"
"249633428-8-1";"Exclusive ability to dye costumes"
