"Location";"Source"
"40552436-0-478";"In the ruins of a fort along the coast."
"40552436-0-479";"Outside the marshy walls of a fort overrun with enemies."
"40552436-0-480";"Behind the statue of a warrior."
"40552436-0-481";"On an island in the sea."
"40552436-0-482";"Where the floating roads sink beneath the water."
"40552436-0-483";"Southeast of where the forgotten tower sits."
"40552436-0-484";"Hidden where specters guard a dead fortress."
"40552436-0-485";"In a place where a misstep leads to a long fall."
"40552436-0-486";"Where the rocks pile high and the trees stand tall."
"40552436-0-487";"By the island where the haj mota prowls."
"40552436-0-488";"In a hidden corridor by the blooming red blossoms."
"40552436-0-489";"On a platform above where the dead and living walk."
"40552436-0-490";"Nestled in the moss where the behemoth stalks."
"40552436-0-491";"High above where the Goblins scheme."
"40552436-0-492";"Watched over by flaming skulls."
"40552436-0-493";"Where spiders creep and birds speak."
"40552436-0-494";"In a cave by the false night's sky."
"40552436-0-495";"In a rocky alcove, guarded by a vicious wamasu."
"40552436-0-496";"Atop a natural bridge cut in half, north of the Raging Coast."
"40552436-0-497";"In a deep pit below a toiling foundry."
"40552436-0-498";"Looming over a small camp in the shadow of Annihilarch's Summit."
"40552436-0-499";"Resting atop the sharp teeth of a dead giant in the Shambles."
"40552436-0-500";"Cradled within an altar inside the Brandfire Reformatory."
"40552436-0-501";"On a ledge overlooking green pools inside False Martyrs' Folly."
"40552436-0-504";"High above the river across from the Firepot."
"40552436-0-505";"Under the middle bridge spanning Loch Abhain."
"40552436-0-506";"By a beach near the bridge on High Isle's southern coast."
"40552436-0-507";"Hidden in the rocks above Jheury's Cove on High Isle."
"40552436-0-508";"Just west of a pointed rock on High Isle's northernmost beach."
"40552436-0-509";"In the shadow of All Flags Castle's north wall."
"40552436-0-510";"Overlooking the volcanic vent north of Tor Draioch."
"40552436-0-511";"In the heart of the river canyon east of Amenos Station."
"40552436-0-512";"On the shore of the Flooded Coast below Snake's Eye View."
"40552436-0-513";"By a bay full of wrecked ships along Skulltooth Coast."
"40552436-0-514";"Follow a climbing path on the southern side of Ghost Haven Bay."
"40552436-0-515";"In the hedge maze of the Spire of the Crimson Coin."
"40552436-0-516";"On a ledge above a pool in the back of Breakwater Cave."
"40552436-0-517";"Guarded by the dead in Death's Valor Keep."
"40552436-0-518";"At one end of a natural bridge in the heart of the Firepot."
"40552436-0-519";"At the end of a winding path high above Shipwreck Shoals."
"40552436-0-520";"By a blue tree within the caverns of Coral Cliffs."
"40552436-0-521";"Hidden high among the rocky ridges of Whalefall."
"40552436-0-522";"Through a lofty tunnel in Glimmertarn, on a balcony with a view."
"40552436-0-523";"Found near a curious bridge made from a large tree near Ivyhame."
"40552436-0-524";"Between two boulders in the hills northwest of Tuinh."
"40552436-0-525";"Southeast of Fauns' Thicket on a bluff, surrounded by rocks."
"40552436-0-526";"Inside Fauns' Thicket, on ruined stairs in the southern cliffs."
"40552436-0-527";"Overlooking the magma pools near the northern tip of Embervine."
"40552436-0-528";"Tickling the palm of a mountainous hand."
"40552436-0-529";"Near an ancient pillar south of Kemel-Ze."
"40552436-0-530";"Near the dock, east of the glass mine."
"40552436-0-531";"Among craggy rocks on the water's edge, north of Tel Dreloth."
"40552436-0-532";"At the foot of the Endless Library's climbing mire."
"40552436-0-533";"On the deck of a ship overlooking the Ichor Sea."
"40552436-0-534";"In a dark corner of the echoing caves that divide Apocrypha."
"40552436-0-535";"Overlooking inky waters betwixt quag and acropolis."
"40552436-0-536";"Atop a stone helix east of the Tormenting Eye."
"40552436-0-537";"Atop a cliff overlooking Chthon Plaza and the Fallen Hues."
"40552436-0-538";"On a platform of ripped and ravaged books in the Underweave."
"40552436-0-539";"On the scaffolding high above Gorne's north-central courtyard."
"40552436-0-540";"Among the eggs of Anchre, beyond a dead and rotting tree."
"40552436-0-541";"Nestled among the highest northern point in a disquiet study."
"40552436-0-542";"In Quires Wind, just beyond the gaze of Mora's searching eye."
"40552436-0-543";"On a prow pointed to the sky, among the ghosts of voyages past."
"40552436-0-544";"Atop the central scaffolding in a Dunmer crime syndicate lair."
"40552436-0-545";"Beyond the central arches, where the Tormenting Eye was shelved."
"40552436-0-546";"On the steps of a vineyard near wildburn's edge."
"40552436-0-547";"Outside the grate upriver of Varen's Watch."
"40552436-0-548";"Overlooking the gorge beside the Skingrad castle bridge."
"40552436-0-549";"Atop an overgrown citadel northwest of Ostumir's ruin."
"40552436-0-550";"Where Ayleids once looked down upon the river Strid."
"40552436-0-551";"Gazing down upon wheat fields from Centurion's Rise."
"40552436-0-552";"Up top on Rock Bottom."
"40552436-0-553";"In the rubble of a collapsed mine in sight of Leftwheal."
"40552436-0-554";"Wedged in a stump at Deserter's Lagoon."
"40552436-0-555";"Tucked in a cave amid the wildburn west of Hoperoot."
"40552436-0-556";"Resting on Silorn treasures down a blind alley in the north."
"40552436-0-557";"In the maw of a mighty skull. Look up in Leftwheal."
"40552436-0-558";"On a platform overlooking the Legion's Rest central cavern."
"40552436-0-559";"On a wildgrown bridge high above a Fyrelight stream."
"40552436-0-560";"Displayed at the end of a hall in Nonungalo's ancient maze."
"40552436-0-561";"Carted to the top of the battlements at Fort Colovia."
"40552436-0-562";"South at Haldain Lumber Camp, beneath Ayleid boughs."
"40552436-0-563";"Pulled to a tower's top near the middle of Varen's Watch."
